sentence,compound,positive,negative,neutral,label,title
"The sailor, observing the heavy surf on the shore, shook his head.",-0.1027,0.0,0.113,0.887,negative,The Mysterious Island
"The engineer had disappeared to the north of the shore, and nearly half a mile from the place where the castaways had landed.",-0.2263,0.0,0.083,0.917,negative,The Mysterious Island
The nearest point of the beach he could reach was thus fully that distance off.,0.0258,0.073,0.0,0.927,neutral,The Mysterious Island
It was then nearly six o'clock.,0.0,0.0,0.0,1.0,neutral,The Mysterious Island
A thick fog made the night very dark.,0.0,0.0,0.0,1.0,neutral,The Mysterious Island
"The castaways proceeded toward the north of the land on which chance had thrown them, an unknown region, the geographical situation of which they could not even guess.",0.25,0.069,0.0,0.931,positive,The Mysterious Island
"They were walking upon a sandy soil, mingled with stones, which appeared destitute of any sort of vegetation.",0.0,0.0,0.0,1.0,neutral,The Mysterious Island
"The ground, very unequal and rough, was in some places perfectly riddled with holes, making walking extremely painful.",-0.1744,0.167,0.235,0.598,negative,The Mysterious Island
"From these holes escaped every minute great birds of clumsy flight, which flew in all directions.",0.6249,0.215,0.0,0.785,positive,The Mysterious Island
"Others, more active, rose in flocks and passed in clouds over their heads.",0.4576,0.2,0.0,0.8,positive,The Mysterious Island
"The sailor thought he recognized gulls and cormorants, whose shrill cries rose above the roaring of the sea.",-0.4019,0.0,0.137,0.863,negative,The Mysterious Island
"From time to time the castaways stopped and shouted, then listened for some response from the ocean, for they thought that if the engineer had landed, and they had been near to the place, they would have heard the barking of the dog Top, even should Harding himself have been unable to give any sign of existence.",-0.0258,0.031,0.032,0.937,neutral,The Mysterious Island
"They stopped to listen, but no sound arose above the roaring of the waves and the dashing of the surf.",-0.5023,0.0,0.191,0.809,negative,The Mysterious Island
"The little band then continued their march forward, searching into every hollow of the shore.",0.0,0.0,0.0,1.0,neutral,The Mysterious Island
"After walking for twenty minutes, the four castaways were suddenly brought to a standstill by the sight of foaming billows close to their feet.",0.0,0.0,0.0,1.0,neutral,The Mysterious Island
The solid ground ended here.,0.1531,0.286,0.0,0.714,positive,The Mysterious Island
They found themselves at the extremity of a sharp point on which the sea broke furiously.,-0.6908,0.0,0.305,0.695,negative,The Mysterious Island
"""It is a promontory,"" said the sailor; ""we must retrace our steps, holding towards the right, and we shall thus gain the mainland.""",0.5267,0.139,0.0,0.861,positive,The Mysterious Island
"""But if he is there,"" said Neb, pointing to the ocean, whose waves shone of a snowy white in the darkness.",-0.3612,0.0,0.116,0.884,negative,The Mysterious Island
"""Well, let us call again,"" and all uniting their voices, they gave a vigorous shout, but there came no reply.",-0.4215,0.0,0.135,0.865,negative,The Mysterious Island
"They waited for a lull, then began again; still no reply.",-0.296,0.0,0.196,0.804,negative,The Mysterious Island
"The castaways accordingly returned, following the opposite side of the promontory, over a soil equally sandy and rugged.",0.0,0.0,0.0,1.0,neutral,The Mysterious Island
"However, Pencroft observed that the shore was more equal, that the ground rose, and he declared that it was joined by a long slope to a hill, whose massive front he thought that he could see looming indistinctly through the mist.",-0.128,0.0,0.038,0.962,negative,The Mysterious Island
"The birds were less numerous on this part of the shore; the sea was also less tumultuous, and they observed that the agitation of the waves was diminished.",-0.25,0.0,0.069,0.931,negative,The Mysterious Island
The noise of the surf was scarcely heard.,0.0,0.0,0.0,1.0,neutral,The Mysterious Island
"This side of the promontory evidently formed a semicircular bay, which the sharp point sheltered from the breakers of the open sea.",0.0,0.0,0.0,1.0,neutral,The Mysterious Island
"But to follow this direction was to go south, exactly opposite to that part of the coast where Harding might have landed.",0.0,0.0,0.0,1.0,neutral,The Mysterious Island
"After a walk of a mile and a half, the shore presented no curve which would permit them to return to the north.",-0.296,0.0,0.104,0.896,negative,The Mysterious Island
"This promontory, of which they had turned the point, must be attached to the mainland.",0.0,0.0,0.0,1.0,neutral,The Mysterious Island
"The castaways, although their strength was nearly exhausted, still marched courageously forward, hoping every moment to meet with a sudden angle which would set them in the first direction.",0.7783,0.26,0.07,0.67,positive,The Mysterious Island
"What was their disappointment, when, after trudging nearly two miles, having reached an elevated point composed of slippery rocks, they found themselves again stopped by the sea.",-0.5859,0.046,0.17,0.784,negative,The Mysterious Island
"""We are on an islet,"" said Pencroft, ""and we have surveyed it from one extremity to the other.""",0.0,0.0,0.0,1.0,neutral,The Mysterious Island
"The sailor was right; they had been thrown, not on a continent, not even on an island, but on an islet which was not more than two miles in length, with even a less breadth.",0.0,0.0,0.0,1.0,neutral,The Mysterious Island
"Was this barren spot the desolate refuge of sea-birds, strewn with stones and destitute of vegetation, attached to a more important archipelago?",0.2716,0.095,0.0,0.905,positive,The Mysterious Island
It was impossible to say.,0.0,0.0,0.0,1.0,neutral,The Mysterious Island
"When the voyagers from their car saw the land through the mist, they had not been able to reconnoiter it sufficiently.",0.0,0.0,0.0,1.0,neutral,The Mysterious Island
"However, Pencroft, accustomed with his sailor eyes to piece through the gloom, was almost certain that he could clearly distinguish in the west confused masses which indicated an elevated coast.",-0.3384,0.124,0.162,0.714,negative,The Mysterious Island
"But they could not in the dark determine whether it was a single island, or connected with others.",0.0,0.0,0.0,1.0,neutral,The Mysterious Island
"They could not leave it either, as the sea surrounded them; they must therefore put off till the next day their search for the engineer, from whom, alas!",-0.3058,0.039,0.081,0.88,negative,The Mysterious Island
not a single cry had reached them to show that he was still in existence.,0.4504,0.248,0.0,0.752,positive,The Mysterious Island
"""The silence of our friend proves nothing,"" said the reporter.",0.4939,0.262,0.0,0.738,positive,The Mysterious Island
"""Perhaps he has fainted or is wounded, and unable to reply directly, so we will not despair.""",0.0,0.0,0.0,1.0,neutral,The Mysterious Island
"The reporter then proposed to light a fire on a point of the islet, which would serve as a signal to the engineer.",-0.34,0.0,0.112,0.888,negative,The Mysterious Island
But they searched in vain for wood or dry brambles; nothing but sand and stones were to be found.,-0.5719,0.0,0.171,0.829,negative,The Mysterious Island
"The grief of Neb and his companions, who were all strongly attached to the intrepid Harding, can be better pictured than described.",0.2023,0.184,0.118,0.699,positive,The Mysterious Island
It was too evident that they were powerless to help him.,-0.128,0.181,0.215,0.604,negative,The Mysterious Island
They must wait with what patience they could for daylight.,0.0,0.0,0.0,1.0,neutral,The Mysterious Island
"Either the engineer had been able to save himself, and had already found a refuge on some point of the coast, or he was lost for ever!",0.2942,0.117,0.077,0.806,positive,The Mysterious Island
The long and painful hours passed by.,-0.4404,0.0,0.326,0.674,negative,The Mysterious Island
The cold was intense.,0.0772,0.302,0.0,0.698,positive,The Mysterious Island
"The castaways suffered cruelly, but they scarcely perceived it.",-0.5423,0.0,0.391,0.609,negative,The Mysterious Island
They did not even think of taking a minute's rest.,0.0,0.0,0.0,1.0,neutral,The Mysterious Island
"Forgetting everything but their chief, hoping or wishing to hope on, they continued to walk up and down on this sterile spot, always returning to its northern point, where they could approach nearest to the scene of the catastrophe.",0.4215,0.194,0.12,0.686,positive,The Mysterious Island
"They listened, they called, and then uniting their voices, they endeavored to raise even a louder shout than before, which would be transmitted to a great distance.",0.6249,0.146,0.0,0.854,positive,The Mysterious Island
"The wind had now fallen almost to a calm, and the noise of the sea began also to subside.",-0.1226,0.099,0.122,0.78,negative,The Mysterious Island
One of Neb's shouts even appeared to produce an echo.,0.0,0.0,0.0,1.0,neutral,The Mysterious Island
"Herbert directed Pencroft's attention to it, adding, ""That proves that there is a coast to the west, at no great distance.""",0.4404,0.169,0.091,0.741,positive,The Mysterious Island
"The sailor nodded; besides, his eyes could not deceive him.",0.3089,0.201,0.0,0.799,positive,The Mysterious Island
"If he had discovered land, however indistinct it might appear, land was sure to be there.",0.3182,0.133,0.0,0.867,positive,The Mysterious Island
"But that distant echo was the only response produced by Neb's shouts, while a heavy gloom hung over all the part east of the island.",-0.7096,0.0,0.176,0.824,negative,The Mysterious Island
"Meanwhile, the sky was clearing little by little.",0.0,0.0,0.0,1.0,neutral,The Mysterious Island
"Towards midnight the stars shone out, and if the engineer had been there with his companions he would have remarked that these stars did not belong to the Northern Hemisphere.",0.0,0.0,0.0,1.0,neutral,The Mysterious Island
"The Polar Star was not visible, the constellations were not those which they had been accustomed to see in the United States; the Southern Cross glittered brightly in the sky.",0.6486,0.159,0.0,0.841,positive,The Mysterious Island
The night passed away.,0.0,0.0,0.0,1.0,neutral,The Mysterious Island
"Towards five o'clock in the morning of the 25th of March, the sky began to lighten; the horizon still remained dark, but with daybreak a thick mist rose from the sea, so that the eye could scarcely penetrate beyond twenty feet or so from where they stood.",0.0,0.0,0.0,1.0,neutral,The Mysterious Island
At length the fog gradually unrolled itself in great heavily moving waves.,0.6249,0.272,0.0,0.728,positive,The Mysterious Island
"It was unfortunate, however, that the castaways could distinguish nothing around them.",-0.4588,0.0,0.214,0.786,negative,The Mysterious Island
"While the gaze of the reporter and Neb were cast upon the ocean, the sailor and Herbert looked eagerly for the coast in the west.",0.3818,0.098,0.0,0.902,positive,The Mysterious Island
But not a speck of land was visible.,0.0,0.0,0.0,1.0,neutral,The Mysterious Island
"""Never mind,"" said Pencroft, ""though I do not see the land, I feel it... it is there... there... as sure as the fact that we are no longer at Richmond.""",0.0258,0.075,0.072,0.852,neutral,The Mysterious Island
But the fog was not long in rising.,0.0,0.0,0.0,1.0,neutral,The Mysterious Island
It was only a fine-weather mist.,0.0,0.0,0.0,1.0,neutral,The Mysterious Island
A hot sun soon penetrated to the surface of the island.,0.0,0.0,0.0,1.0,neutral,The Mysterious Island
"About half-past six, three-quarters of an hour after sunrise, the mist became more transparent.",0.0,0.0,0.0,1.0,neutral,The Mysterious Island
"It grew thicker above, but cleared away below.",0.1531,0.186,0.0,0.814,positive,The Mysterious Island
"Soon the isle appeared as if it had descended from a cloud, then the sea showed itself around them, spreading far away towards the east, but bounded on the west by an abrupt and precipitous coast.",0.0,0.0,0.0,1.0,neutral,The Mysterious Island
Yes!,0.4574,1.0,0.0,0.0,positive,The Mysterious Island
the land was there.,0.0,0.0,0.0,1.0,neutral,The Mysterious Island
Their safety was at least provisionally insured.,0.4215,0.318,0.0,0.682,positive,The Mysterious Island
"The islet and the coast were separated by a channel about half a mile in breadth, through which rushed an extremely rapid current.",0.0,0.0,0.0,1.0,neutral,The Mysterious Island
"However, one of the castaways, following the impulse of his heart, immediately threw himself into the current, without consulting his companions, without saying a single word.",0.0,0.0,0.0,1.0,neutral,The Mysterious Island
It was Neb.,0.0,0.0,0.0,1.0,neutral,The Mysterious Island
"He was in haste to be on the other side, and to climb towards the north.",0.0,0.0,0.0,1.0,neutral,The Mysterious Island
It had been impossible to hold him back.,0.0,0.0,0.0,1.0,neutral,The Mysterious Island
Pencroft called him in vain.,-0.4215,0.0,0.412,0.588,negative,The Mysterious Island
"The reporter prepared to follow him, but Pencroft stopped him.",-0.2263,0.123,0.199,0.678,negative,The Mysterious Island
"""Do you want to cross the channel?""",0.0772,0.178,0.0,0.822,positive,The Mysterious Island
he asked.,0.0,0.0,0.0,1.0,neutral,The Mysterious Island
"""Yes,"" replied Spilett.",0.0,0.0,0.0,1.0,neutral,The Mysterious Island
"""All right!""",0.0,0.0,0.0,1.0,neutral,The Mysterious Island
"said the seaman; ""wait a bit; Neb is well able to carry help to his master.",0.5859,0.27,0.0,0.73,positive,The Mysterious Island
"If we venture into the channel, we risk being carried into the open sea by the current, which is running very strong; but, if I'm not wrong, it is ebbing.",0.6221,0.165,0.045,0.79,positive,The Mysterious Island
"See, the tide is going down over the sand.",0.0,0.0,0.0,1.0,neutral,The Mysterious Island
"Let us have patience, and at low water it is possible we may find a fordable passage.""",-0.2732,0.0,0.123,0.877,negative,The Mysterious Island
"""You are right,"" replied the reporter, ""we will not separate more than we can help.""",0.0,0.0,0.0,1.0,neutral,The Mysterious Island
During this time Neb was struggling vigorously against the current.,-0.3182,0.122,0.228,0.65,negative,The Mysterious Island
He was crossing in an oblique direction.,0.0,0.0,0.0,1.0,neutral,The Mysterious Island
His black shoulders could be seen emerging at each stroke.,0.0,0.0,0.0,1.0,neutral,The Mysterious Island
"He was carried down very quickly, but he also made way towards the shore.",0.0,0.0,0.0,1.0,neutral,The Mysterious Island
"It took more than half an hour to cross from the islet to the land, and he reached the shore several hundred feet from the place which was opposite to the point from which he had started.",0.1027,0.037,0.0,0.963,positive,The Mysterious Island
"Landing at the foot of a high wall of granite, he shook himself vigorously; and then, setting off running, soon disappeared behind a rocky point, which projected to nearly the height of the northern extremity of the islet.",-0.2023,0.04,0.087,0.873,negative,The Mysterious Island
"Neb's companions had watched his daring attempt with painful anxiety, and when he was out of sight, they fixed their attention on the land where their hope of safety lay, while eating some shell-fish with which the sand was strewn.",0.5574,0.172,0.096,0.732,positive,The Mysterious Island
"It was a wretched repast, but still it was better than nothing.",0.5927,0.278,0.0,0.722,positive,The Mysterious Island
"The opposite coast formed one vast bay, terminating on the south by a very sharp point, which was destitute of all vegetation, and was of a very wild aspect.",0.0,0.0,0.0,1.0,neutral,The Mysterious Island
This point abutted on the shore in a grotesque outline of high granite rocks.,0.0,0.0,0.0,1.0,neutral,The Mysterious Island
"Towards the north, on the contrary, the bay widened, and a more rounded coast appeared, trending from the southwest to the northeast, and terminating in a slender cape.",0.0,0.0,0.0,1.0,neutral,The Mysterious Island
"The distance between these two extremities, which made the bow of the bay, was about eight miles.",0.0,0.0,0.0,1.0,neutral,The Mysterious Island
"Half a mile from the shore rose the islet, which somewhat resembled the carcass of a gigantic whale.",0.0,0.0,0.0,1.0,neutral,The Mysterious Island
Its extreme breadth was not more than a quarter of a mile.,0.0,0.0,0.0,1.0,neutral,The Mysterious Island
"Opposite the islet, the beach consisted first of sand, covered with black stones, which were now appearing little by little above the retreating tide.",0.0,0.0,0.0,1.0,neutral,The Mysterious Island
"The second level was separated by a perpendicular granite cliff, terminated at the top by an unequal edge at a height of at least 300 feet.",-0.1531,0.069,0.092,0.84,negative,The Mysterious Island
"It continued thus for a length of three miles, ending suddenly on the right with a precipice which looked as if cut by the hand of man.",0.2732,0.113,0.074,0.813,positive,The Mysterious Island
"On the left, above the promontory, this irregular and jagged cliff descended by a long slope of conglomerated rocks till it mingled with the ground of the southern point.",0.0,0.0,0.0,1.0,neutral,The Mysterious Island
On the upper plateau of the coast not a tree appeared.,0.0,0.0,0.0,1.0,neutral,The Mysterious Island
"It was a flat tableland like that above Cape Town at the Cape of Good Hope, but of reduced proportions; at least so it appeared seen from the islet.",0.5647,0.184,0.0,0.816,positive,The Mysterious Island
"However, verdure was not wanting to the right beyond the precipice.",0.0,0.0,0.0,1.0,neutral,The Mysterious Island
"They could easily distinguish a confused mass of great trees, which extended beyond the limits of their view.",0.6369,0.285,0.101,0.614,positive,The Mysterious Island
"This verdure relieved the eye, so long wearied by the continued ranges of granite.",0.3818,0.167,0.0,0.833,positive,The Mysterious Island
"Lastly, beyond and above the plateau, in a northwesterly direction and at a distance of at least seven miles, glittered a white summit which reflected the sun's rays.",0.0,0.0,0.0,1.0,neutral,The Mysterious Island
"It was that of a lofty mountain, capped with snow.",0.0,0.0,0.0,1.0,neutral,The Mysterious Island
"The question could not at present be decided whether this land formed an island, or whether it belonged to a continent.",0.0,0.0,0.0,1.0,neutral,The Mysterious Island
"But on beholding the convulsed masses heaped up on the left, no geologist would have hesitated to give them a volcanic origin, for they were unquestionably the work of subterranean convulsions.",-0.6956,0.0,0.17,0.83,negative,The Mysterious Island
"Gideon Spilett, Pencroft, and Herbert attentively examined this land, on which they might perhaps have to live many long years; on which indeed they might even die, should it be out of the usual track of vessels, as was likely to be the case.",-0.5994,0.0,0.083,0.917,negative,The Mysterious Island
"""Well,"" asked Herbert, ""what do you say, Pencroft?""",0.0,0.0,0.0,1.0,neutral,The Mysterious Island
"""There is some good and some bad, as in everything,"" replied the sailor.",-0.1531,0.167,0.201,0.632,negative,The Mysterious Island
"""We shall see.",0.0,0.0,0.0,1.0,neutral,The Mysterious Island
But now the ebb is evidently making.,0.0,0.0,0.0,1.0,neutral,The Mysterious Island
"In three hours we will attempt the passage, and once on the other side, we will try to get out of this scrape, and I hope may find the captain.""",0.4404,0.094,0.0,0.906,positive,The Mysterious Island
Pencroft was not wrong in his anticipations.,0.3724,0.299,0.0,0.701,positive,The Mysterious Island
"Three hours later at low tide, the greater part of the sand forming the bed of the channel was uncovered.",0.1027,0.111,0.093,0.796,positive,The Mysterious Island
Between the islet and the coast there only remained a narrow channel which would no doubt be easy to cross.,-0.2023,0.123,0.199,0.678,negative,The Mysterious Island
"About ten o'clock, Gideon Spilett and his companions stripped themselves of their clothes, which they placed in bundles on their heads, and then ventured into the water, which was not more than five feet deep.",0.0,0.0,0.0,1.0,neutral,The Mysterious Island
"Herbert, for whom it was too deep, swam like a fish, and got through capitally.",0.3612,0.161,0.0,0.839,positive,The Mysterious Island
All three arrived without difficulty on the opposite shore.,0.2584,0.203,0.0,0.797,positive,The Mysterious Island
"Quickly drying themselves in the sun, they put on their clothes, which they had preserved from contact with the water, and sat down to take counsel together what to do next.",0.0,0.0,0.0,1.0,neutral,The Mysterious Island
"Chapter 4 All at once the reporter sprang up, and telling the sailor that he would rejoin them at that same place, he climbed the cliff in the direction which the Negro Neb had taken a few hours before.",0.0,0.0,0.0,1.0,neutral,The Mysterious Island
"Anxiety hastened his steps, for he longed to obtain news of his friend, and he soon disappeared round an angle of the cliff.",0.1531,0.119,0.134,0.746,positive,The Mysterious Island
Herbert wished to accompany him.,0.0,0.0,0.0,1.0,neutral,The Mysterious Island
"""Stop here, my boy,"" said the sailor; ""we have to prepare an encampment, and to try and find rather better grub than these shell-fish.",0.1779,0.107,0.081,0.812,positive,The Mysterious Island
Our friends will want something when they come back.,0.5267,0.386,0.0,0.614,positive,The Mysterious Island
"There is work for everybody.""",0.0,0.0,0.0,1.0,neutral,The Mysterious Island
"""I am ready,"" replied Herbert.",0.0,0.0,0.0,1.0,neutral,The Mysterious Island
"""All right,"" said the sailor; ""that will do.",0.0,0.0,0.0,1.0,neutral,The Mysterious Island
We must set about it regularly.,0.0,0.0,0.0,1.0,neutral,The Mysterious Island
"We are tired, cold, and hungry; therefore we must have shelter, fire, and food.",-0.6486,0.0,0.306,0.694,negative,The Mysterious Island
"There is wood in the forest, and eggs in nests; we have only to find a house.""",0.0,0.0,0.0,1.0,neutral,The Mysterious Island
"""Very well,"" returned Herbert, ""I will look for a cave among the rocks, and I shall be sure to discover some hole into which we can creep.""",0.3182,0.087,0.0,0.913,positive,The Mysterious Island
"""All right,"" said Pencroft; ""go on, my boy.""",0.0,0.0,0.0,1.0,neutral,The Mysterious Island
"They both walked to the foot of the enormous wall over the beach, far from which the tide had now retreated; but instead of going towards the north, they went southward.",0.0,0.0,0.0,1.0,neutral,The Mysterious Island
"Pencroft had remarked, several hundred feet from the place at which they landed, a narrow cutting, out of which he thought a river or stream might issue.",-0.128,0.0,0.059,0.941,negative,The Mysterious Island
"Now, on the one hand it was important to settle themselves in the neighborhood of a good stream of water, and on the other it was possible that the current had thrown Cyrus Harding on the shore there.",0.7845,0.189,0.0,0.811,positive,The Mysterious Island
"The cliff, as has been said, rose to a height of three hundred feet, but the mass was unbroken throughout, and even at its base, scarcely washed by the sea, it did not offer the smallest fissure which would serve as a dwelling.",0.0387,0.028,0.0,0.972,neutral,The Mysterious Island
"It was a perpendicular wall of very hard granite, which even the waves had not worn away.",0.0503,0.107,0.096,0.796,positive,The Mysterious Island
"Towards the summit fluttered myriads of sea-fowl, and especially t",0.0,0.0,0.0,1.0,neutral,The Mysterious Island
