sentence,compound,positive,negative,neutral,label,title
"In short, for anything and for everything in the way of criticism I should be thankful.",0.2023,0.189,0.148,0.663,positive,Dead Souls
"Also, it would be an excellent thing if some reader in the higher walks of life, some person who stands remote, both by life and by education, from the circle of folk which I have pictured in my book, but who knows the life of the circle in which he himself revolves, would undertake to read my work in similar fashion, and methodically to recall to his mind any members of superior social classes whom he has met, and carefully to observe whether there exists any resemblance between one such class and another, and whether, at times, there may not be repeated in a higher sphere what is done in a lower, and likewise to note any additional fact in the same connection which may occur to him (that is to say, any fact pertaining to the higher ranks of society which would seem to confirm or to disprove his conclusions), and, lastly, to record that fact as it may have occurred within his own experience, while giving full details of persons (of individual manners, tendencies, and customs) and also of inanimate surroundings (of dress, furniture, fittings of houses, and so forth).",0.8462,0.06,0.014,0.926,positive,Dead Souls
"For I need knowledge of the classes in question, which are the flower of our people.",0.0,0.0,0.0,1.0,neutral,Dead Souls
"In fact, this very reason--the reason that I do not yet know Russian life in all its aspects, and in the degree to which it is necessary for me to know it in order to become a successful author--is what has, until now, prevented me from publishing any subsequent volumes of this story.",0.5994,0.091,0.0,0.909,positive,Dead Souls
"Again, it would be an excellent thing if some one who is endowed with the faculty of imagining and vividly picturing to himself the various situations wherein a character may be placed, and of mentally following up a character's career in one field and another--by this I mean some one who possesses the power of entering into and developing the ideas of the author whose work he may be reading--would scan each character herein portrayed, and tell me how each character ought to have acted at a given juncture, and what, to judge from the beginnings of each character, ought to have become of that character later, and what new circumstances might be devised in connection therewith, and what new details might advantageously be added to those already described.",0.765,0.051,0.0,0.949,positive,Dead Souls
Honestly can I say that to consider these points against the time when a new edition of my book may be published in a different and a better form would give me the greatest possible pleasure.,0.93,0.33,0.0,0.67,positive,Dead Souls
One thing in particular would I ask of any reader who may be willing to give me the benefit of his advice.,0.4588,0.13,0.0,0.87,positive,Dead Souls
"That is to say, I would beg of him to suppose, while recording his remarks, that it is for the benefit of a man in no way his equal in education, or similar to him in tastes and ideas, or capable of apprehending criticisms without full explanation appended, that he is doing so.",0.3612,0.099,0.072,0.829,positive,Dead Souls
"Rather would I ask such a reader to suppose that before him there stands a man of incomparably inferior enlightenment and schooling--a rude country bumpkin whose life, throughout, has been passed in retirement--a bumpkin to whom it is necessary to explain each circumstance in detail, while never forgetting to be as simple of speech as though he were a child, and at every step there were a danger of employing terms beyond his understanding.",-0.8442,0.0,0.121,0.879,negative,Dead Souls
"Should these precautions be kept constantly in view by any reader undertaking to annotate my book, that reader's remarks will exceed in weight and interest even his own expectations, and will bring me very real advantage.",0.6461,0.134,0.0,0.866,positive,Dead Souls
"Thus, provided that my earnest request be heeded by my readers, and that among them there be found a few kind spirits to do as I desire, the following is the manner in which I would request them to transmit their notes for my consideration.",0.8555,0.194,0.0,0.806,positive,Dead Souls
"Inscribing the package with my name, let them then enclose that package in a second one addressed either to the Rector of the University of St. Petersburg or to Professor Shevirev of the University of Moscow, according as the one or the other of those two cities may be the nearer to the sender.",0.0,0.0,0.0,1.0,neutral,Dead Souls
"Lastly, while thanking all journalists and litterateurs for their previously published criticisms of my book--criticisms which, in spite of a spice of that intemperance and prejudice which is common to all humanity, have proved of the greatest use both to my head and to my heart--I beg of such writers again to favour me with their reviews.",-0.128,0.106,0.129,0.765,negative,Dead Souls
For in all sincerity I can assure them that whatsoever they may be pleased to say for my improvement and my instruction will be received by me with naught but gratitude.,0.8442,0.28,0.0,0.72,positive,Dead Souls
"DEAD SOULS PART I CHAPTER I To the door of an inn in the provincial town of N. there drew up a smart britchka--a light spring-carriage of the sort affected by bachelors, retired lieutenant-colonels, staff-captains, land-owners possessed of about a hundred souls, and, in short, all persons who rank as gentlemen of the intermediate category.",-0.6037,0.047,0.116,0.837,negative,Dead Souls
"In the britchka was seated such a gentleman--a man who, though not handsome, was not ill-favoured, not over-fat, and not over-thin.",-0.3875,0.0,0.122,0.878,negative,Dead Souls
"Also, though not over-elderly, he was not over-young.",0.0,0.0,0.0,1.0,neutral,Dead Souls
"His arrival produced no stir in the town, and was accompanied by no particular incident, beyond that a couple of peasants who happened to be standing at the door of a dramshop exchanged a few comments with reference to the equipage rather than to the individual who was seated in it.",-0.5267,0.0,0.087,0.913,negative,Dead Souls
"""Look at that carriage,"" one of them said to the other.",0.0,0.0,0.0,1.0,neutral,Dead Souls
"""Think you it will be going as far as Moscow?""",0.0,0.0,0.0,1.0,neutral,Dead Souls
"""I think it will,"" replied his companion.",0.0,0.0,0.0,1.0,neutral,Dead Souls
"""But not as far as Kazan, eh?""",0.0,0.0,0.0,1.0,neutral,Dead Souls
"""No, not as far as Kazan.""",0.0,0.0,0.0,1.0,neutral,Dead Souls
With that the conversation ended.,0.0,0.0,0.0,1.0,neutral,Dead Souls
"Presently, as the britchka was approaching the inn, it was met by a young man in a pair of very short, very tight breeches of white dimity, a quasi-fashionable frockcoat, and a dickey fastened with a pistol-shaped bronze tie-pin.",0.0,0.0,0.0,1.0,neutral,Dead Souls
The young man turned his head as he passed the britchka and eyed it attentively; after which he clapped his hand to his cap (which was in danger of being removed by the wind) and resumed his way.,-0.0516,0.075,0.08,0.845,negative,Dead Souls
"On the vehicle reaching the inn door, its occupant found standing there to welcome him the polevoi, or waiter, of the establishment--an individual of such nimble and brisk movement that even to distinguish the character of his face was impossible.",0.6597,0.147,0.0,0.853,positive,Dead Souls
"Running out with a napkin in one hand and his lanky form clad in a tailcoat, reaching almost to the nape of his neck, he tossed back his locks, and escorted the gentleman upstairs, along a wooden gallery, and so to the bedchamber which God had prepared for the gentleman's reception.",0.7906,0.17,0.0,0.83,positive,Dead Souls
"The said bedchamber was of quite ordinary appearance, since the inn belonged to the species to be found in all provincial towns--the species wherein, for two roubles a day, travellers may obtain a room swarming with black-beetles, and communicating by a doorway with the apartment adjoining.",0.0,0.0,0.0,1.0,neutral,Dead Souls
"True, the doorway may be blocked up with a wardrobe; yet behind it, in all probability, there will be standing a silent, motionless neighbour whose ears are burning to learn every possible detail concerning the latest arrival.",0.1779,0.074,0.055,0.871,positive,Dead Souls
The inn's exterior corresponded with its interior.,0.0,0.0,0.0,1.0,neutral,Dead Souls
"Long, and consisting only of two storeys, the building had its lower half destitute of stucco; with the result that the dark-red bricks, originally more or less dingy, had grown yet dingier under the influence of atmospheric changes.",-0.296,0.0,0.056,0.944,negative,Dead Souls
"As for the upper half of the building, it was, of course, painted the usual tint of unfading yellow.",0.0,0.0,0.0,1.0,neutral,Dead Souls
"Within, on the ground floor, there stood a number of benches heaped with horse-collars, rope, and sheepskins; while the window-seat accommodated a sbitentshik 4 , cheek by jowl with a samovar 5 --the latter so closely resembling the former in appearance that, but for the fact of the samovar possessing a pitch-black lip, the samovar and the sbitentshik might have been two of a pair.",0.0387,0.02,0.0,0.98,neutral,Dead Souls
During the traveller's inspection of his room his luggage was brought into the apartment.,0.0,0.0,0.0,1.0,neutral,Dead Souls
First came a portmanteau of white leather whose raggedness indicated that the receptacle had made several previous journeys.,0.0,0.0,0.0,1.0,neutral,Dead Souls
"The bearers of the same were the gentleman's coachman, Selifan (a little man in a large overcoat), and the gentleman's valet, Petrushka--the latter a fellow of about thirty, clad in a worn, over-ample jacket which formerly had graced his master's shoulders, and possessed of a nose and a pair of lips whose coarseness communicated to his face rather a sullen expression.",-0.4588,0.032,0.083,0.884,negative,Dead Souls
"Behind the portmanteau came a small dispatch-box of redwood, lined with birch bark, a boot-case, and (wrapped in blue paper) a roast fowl; all of which having been deposited, the coachman departed to look after his horses, and the valet to establish himself in the little dark anteroom or kennel where already he had stored a cloak, a bagful of livery, and his own peculiar smell.",0.1531,0.026,0.0,0.974,positive,Dead Souls
"Pressing the narrow bedstead back against the wall, he covered it with the tiny remnant of mattress--a remnant as thin and flat (perhaps also as greasy) as a pancake--which he had managed to beg of the landlord of the establishment.",0.0,0.0,0.0,1.0,neutral,Dead Souls
While the attendants had been thus setting things straight the gentleman had repaired to the common parlour.,0.2263,0.106,0.0,0.894,positive,Dead Souls
The appearance of common parlours of the kind is known to every one who travels.,0.5267,0.195,0.0,0.805,positive,Dead Souls
"Always they have varnished walls which, grown black in their upper portions with tobacco smoke, are, in their lower, grown shiny with the friction of customers' backs--more especially with that of the backs of such local tradesmen as, on market-days, make it their regular practice to resort to the local hostelry for a glass of tea.",-0.34,0.0,0.06,0.94,negative,Dead Souls
"Also, parlours of this kind invariably contain smutty ceilings, an equally smutty chandelier, a number of pendent shades which jump and rattle whenever the waiter scurries across the shabby oilcloth with a trayful of glasses (the glasses looking like a flock of birds roosting by the seashore), and a selection of oil paintings.",0.7783,0.145,0.0,0.855,positive,Dead Souls
"In short, there are certain objects which one sees in every inn.",0.2732,0.16,0.0,0.84,positive,Dead Souls
In the present case the only outstanding feature of the room was the fact that in one of the paintings a nymph was portrayed as possessing breasts of a size such as the reader can never in his life have beheld.,0.6124,0.095,0.0,0.905,positive,Dead Souls
"A similar caricaturing of nature is to be noted in the historical pictures (of unknown origin, period, and creation) which reach us--sometimes through the instrumentality of Russian magnates who profess to be connoisseurs of art--from Italy; owing to the said magnates having made such purchases solely on the advice of the couriers who have escorted them.",0.0258,0.02,0.0,0.98,neutral,Dead Souls
"To resume, however--our traveller removed his cap, and divested his neck of a parti-coloured woollen scarf of the kind which a wife makes for her husband with her own hands, while accompanying the gift with interminable injunctions as to how best such a garment ought to be folded.",0.8885,0.2,0.0,0.8,positive,Dead Souls
"True, bachelors also wear similar gauds, but, in their case, God alone knows who may have manufactured the articles!",0.3274,0.207,0.107,0.685,positive,Dead Souls
"For my part, I cannot endure them.",0.0,0.0,0.0,1.0,neutral,Dead Souls
"Having unfolded the scarf, the gentleman ordered dinner, and whilst the various dishes were being got ready--cabbage soup, a pie several weeks old, a dish of marrow and peas, a dish of sausages and cabbage, a roast fowl, some salted cucumber, and the sweet tart which stands perpetually ready for use in such establishments; whilst, I say, these things were either being warmed up or brought in cold, the gentleman induced the waiter to retail certain fragments of tittle-tattle concerning the late landlord of the hostelry, the amount of income which the hostelry produced, and the character of its present proprietor.",0.8271,0.095,0.0,0.905,positive,Dead Souls
"To the last-mentioned inquiry the waiter returned the answer invariably given in such cases--namely, ""My master is a terribly hard man, sir.""",-0.6124,0.0,0.208,0.792,negative,Dead Souls
Curious that in enlightened Russia so many people cannot even take a meal at an inn without chattering to the attendant and making free with him!,0.8439,0.292,0.0,0.708,positive,Dead Souls
"Nevertheless not ALL the questions which the gentleman asked were aimless ones, for he inquired who was Governor of the town, who President of the Local Council, and who Public Prosecutor.",0.0,0.0,0.0,1.0,neutral,Dead Souls
"In short, he omitted no single official of note, while asking also (though with an air of detachment) the most exact particulars concerning the landowners of the neighbourhood.",-0.296,0.0,0.075,0.925,negative,Dead Souls
"Which of them, he inquired, possessed serfs, and how many of them?",0.0,0.0,0.0,1.0,neutral,Dead Souls
How far from the town did those landowners reside?,0.0,0.0,0.0,1.0,neutral,Dead Souls
"What was the character of each landowner, and was he in the habit of paying frequent visits to the town?",0.0,0.0,0.0,1.0,neutral,Dead Souls
The gentleman also made searching inquiries concerning the hygienic condition of the countryside.,0.0,0.0,0.0,1.0,neutral,Dead Souls
"Was there, he asked, much sickness about--whether sporadic fever, fatal forms of ague, smallpox, or what not?",-0.5423,0.0,0.179,0.821,negative,Dead Souls
"Yet, though his solicitude concerning these matters showed more than ordinary curiosity, his bearing retained its gravity unimpaired, and from time to time he blew his nose with portentous fervour.",0.0516,0.073,0.0,0.927,positive,Dead Souls
"Indeed, the manner in which he accomplished this latter feat was marvellous in the extreme, for, though that member emitted sounds equal to those of a trumpet in intensity, he could yet, with his accompanying air of guileless dignity, evoke the waiter's undivided respect--so much so that, whenever the sounds of the nose reached that menial's ears, he would shake back his locks, straighten himself into a posture of marked solicitude, and inquire afresh, with head slightly inclined, whether the gentleman happened to require anything further.",0.6486,0.079,0.019,0.902,positive,Dead Souls
"After dinner the guest consumed a cup of coffee, and then, seating himself upon the sofa, with, behind him, one of those wool-covered cushions which, in Russian taverns, resemble nothing so much as a cobblestone or a brick, fell to snoring; whereafter, returning with a start to consciousness, he ordered himself to be conducted to his room, flung himself at full length upon the bed, and once more slept soundly for a couple of hours.",0.0,0.0,0.0,1.0,neutral,Dead Souls
"Aroused, eventually, by the waiter, he, at the latter's request, inscribed a fragment of paper with his name, his surname, and his rank (for communication, in accordance with the law, to the police): and on that paper the waiter, leaning forward from the corridor, read, syllable by syllable: ""Paul Ivanovitch Chichikov, Collegiate Councillor--Landowner--Travelling on Private Affairs.""",0.0,0.0,0.0,1.0,neutral,Dead Souls
The waiter had just time to accomplish this feat before Paul Ivanovitch Chichikov set forth to inspect the town.,0.4215,0.135,0.0,0.865,positive,Dead Souls
"Apparently the place succeeded in satisfying him, and, to tell the truth, it was at least up to the usual standard of our provincial capitals.",0.7964,0.269,0.0,0.731,positive,Dead Souls
"Where the staring yellow of stone edifices did not greet his eye he found himself confronted with the more modest grey of wooden ones; which, consisting, for the most part, of one or two storeys (added to the range of attics which provincial architects love so well), looked almost lost amid the expanses of street and intervening medleys of broken or half-finished partition-walls.",-0.2939,0.079,0.124,0.797,negative,Dead Souls
"At other points evidence of more life and movement was to be seen, and here the houses stood crowded together and displayed dilapidated, rain-blurred signboards whereon boots or cakes or pairs of blue breeches inscribed ""Arshavski, Tailor,"" and so forth, were depicted.",0.0,0.0,0.0,1.0,neutral,Dead Souls
"Over a shop containing hats and caps was written ""Vassili Thedorov, Foreigner""; while, at another spot, a signboard portrayed a billiard table and two players--the latter clad in frockcoats of the kind usually affected by actors whose part it is to enter the stage during the closing act of a piece, even though, with arms sharply crooked and legs slightly bent, the said billiard players were taking the most careful aim, but succeeding only in making abortive strokes in the air.",0.7681,0.097,0.016,0.888,positive,Dead Souls
"Each emporium of the sort had written over it: ""This is the best establishment of its kind in the town.""",0.8225,0.297,0.0,0.703,positive,Dead Souls
"Also, al fresco in the streets there stood tables heaped with nuts, soap, and gingerbread (the latter but little distinguishable from the soap), and at an eating-house there was displayed the sign of a plump fish transfixed with a gaff.",-0.1655,0.0,0.043,0.957,negative,Dead Souls
"But the sign most frequently to be discerned was the insignia of the State, the double-headed eagle (now replaced, in this connection, with the laconic inscription ""Dramshop"").",0.0,0.0,0.0,1.0,neutral,Dead Souls
"As for the paving of the town, it was uniformly bad.",-0.5423,0.0,0.259,0.741,negative,Dead Souls
"The gentleman peered also into the municipal gardens, which contained only a few sorry trees that were poorly selected, requiring to be propped with oil-painted, triangular green supports, and able to boast of a height no greater than that of an ordinary walking-stick.",0.3612,0.11,0.077,0.813,positive,Dead Souls
"Yet recently the local paper had said (apropos of a gala) that, ""Thanks to the efforts of our Civil Governor, the town has become enriched with a pleasaunce full of umbrageous, spaciously-branching trees.",0.4404,0.088,0.0,0.912,positive,Dead Souls
"Even on the most sultry day they afford agreeable shade, and indeed gratifying was it to see the hearts of our citizens panting with an impulse of gratitude as their eyes shed tears in recognition of all that their Governor has done for them!""",0.8313,0.188,0.037,0.775,positive,Dead Souls
"Next, after inquiring of a gendarme as to the best ways and means of finding the local council, the local law-courts, and the local Governor, should he (Chichikov) have need of them, the gentleman went on to inspect the river which ran through the town.",0.6369,0.089,0.0,0.911,positive,Dead Souls
"En route he tore off a notice affixed to a post, in order that he might the more conveniently read it after his return to the inn.",0.0,0.0,0.0,1.0,neutral,Dead Souls
"Also, he bestowed upon a lady of pleasant exterior who, escorted by a footman laden with a bundle, happened to be passing along a wooden sidewalk a prolonged stare.",0.5106,0.125,0.0,0.875,positive,Dead Souls
"Lastly, he threw around him a comprehensive glance (as though to fix in his mind the general topography of the place) and betook himself home.",0.25,0.08,0.0,0.92,positive,Dead Souls
"There, gently aided by the waiter, he ascended the stairs to his bedroom, drank a glass of tea, and, seating himself at the table, called for a candle; which having been brought him, he produced from his pocket the notice, held it close to the flame, and conned its tenour--slightly contracting his right eye as he did so.",0.4588,0.052,0.0,0.948,positive,Dead Souls
Yet there was little in the notice to call for remark.,0.0,0.0,0.0,1.0,neutral,Dead Souls
"All that it said was that shortly one of Kotzebue's 6 plays would be given, and that one of the parts in the play was to be taken by a certain Monsieur Poplevin, and another by a certain Mademoiselle Ziablova, while the remaining parts were to be filled by a number of less important personages.",0.813,0.202,0.0,0.798,positive,Dead Souls
"Nevertheless the gentleman perused the notice with careful attention, and even jotted down the prices to be asked for seats for the performance.",0.1531,0.068,0.0,0.932,positive,Dead Souls
"Also, he remarked that the bill had been printed in the press of the Provincial Government.",0.0,0.0,0.0,1.0,neutral,Dead Souls
"Next, he turned over the paper, in order to see if anything further was to be read on the reverse side; but, finding nothing there, he refolded the document, placed it in the box which served him as a receptacle for odds and ends, and brought the day to a close with a portion of cold veal, a bottle of pickles, and a sound sleep.",0.0,0.0,0.0,1.0,neutral,Dead Souls
"The following day he devoted to paying calls upon the various municipal officials--a first, and a very respectful, visit being paid to the Governor.",0.7178,0.222,0.0,0.778,positive,Dead Souls
This personage turned out to resemble Chichikov himself in that he was neither fat nor thin.,0.0,0.0,0.0,1.0,neutral,Dead Souls
"Also, he wore the riband of the order of Saint Anna about his neck, and was reported to have been recommended also for the star.",0.2023,0.07,0.0,0.93,positive,Dead Souls
"For the rest, he was large and good-natured, and had a habit of amusing himself with occasional spells of knitting.",0.3818,0.126,0.0,0.874,positive,Dead Souls
"Next, Chichikov repaired to the Vice-Governor's, and thence to the house of the Public Prosecutor, to that of the President of the Local Council, to that of the Chief of Police, to that of the Commissioner of Taxes, and to that of the local Director of State Factories.",0.0,0.0,0.0,1.0,neutral,Dead Souls
"True, the task of remembering every big-wig in this world of ours is not a very easy one; but at least our visitor displayed the greatest activity in his work of paying calls, seeing that he went so far as to pay his respects also to the Inspector of the Municipal Department of Medicine and to the City Architect.",0.8496,0.159,0.051,0.79,positive,Dead Souls
Thereafter he sat thoughtfully in his britchka--plunged in meditation on the subject of whom else it might be well to visit.,0.5859,0.202,0.0,0.798,positive,Dead Souls
"However, not a single magnate had been neglected, and in conversation with his hosts he had contrived to flatter each separate one.",-0.4588,0.059,0.143,0.798,negative,Dead Souls
"For instance to the Governor he had hinted that a stranger, on arriving in his, the Governor's province, would conceive that he had reached Paradise, so velvety were the roads.",0.6808,0.172,0.0,0.828,positive,Dead Souls
"""Governors who appoint capable subordinates,"" had said Chichikov, ""are deserving of the most ample meed of praise.""",0.3818,0.14,0.0,0.86,positive,Dead Souls
"Again, to the Chief of Police our hero had passed a most gratifying remark on the subject of the local gendarmery; while in his conversation with the Vice-Governor and the President of the Local Council (neither of whom had, as yet, risen above the rank of State Councillor) he had twice been guilty of the gaucherie of addressing his interlocutors with the title of ""Your Excellency""--a blunder which had not failed to delight them.",0.6058,0.118,0.071,0.811,positive,Dead Souls
"In the result the Governor had invited him to a reception the same evening, and certain other officials had followed suit by inviting him, one of them to dinner, a second to a tea-party, and so forth, and so forth.",0.5267,0.112,0.0,0.888,positive,Dead Souls
"Of himself, however, the traveller had spoken little; or, if he had spoken at any length, he had done so in a general sort of way and with marked modesty.",0.0,0.0,0.0,1.0,neutral,Dead Souls
