sentence,compound,positive,negative,neutral,label,title
Other countries have Protection and yet many of their people are glad to come here and work for starvation wages.,0.4588,0.136,0.0,0.864,positive,The Ragged Trousered Philanthropists
"The only difference between Free Trade and Protection is that under certain circumstances one might be a little worse than the other, but as remedies for Poverty, neither of them are of any real use whatever, for the simple reason that they do not deal with the real causes of Poverty.""",-0.5652,0.066,0.113,0.821,negative,The Ragged Trousered Philanthropists
"""The greatest cause of poverty is hover-population,"" remarked Harlow.",0.2263,0.29,0.228,0.483,positive,The Ragged Trousered Philanthropists
"""Yes,"" said old Joe Philpot.",0.0,0.0,0.0,1.0,neutral,The Ragged Trousered Philanthropists
"""If a boss wants two men, twenty goes after the job: ther's too many people and not enough work.""",0.0,0.0,0.0,1.0,neutral,The Ragged Trousered Philanthropists
"""Over-population!""",0.0,0.0,0.0,1.0,neutral,The Ragged Trousered Philanthropists
"cried Owen, ""when there's thousands of acres of uncultivated land in England without a house or human being to be seen.",-0.3818,0.0,0.12,0.88,negative,The Ragged Trousered Philanthropists
Is over-population the cause of poverty in France?,-0.5106,0.0,0.32,0.68,negative,The Ragged Trousered Philanthropists
Is over-population the cause of poverty in Ireland?,-0.5106,0.0,0.32,0.68,negative,The Ragged Trousered Philanthropists
Within the last fifty years the population of Ireland has been reduced by more than half.,0.0,0.0,0.0,1.0,neutral,The Ragged Trousered Philanthropists
"Four millions of people have been exterminated by famine or got rid of by emigration, but they haven't got rid of poverty.",-0.6652,0.0,0.175,0.825,negative,The Ragged Trousered Philanthropists
"P'raps you think that half the people in this country ought to be exterminated as well.""",0.0,0.0,0.0,1.0,neutral,The Ragged Trousered Philanthropists
"Here Owen was seized with a violent fit of coughing, and resumed his seat.",-0.34,0.144,0.224,0.632,negative,The Ragged Trousered Philanthropists
When the cough had ceased he sat wiping his mouth with his handkerchief and listening to the talk that ensued.,0.0,0.0,0.0,1.0,neutral,The Ragged Trousered Philanthropists
"""Drink is the cause of most of the poverty,"" said Slyme.",0.0,0.0,0.0,1.0,neutral,The Ragged Trousered Philanthropists
"This young man had been through some strange process that he called ""conversion"".",-0.2023,0.0,0.13,0.87,negative,The Ragged Trousered Philanthropists
"He had had a ""change of 'art"" and looked down with pious pity upon those he called ""worldly"" people.",-0.296,0.0,0.115,0.885,negative,The Ragged Trousered Philanthropists
"He was not ""worldly"", he did not smoke or drink and never went to the theatre.",0.0,0.0,0.0,1.0,neutral,The Ragged Trousered Philanthropists
He had an extraordinary notion that total abstinence was one of the fundamental principles of the Christian religion.,0.0,0.0,0.0,1.0,neutral,The Ragged Trousered Philanthropists
"It never occurred to what he called his mind, that this doctrine is an insult to the Founder of Christianity.",-0.5106,0.0,0.148,0.852,negative,The Ragged Trousered Philanthropists
"""Yes,"" said Crass, agreeing with Slyme, ""an' thers plenty of 'em wot's too lazy to work when they can get it.",-0.0258,0.1,0.105,0.795,neutral,The Ragged Trousered Philanthropists
Some of the b--s who go about pleading poverty 'ave never done a fair day's work in all their bloody lives.,-0.7999,0.0,0.324,0.676,negative,The Ragged Trousered Philanthropists
"Then thers all this new-fangled machinery,"" continued Crass.",0.0,0.0,0.0,1.0,neutral,The Ragged Trousered Philanthropists
"""That's wot's ruinin' everything.",0.0,0.0,0.0,1.0,neutral,The Ragged Trousered Philanthropists
"Even in our trade ther's them machines for trimmin' wallpaper, an' now they've brought out a paintin' machine.",0.0,0.0,0.0,1.0,neutral,The Ragged Trousered Philanthropists
"Ther's a pump an' a 'ose pipe, an' they reckon two men can do as much with this 'ere machine as twenty could without it.""",0.0,0.0,0.0,1.0,neutral,The Ragged Trousered Philanthropists
"""Another thing is women,"" said Harlow, ""there's thousands of 'em nowadays doin' work wot oughter be done by men.""",0.0,0.0,0.0,1.0,neutral,The Ragged Trousered Philanthropists
"""In my opinion ther's too much of this 'ere eddication, nowadays,"" remarked old Linden.",0.0,0.0,0.0,1.0,neutral,The Ragged Trousered Philanthropists
"""Wot the 'ell's the good of eddication to the likes of us?""",0.6908,0.363,0.0,0.637,positive,The Ragged Trousered Philanthropists
"""None whatever,"" said Crass, ""it just puts foolish idears into people's 'eds and makes 'em too lazy to work.""",-0.5574,0.0,0.213,0.787,negative,The Ragged Trousered Philanthropists
"Barrington, who took no part in the conversation, still sat silently smoking.",-0.296,0.0,0.167,0.833,negative,The Ragged Trousered Philanthropists
Owen was listening to this pitiable farrago with feelings of contempt and wonder.,-0.7331,0.0,0.36,0.64,negative,The Ragged Trousered Philanthropists
Were they all hopelessly stupid?,-0.765,0.0,0.688,0.312,negative,The Ragged Trousered Philanthropists
Had their intelligence never developed beyond the childhood stage?,0.4767,0.279,0.0,0.721,positive,The Ragged Trousered Philanthropists
Or was he mad himself?,-0.4939,0.0,0.444,0.556,negative,The Ragged Trousered Philanthropists
"""Early marriages is another thing,"" said Slyme: ""no man oughtn't to be allowed to get married unless he's in a position to keep a family.""",-0.296,0.0,0.091,0.909,negative,The Ragged Trousered Philanthropists
"""How can marriage be a cause of poverty?""",0.0,0.0,0.0,1.0,neutral,The Ragged Trousered Philanthropists
"said Owen, contemptuously.",-0.5267,0.0,0.63,0.37,negative,The Ragged Trousered Philanthropists
"""A man who is not married is living an unnatural life.",0.0,0.0,0.0,1.0,neutral,The Ragged Trousered Philanthropists
Why don't you continue your argument a little further and say that the practice of eating and drinking is the cause of poverty or that if people were to go barefoot and naked there would be no poverty?,-0.8834,0.0,0.255,0.745,negative,The Ragged Trousered Philanthropists
"The man who is so poor that he cannot marry is in a condition of poverty already.""",-0.8069,0.0,0.342,0.658,negative,The Ragged Trousered Philanthropists
"""Wot I mean,"" said Slyme, ""is that no man oughtn't to marry till he's saved up enough so as to 'ave some money in the bank; an' another thing, I reckon a man oughtn't to get married till 'e's got an 'ouse of 'is own.",0.1531,0.062,0.049,0.889,positive,The Ragged Trousered Philanthropists
"It's easy enough to buy one in a building society if you're in reg'lar work.""",0.4404,0.182,0.0,0.818,positive,The Ragged Trousered Philanthropists
At this there was a general laugh.,0.5574,0.419,0.0,0.581,positive,The Ragged Trousered Philanthropists
"""Why, you bloody fool,"" said Harlow, scornfully, ""most of us is walkin' about 'arf our time.",-0.4404,0.0,0.162,0.838,negative,The Ragged Trousered Philanthropists
It's all very well for you to talk; you've got almost a constant job on this firm.,0.3384,0.138,0.0,0.862,positive,The Ragged Trousered Philanthropists
If they're doin' anything at all you're one of the few gets a show in.,0.0,0.0,0.0,1.0,neutral,The Ragged Trousered Philanthropists
"And another thing,"" he added with a sneer, ""we don't all go to the same chapel as old Misery,"" ""Old Misery"" was Ruston & Co.'s manager or walking foreman.",-0.5719,0.0,0.125,0.875,negative,The Ragged Trousered Philanthropists
"""Misery"" was only one of the nicknames bestowed upon him by the hands: he was also known as ""Nimrod"" and ""Pontius Pilate"".",0.0,0.0,0.0,1.0,neutral,The Ragged Trousered Philanthropists
"""And even if it's not possible,"" Harlow continued, winking at the others, ""what's a man to do during the years he's savin' up?""",0.0,0.0,0.0,1.0,neutral,The Ragged Trousered Philanthropists
"""Well, he must conquer hisself,"" said Slyme, getting red.",0.0,0.0,0.0,1.0,neutral,The Ragged Trousered Philanthropists
"""Conquer hisself is right!""",0.0,0.0,0.0,1.0,neutral,The Ragged Trousered Philanthropists
said Harlow and the others laughed again.,0.4588,0.333,0.0,0.667,positive,The Ragged Trousered Philanthropists
"""Of course if a man tried to conquer hisself by his own strength,"" replied Slyme, ""'e would be sure to fail, but when you've got the Grace of God in you it's different.""",0.6956,0.209,0.059,0.732,positive,The Ragged Trousered Philanthropists
"""Chuck it, fer Christ's sake!""",0.0,0.0,0.0,1.0,neutral,The Ragged Trousered Philanthropists
said Harlow in a tone of disgust.,-0.5994,0.0,0.438,0.562,negative,The Ragged Trousered Philanthropists
"""We've only just 'ad our dinner!""",0.0,0.0,0.0,1.0,neutral,The Ragged Trousered Philanthropists
"""And wot about drink?""",0.0,0.0,0.0,1.0,neutral,The Ragged Trousered Philanthropists
"demanded old Joe Philpot, suddenly.",-0.2263,0.0,0.322,0.678,negative,The Ragged Trousered Philanthropists
"""'Ear, 'ear,"" cried Harlow.",-0.3818,0.0,0.464,0.536,negative,The Ragged Trousered Philanthropists
"""That's the bleedin' talk.",0.0,0.0,0.0,1.0,neutral,The Ragged Trousered Philanthropists
"I wouldn't mind 'avin 'arf a pint now, if somebody else will pay for it.""",-0.1027,0.0,0.104,0.896,negative,The Ragged Trousered Philanthropists
"Joe Philpot--or as he was usually called, ""Old Joe""--was in the habit of indulging freely in the cup that inebriates.",0.4404,0.132,0.0,0.868,positive,The Ragged Trousered Philanthropists
"He was not very old, being only a little over fifty, but he looked much older.",0.0,0.0,0.0,1.0,neutral,The Ragged Trousered Philanthropists
"He had lost his wife some five years ago and was now alone in the world, for his three children had died in their infancy.",-0.7845,0.0,0.264,0.736,negative,The Ragged Trousered Philanthropists
Slyme's reference to drink had roused Philpot's indignation; he felt that it was directed against himself.,-0.5267,0.0,0.185,0.815,negative,The Ragged Trousered Philanthropists
"The muddled condition of his brain did not permit him to take up the cudgels in his own behalf, but he knew that although Owen was a tee-totaller himself, he disliked Slyme.",-0.5499,0.0,0.106,0.894,negative,The Ragged Trousered Philanthropists
"""There's no need for us to talk about drink or laziness,"" returned Owen, impatiently, ""because they have nothing to do with the matter.",-0.5859,0.042,0.188,0.769,negative,The Ragged Trousered Philanthropists
"The question is, what is the cause of the lifelong poverty of the majority of those who are not drunkards and who DO work?",-0.5106,0.0,0.125,0.875,negative,The Ragged Trousered Philanthropists
"Why, if all the drunkards and won't-works and unskilled or inefficient workers could be by some miracle transformed into sober, industrious and skilled workers tomorrow, it would, under the present conditions, be so much the worse for us, because there isn't enough work for all NOW and those people by increasing the competition for what work there is, would inevitably cause a reduction of wages and a greater scarcity of employment.",0.4472,0.083,0.044,0.872,positive,The Ragged Trousered Philanthropists
"The theories that drunkenness, laziness or inefficiency are the causes of poverty are so many devices invented and fostered by those who are selfishly interested in maintaining the present states of affairs, for the purpose of preventing us from discovering the real causes of our present condition.""",-0.4767,0.051,0.13,0.819,negative,The Ragged Trousered Philanthropists
"""Well, if we're all wrong,"" said Crass, with a sneer, ""praps you can tell us what the real cause is?""",0.0,0.0,0.0,1.0,neutral,The Ragged Trousered Philanthropists
"""An' praps you think you know how it's to be altered,"" remarked Harlow, winking at the others.",0.0,0.0,0.0,1.0,neutral,The Ragged Trousered Philanthropists
"""Yes; I do think I know the cause,"" declared Owen, ""and I do think I know how it could be altered--"" ""It can't never be haltered,"" interrupted old Linden.",0.2235,0.073,0.0,0.927,positive,The Ragged Trousered Philanthropists
"""I don't see no sense in all this 'ere talk.",0.2235,0.173,0.0,0.827,positive,The Ragged Trousered Philanthropists
"There's always been rich and poor in the world, and there always will be.""",0.128,0.193,0.166,0.642,positive,The Ragged Trousered Philanthropists
"""Wot I always say is there 'ere,"" remarked Philpot, whose principal characteristic--apart from thirst--was a desire to see everyone comfortable, and who hated rows of any kind.",0.6369,0.272,0.121,0.607,positive,The Ragged Trousered Philanthropists
"""There ain't no use in the likes of us trubblin our 'eds or quarrelin about politics.",0.5702,0.251,0.0,0.749,positive,The Ragged Trousered Philanthropists
It don't make a dam bit of difference who you votes for or who gets in.,0.0,0.0,0.0,1.0,neutral,The Ragged Trousered Philanthropists
They're hall the same; workin the horicle for their own benefit.,0.4588,0.231,0.0,0.769,positive,The Ragged Trousered Philanthropists
"You can talk till you're black in the face, but you won't never be able to alter it.",0.0,0.0,0.0,1.0,neutral,The Ragged Trousered Philanthropists
It's no use worrying.,-0.5574,0.0,0.697,0.303,negative,The Ragged Trousered Philanthropists
"The sensible thing is to try and make the best of things as we find 'em: enjoy ourselves, and do the best we can for each other.",0.9118,0.326,0.0,0.674,positive,The Ragged Trousered Philanthropists
"Life's too short to quarrel and we'll hall soon be dead!""",0.0,0.0,0.0,1.0,neutral,The Ragged Trousered Philanthropists
"At the end of this lengthy speech, the philosophic Philpot abstractedly grasped a jam-jar and raised it to his lips; but suddenly remembering that it contained stewed tea and not beer, set it down again without drinking.",0.0,0.0,0.0,1.0,neutral,The Ragged Trousered Philanthropists
"""Let us begin at the beginning,"" continued Owen, taking no notice of these interruptions.",-0.5994,0.0,0.29,0.71,negative,The Ragged Trousered Philanthropists
"""First of all, what do you mean by Poverty?""",0.0,0.0,0.0,1.0,neutral,The Ragged Trousered Philanthropists
"""Why, if you've got no money, of course,"" said Crass impatiently.",-0.5994,0.0,0.353,0.647,negative,The Ragged Trousered Philanthropists
The others laughed disdainfully.,0.4588,0.5,0.0,0.5,positive,The Ragged Trousered Philanthropists
It seemed to them such a foolish question.,-0.2732,0.0,0.259,0.741,negative,The Ragged Trousered Philanthropists
"""Well, that's true enough as far as it goes,"" returned Owen, ""that is, as things are arranged in the world at present.",0.4215,0.118,0.0,0.882,positive,The Ragged Trousered Philanthropists
"But money itself is not wealth: it's of no use whatever.""",-0.7385,0.0,0.41,0.59,negative,The Ragged Trousered Philanthropists
At this there was another outburst of jeering laughter.,0.4939,0.286,0.0,0.714,positive,The Ragged Trousered Philanthropists
"""Supposing for example that you and Harlow were shipwrecked on a desolate island, and YOU had saved nothing from the wreck but a bag containing a thousand sovereigns, and he had a tin of biscuits and a bottle of water.""",0.3824,0.098,0.0,0.902,positive,The Ragged Trousered Philanthropists
"""Make it beer!""",0.0,0.0,0.0,1.0,neutral,The Ragged Trousered Philanthropists
cried Harlow appealingly.,-0.3818,0.0,0.565,0.435,negative,The Ragged Trousered Philanthropists
"""Who would be the richer man, you or Harlow?""",0.5267,0.298,0.0,0.702,positive,The Ragged Trousered Philanthropists
"""But then you see we ain't shipwrecked on no dissolute island at all,"" sneered Crass.",0.3252,0.143,0.0,0.857,positive,The Ragged Trousered Philanthropists
"""That's the worst of your arguments.",-0.7783,0.0,0.63,0.37,negative,The Ragged Trousered Philanthropists
You can't never get very far without supposing some bloody ridclus thing or other.,0.3412,0.156,0.0,0.844,positive,The Ragged Trousered Philanthropists
"Never mind about supposing things wot ain't true; let's 'ave facts and common sense.""",-0.3252,0.0,0.152,0.848,negative,The Ragged Trousered Philanthropists
"""'Ear, 'ear,"" said old Linden.",0.0,0.0,0.0,1.0,neutral,The Ragged Trousered Philanthropists
"""That's wot we want--a little common sense.""",0.0,0.0,0.0,1.0,neutral,The Ragged Trousered Philanthropists
"""What do YOU mean by poverty, then?""",-0.5106,0.0,0.355,0.645,negative,The Ragged Trousered Philanthropists
asked Easton.,0.0,0.0,0.0,1.0,neutral,The Ragged Trousered Philanthropists
"""What I call poverty is when people are not able to secure for themselves all the benefits of civilization; the necessaries, comforts, pleasures and refinements of life, leisure, books, theatres, pictures, music, holidays, travel, good and beautiful homes, good clothes, good and pleasant food.""",0.9673,0.421,0.083,0.497,positive,The Ragged Trousered Philanthropists
Everybody laughed.,0.4588,0.75,0.0,0.25,positive,The Ragged Trousered Philanthropists
It was so ridiculous.,-0.5009,0.0,0.519,0.481,negative,The Ragged Trousered Philanthropists
The idea of the likes of THEM wanting or having such things!,0.4753,0.219,0.0,0.781,positive,The Ragged Trousered Philanthropists
Any doubts that any of them had entertained as to Owen's sanity disappeared.,-0.1027,0.161,0.244,0.595,negative,The Ragged Trousered Philanthropists
The man was as mad as a March hare.,-0.4939,0.0,0.314,0.686,negative,The Ragged Trousered Philanthropists
"""If a man is only able to provide himself and his family with the bare necessaries of existence, that man's family is living in poverty.",-0.5106,0.0,0.125,0.875,negative,The Ragged Trousered Philanthropists
"Since he cannot enjoy the advantages of civilization he might just as well be a savage: better, in fact, for a savage knows nothing of what he is deprived.",-0.8333,0.129,0.356,0.515,negative,The Ragged Trousered Philanthropists
What we call civilization--the accumulation of knowledge which has come down to us from our forefathers--is the fruit of thousands of years of human thought and toil.,0.0,0.0,0.0,1.0,neutral,The Ragged Trousered Philanthropists
"It is not the result of the labour of the ancestors of any separate class of people who exist today, and therefore it is by right the common heritage of all.",0.0,0.0,0.0,1.0,neutral,The Ragged Trousered Philanthropists
"Every little child that is born into the world, no matter whether he is clever or full, whether he is physically perfect or lame, or blind; no matter how much he may excel or fall short of his fellows in other respects, in one thing at least he is their equal--he is one of the heirs of all the ages that have gone before.""",0.5106,0.182,0.127,0.691,positive,The Ragged Trousered Philanthropists
Some of them began to wonder whether Owen was not sane after all.,0.0,0.0,0.0,1.0,neutral,The Ragged Trousered Philanthropists
He certainly must be a clever sort of chap to be able to talk like this.,0.7845,0.397,0.0,0.603,positive,The Ragged Trousered Philanthropists
"It sounded almost like something out of a book, and most of them could not understand one half of it.",0.2975,0.109,0.0,0.891,positive,The Ragged Trousered Philanthropists
"""Why is it,"" continued Owen, ""that we are not only deprived of our inheritance--we are not only deprived of nearly all the benefits of civilization, but we and our children are also often unable to obtain even the bare necessaries of existence?""",0.5194,0.121,0.0,0.879,positive,The Ragged Trousered Philanthropists
No one answered.,-0.296,0.0,0.524,0.476,negative,The Ragged Trousered Philanthropists
"""All these things,"" Owen proceeded, ""are produced by those who work.",0.0,0.0,0.0,1.0,neutral,The Ragged Trousered Philanthropists
"We do our full share of the work, therefore we should have a full share of the things that are made by work.""",0.5267,0.18,0.0,0.82,positive,The Ragged Trousered Philanthropists
The others continued silent.,0.0,0.0,0.0,1.0,neutral,The Ragged Trousered Philanthropists
"Harlow thought of the over-population theory, but decided not to mention it.",0.0,0.0,0.0,1.0,neutral,The Ragged Trousered Philanthropists
"Crass, who could not have given an intelligent answer to save his life, for once had sufficient sense to remain silent.",0.7351,0.246,0.0,0.754,positive,The Ragged Trousered Philanthropists
"He did think of calling out the patent paint-pumping machine and bringing the hosepipe to bear on the subject, but abandoned the idea; after all, he thought, what was the use of arguing with such a fool as Owen?",-0.9161,0.0,0.253,0.747,negative,The Ragged Trousered Philanthropists
Sawkins pretended to be asleep.,0.0,0.0,0.0,1.0,neutral,The Ragged Trousered Philanthropists
"Philpot, however, had suddenly grown very serious.",-0.1513,0.0,0.21,0.79,negative,The Ragged Trousered Philanthropists
"""As things are now,"" went on Owen, ""instead of enjoying the advantages of civilization we are really worse off than slaves, for if we were slaves our owners in their own interest would see to it that we always had food and--"" ""Oh, I don't see that,"" roughly interrupted old Linden, who had been listening with evident anger and impatience.",-0.4927,0.122,0.166,0.712,negative,The Ragged Trousered Philanthropists
"""You can speak for yourself, but I can tell yer I don't put MYSELF down as a slave.""",0.0,0.0,0.0,1.0,neutral,The Ragged Trousered Philanthropists
"""Nor me neither,"" said Crass sturdily.",0.0,0.0,0.0,1.0,neutral,The Ragged Trousered Philanthropists
"""Let them call their selves slaves as wants to.""",0.0,0.0,0.0,1.0,neutral,The Ragged Trousered Philanthropists
At this moment a footstep was heard in the passage leading to the kitchen.,0.0,0.0,0.0,1.0,neutral,The Ragged Trousered Philanthropists
Old Misery!,-0.6114,0.0,0.8,0.2,negative,The Ragged Trousered Philanthropists
or perhaps the bloke himself!,0.0,0.0,0.0,1.0,neutral,The Ragged Trousered Philanthropists
Crass hurriedly pulled out his watch.,0.0,0.0,0.0,1.0,neutral,The Ragged Trousered Philanthropists
"""Jesus Christ!""",0.0,0.0,0.0,1.0,neutral,The Ragged Trousered Philanthropists
he gasped.,0.0,0.0,0.0,1.0,neutral,The Ragged Trousered Philanthropists
"""It's four minutes past one!""",0.0,0.0,0.0,1.0,neutral,The Ragged Trousered Philanthropists
Linden frantically seized hold of a pair of steps and began wandering about the room with them.,-0.34,0.0,0.138,0.862,negative,The Ragged Trousered Philanthropists
"Sawkins scrambled hastily to his feet and, snatching a piece of sandpaper from the pocket of his apron, began furiously rubbing down the scullery door.",-0.4404,0.0,0.112,0.888,negative,The Ragged Trousered Philanthropists
Easton threw down the copy of the Obscurer and scrambled hastily to his feet.,0.0,0.0,0.0,1.0,neutral,The Ragged Trousered Philanthropists
The boy crammed the Chronicles of Crime into his trousers pocket.,-0.5423,0.0,0.259,0.741,negative,The Ragged Trousered Philanthropists
"Crass rushed over to the bucket and began stirring up the stale whitewash it contained, and the stench which it gave forth was simply appalling.",-0.6908,0.038,0.201,0.761,negative,The Ragged Trousered Philanthropists
Consternation reigned.,0.0,0.0,0.0,1.0,neutral,The Ragged Trousered Philanthropists
They looked like a gang of malefactors suddenly interrupted in the commission of a crime.,-0.4939,0.137,0.313,0.549,negative,The Ragged Trousered Philanthropists
The door opened.,0.0,0.0,0.0,1.0,neutral,The Ragged Trousered Philanthropists
It was only Bundy returning from his mission to the Bookie.,0.0,0.0,0.0,1.0,neutral,The Ragged Trousered Philanthropists
"Chapter 2 Nimrod: a Mighty Hunter before the Lord Mr Hunter, as he was called to his face and as he was known to his brethren at the Shining Light Chapel, where he was superintendant of the Sunday School, or ""Misery"" or ""Nimrod"", as he was named behind his back by the workmen over whom he tyrannized, was the general or walking foreman or ""manager"" of the firm whose card is herewith presented to the reader: RUSHTON & CO. MUGSBOROUGH -------- Builders, Decorators, and General Contractors FUNERALS FURNISHED Estimates given for General Repairs to House Property First-class Work only at Moderate Charges There were a number of sub-foremen or ""coddies"", but Hunter was the foreman.",-0.375,0.01,0.033,0.957,negative,The Ragged Trousered Philanthropists
"He was a tall, thin man whose clothes hung loosely on the angles of his round-shouldered, bony form.",0.0,0.0,0.0,1.0,neutral,The Ragged Trousered Philanthropists
"His long, thin legs, about which the baggy trousers draped in ungraceful folds, were slightly knock-kneed and terminated in large, flat feet.",0.0,0.0,0.0,1.0,neutral,The Ragged Trousered Philanthropists
"His arms were very long even for such a tall man, and the huge, bony hands were gnarled and knotted.",0.3182,0.113,0.0,0.887,positive,The Ragged Trousered Philanthropists
"When he removed his bowler hat, as he frequently did to wipe away with a red handkerchief the sweat occasioned by furious bicycle riding, it was seen that his forehead was high, flat and narrow.",-0.5719,0.0,0.101,0.899,negative,The Ragged Trousered Philanthropists
"His nose was a large, fleshy, hawklike beak, and from the side of each nostril a deep indentation extended downwards until it disappeared in the dropping moustache that concealed his mouth, the vast extent of which was perceived only when he opened it to bellow at the workmen his exhortations to greater exertions.",0.1531,0.047,0.036,0.918,positive,The Ragged Trousered Philanthropists
