sentence,compound,positive,negative,neutral,label,title
"All during the day the forest about them had been filled with excited birds of brilliant plumage, and dancing, chattering monkeys, who watched these new arrivals and their wonderful nest building operations with every mark of keenest interest and fascination.",0.9584,0.358,0.0,0.642,positive,Tarzan of the Apes
"Notwithstanding that both Clayton and his wife kept a sharp lookout they saw nothing of larger animals, though on two occasions they had seen their little simian neighbors come screaming and chattering from the near-by ridge, casting frightened glances back over their little shoulders, and evincing as plainly as though by speech that they were fleeing some terrible thing which lay concealed there.",-0.8225,0.0,0.127,0.873,negative,Tarzan of the Apes
"Just before dusk Clayton finished his ladder, and, filling a great basin with water from the near-by stream, the two mounted to the comparative safety of their aerial chamber.",0.7845,0.21,0.0,0.79,positive,Tarzan of the Apes
"As it was quite warm, Clayton had left the side curtains thrown back over the roof, and as they sat, like Turks, upon their blankets, Lady Alice, straining her eyes into the darkening shadows of the wood, suddenly reached out and grasped Clayton's arms.",0.4201,0.126,0.048,0.827,positive,Tarzan of the Apes
"""John,"" she whispered, ""look!",0.0,0.0,0.0,1.0,neutral,Tarzan of the Apes
"What is it, a man?""",0.0,0.0,0.0,1.0,neutral,Tarzan of the Apes
"As Clayton turned his eyes in the direction she indicated, he saw silhouetted dimly against the shadows beyond, a great figure standing upright upon the ridge.",0.6249,0.146,0.0,0.854,positive,Tarzan of the Apes
"For a moment it stood as though listening and then turned slowly, and melted into the shadows of the jungle.",0.0,0.0,0.0,1.0,neutral,Tarzan of the Apes
"""What is it, John?""",0.0,0.0,0.0,1.0,neutral,Tarzan of the Apes
"""I do not know, Alice,"" he answered gravely, ""it is too dark to see so far, and it may have been but a shadow cast by the rising moon.""",-0.1901,0.0,0.061,0.939,negative,Tarzan of the Apes
"""No, John, if it was not a man it was some huge and grotesque mockery of man.",0.0,0.124,0.124,0.753,neutral,Tarzan of the Apes
"Oh, I am afraid.""",0.0,0.0,0.0,1.0,neutral,Tarzan of the Apes
"He gathered her in his arms, whispering words of courage and love into her ears.",0.8126,0.363,0.0,0.637,positive,Tarzan of the Apes
"Soon after, he lowered the curtain walls, tying them securely to the trees so that, except for a little opening toward the beach, they were entirely enclosed.",0.2263,0.086,0.054,0.86,positive,Tarzan of the Apes
"As it was now pitch dark within their tiny aerie they lay down upon their blankets to try to gain, through sleep, a brief respite of forgetfulness.",0.5267,0.12,0.0,0.88,positive,Tarzan of the Apes
"Clayton lay facing the opening at the front, a rifle and a brace of revolvers at his hand.",0.4939,0.176,0.0,0.824,positive,Tarzan of the Apes
Scarcely had they closed their eyes than the terrifying cry of a panther rang out from the jungle behind them.,-0.7783,0.0,0.286,0.714,negative,Tarzan of the Apes
Closer and closer it came until they could hear the great beast directly beneath them.,0.6249,0.227,0.0,0.773,positive,Tarzan of the Apes
"For an hour or more they heard it sniffing and clawing at the trees which supported their platform, but at last it roamed away across the beach, where Clayton could see it clearly in the brilliant moonlight--a great, handsome beast, the largest he had ever seen.",0.9696,0.332,0.0,0.668,positive,Tarzan of the Apes
"During the long hours of darkness they caught but fitful snatches of sleep, for the night noises of a great jungle teeming with myriad animal life kept their overwrought nerves on edge, so that a hundred times they were startled to wakefulness by piercing screams, or the stealthy moving of great bodies beneath them.",0.802,0.173,0.139,0.688,positive,Tarzan of the Apes
CHAPTER III.,0.0,0.0,0.0,1.0,neutral,Tarzan of the Apes
"Life and Death Morning found them but little, if at all refreshed, though it was with a feeling of intense relief that they saw the day dawn.",0.5994,0.231,0.077,0.692,positive,Tarzan of the Apes
"As soon as they had made their meager breakfast of salt pork, coffee and biscuit, Clayton commenced work upon their house, for he realized that they could hope for no safety and no peace of mind at night until four strong walls effectually barred the jungle life from them.",0.8442,0.209,0.073,0.718,positive,Tarzan of the Apes
"The task was an arduous one and required the better part of a month, though he built but one small room.",0.2382,0.093,0.0,0.907,positive,Tarzan of the Apes
"He constructed his cabin of small logs about six inches in diameter, stopping the chinks with clay which he found at the depth of a few feet beneath the surface soil.",-0.1531,0.0,0.052,0.948,negative,Tarzan of the Apes
At one end he built a fireplace of small stones from the beach.,0.0,0.0,0.0,1.0,neutral,Tarzan of the Apes
These also he set in clay and when the house had been entirely completed he applied a coating of the clay to the entire outside surface to the thickness of four inches.,0.0,0.0,0.0,1.0,neutral,Tarzan of the Apes
"In the window opening he set small branches about an inch in diameter both vertically and horizontally, and so woven that they formed a substantial grating that could withstand the strength of a powerful animal.",0.7506,0.204,0.037,0.759,positive,Tarzan of the Apes
Thus they obtained air and proper ventilation without fear of lessening the safety of their cabin.,0.6628,0.279,0.0,0.721,positive,Tarzan of the Apes
"The A-shaped roof was thatched with small branches laid close together and over these long jungle grass and palm fronds, with a final coating of clay.",0.0,0.0,0.0,1.0,neutral,Tarzan of the Apes
"The door he built of pieces of the packing-boxes which had held their belongings, nailing one piece upon another, the grain of contiguous layers running transversely, until he had a solid body some three inches thick and of such great strength that they were both moved to laughter as they gazed upon it.",0.9022,0.201,0.0,0.799,positive,Tarzan of the Apes
"Here the greatest difficulty confronted Clayton, for he had no means whereby to hang his massive door now that he had built it.",-0.0516,0.142,0.216,0.642,negative,Tarzan of the Apes
"After two days' work, however, he succeeded in fashioning two massive hardwood hinges, and with these he hung the door so that it opened and closed easily.",0.6369,0.172,0.0,0.828,positive,Tarzan of the Apes
"The stuccoing and other final touches were added after they moved into the house, which they had done as soon as the roof was on, piling their boxes before the door at night and thus having a comparatively safe and comfortable habitation.",0.7351,0.137,0.0,0.863,positive,Tarzan of the Apes
"The building of a bed, chairs, table, and shelves was a relatively easy matter, so that by the end of the second month they were well settled, and, but for the constant dread of attack by wild beasts and the ever growing loneliness, they were not uncomfortable or unhappy.",-0.5386,0.199,0.19,0.611,negative,Tarzan of the Apes
"At night great beasts snarled and roared about their tiny cabin, but, so accustomed may one become to oft repeated noises, that soon they paid little attention to them, sleeping soundly the whole night through.",0.3716,0.07,0.0,0.93,positive,Tarzan of the Apes
"Thrice had they caught fleeting glimpses of great man-like figures like that of the first night, but never at sufficiently close range to know positively whether the half-seen forms were those of man or brute.",0.836,0.218,0.0,0.782,positive,Tarzan of the Apes
"The brilliant birds and the little monkeys had become accustomed to their new acquaintances, and as they had evidently never seen human beings before they presently, after their first fright had worn off, approached closer and closer, impelled by that strange curiosity which dominates the wild creatures of the forest and the jungle and the plain, so that within the first month several of the birds had gone so far as even to accept morsels of food from the friendly hands of the Claytons.",0.6369,0.114,0.07,0.816,positive,Tarzan of the Apes
"One afternoon, while Clayton was working upon an addition to their cabin, for he contemplated building several more rooms, a number of their grotesque little friends came shrieking and scolding through the trees from the direction of the ridge.",0.5244,0.109,0.0,0.891,positive,Tarzan of the Apes
"Ever as they fled they cast fearful glances back of them, and finally they stopped near Clayton jabbering excitedly to him as though to warn him of approaching danger.",-0.6808,0.089,0.266,0.645,negative,Tarzan of the Apes
"At last he saw it, the thing the little monkeys so feared--the man-brute of which the Claytons had caught occasional fleeting glimpses.",0.0,0.0,0.0,1.0,neutral,Tarzan of the Apes
"It was approaching through the jungle in a semi-erect position, now and then placing the backs of its closed fists upon the ground--a great anthropoid ape, and, as it advanced, it emitted deep guttural growls and an occasional low barking sound.",0.5859,0.134,0.073,0.793,positive,Tarzan of the Apes
"Clayton was at some distance from the cabin, having come to fell a particularly perfect tree for his building operations.",0.6115,0.182,0.0,0.818,positive,Tarzan of the Apes
"Grown careless from months of continued safety, during which time he had seen no dangerous animals during the daylight hours, he had left his rifles and revolvers all within the little cabin, and now that he saw the great ape crashing through the underbrush directly toward him, and from a direction which practically cut him off from escape, he felt a vague little shiver play up and down his spine.",0.1082,0.132,0.139,0.728,positive,Tarzan of the Apes
"He knew that, armed only with an ax, his chances with this ferocious monster were small indeed--and Alice; O God, he thought, what will become of Alice?",0.3612,0.138,0.049,0.813,positive,Tarzan of the Apes
There was yet a slight chance of reaching the cabin.,0.4215,0.352,0.0,0.648,positive,Tarzan of the Apes
"He turned and ran toward it, shouting an alarm to his wife to run in and close the great door in case the ape cut off his retreat.",0.34,0.172,0.131,0.698,positive,Tarzan of the Apes
"Lady Greystoke had been sitting a little way from the cabin, and when she heard his cry she looked up to see the ape springing with almost incredible swiftness, for so large and awkward an animal, in an effort to head off Clayton.",-0.6077,0.0,0.11,0.89,negative,Tarzan of the Apes
"With a low cry she sprang toward the cabin, and, as she entered, gave a backward glance which filled her soul with terror, for the brute had intercepted her husband, who now stood at bay grasping his ax with both hands ready to swing it upon the infuriated animal when he should make his final charge.",-0.8779,0.039,0.197,0.764,negative,Tarzan of the Apes
"""Close and bolt the door, Alice,"" cried Clayton.",-0.3818,0.0,0.271,0.729,negative,Tarzan of the Apes
"""I can finish this fellow with my ax.""",0.0,0.0,0.0,1.0,neutral,Tarzan of the Apes
"But he knew he was facing a horrible death, and so did she.",-0.9022,0.0,0.502,0.498,negative,Tarzan of the Apes
"The ape was a great bull, weighing probably three hundred pounds.",0.6249,0.313,0.0,0.687,positive,Tarzan of the Apes
"His nasty, close-set eyes gleamed hatred from beneath his shaggy brows, while his great canine fangs were bared in a horrid snarl as he paused a moment before his prey.",-0.802,0.104,0.287,0.609,negative,Tarzan of the Apes
"Over the brute's shoulder Clayton could see the doorway of his cabin, not twenty paces distant, and a great wave of horror and fear swept over him as he saw his young wife emerge, armed with one of his rifles.",-0.4215,0.087,0.147,0.766,negative,Tarzan of the Apes
"She had always been afraid of firearms, and would never touch them, but now she rushed toward the ape with the fearlessness of a lioness protecting its young.",0.3919,0.092,0.0,0.908,positive,Tarzan of the Apes
"""Back, Alice,"" shouted Clayton, ""for God's sake, go back.""",0.0,0.0,0.0,1.0,neutral,Tarzan of the Apes
"But she would not heed, and just then the ape charged, so that Clayton could say no more.",-0.6124,0.0,0.238,0.762,negative,Tarzan of the Apes
"The man swung his ax with all his mighty strength, but the powerful brute seized it in those terrible hands, and tearing it from Clayton's grasp hurled it far to one side.",0.1655,0.149,0.107,0.745,positive,Tarzan of the Apes
"With an ugly snarl he closed upon his defenseless victim, but ere his fangs had reached the throat they thirsted for, there was a sharp report and a bullet entered the ape's back between his shoulders.",-0.4215,0.043,0.146,0.811,negative,Tarzan of the Apes
Throwing Clayton to the ground the beast turned upon his new enemy.,-0.5423,0.0,0.241,0.759,negative,Tarzan of the Apes
"There before him stood the terrified girl vainly trying to fire another bullet into the animal's body; but she did not understand the mechanism of the firearm, and the hammer fell futilely upon an empty cartridge.",-0.6597,0.0,0.162,0.838,negative,Tarzan of the Apes
"Almost simultaneously Clayton regained his feet, and without thought of the utter hopelessness of it, he rushed forward to drag the ape from his wife's prostrate form.",-0.7184,0.0,0.194,0.806,negative,Tarzan of the Apes
"With little or no effort he succeeded, and the great bulk rolled inertly upon the turf before him--the ape was dead.",0.1725,0.229,0.207,0.564,positive,Tarzan of the Apes
The bullet had done its work.,0.0,0.0,0.0,1.0,neutral,Tarzan of the Apes
"A hasty examination of his wife revealed no marks upon her, and Clayton decided that the huge brute had died the instant he had sprung toward Alice.",-0.5423,0.074,0.186,0.74,negative,Tarzan of the Apes
"Gently he lifted his wife's still unconscious form, and bore her to the little cabin, but it was fully two hours before she regained consciousness.",0.128,0.075,0.057,0.868,positive,Tarzan of the Apes
Her first words filled Clayton with vague apprehension.,-0.5423,0.0,0.429,0.571,negative,Tarzan of the Apes
"For some time after regaining her senses, Alice gazed wonderingly about the interior of the little cabin, and then, with a satisfied sigh, said: ""O, John, it is so good to be really home!",0.7866,0.209,0.0,0.791,positive,Tarzan of the Apes
"I have had an awful dream, dear.",0.1531,0.434,0.283,0.283,positive,Tarzan of the Apes
"I thought we were no longer in London, but in some horrible place where great beasts attacked us.""",-0.5719,0.195,0.357,0.448,negative,Tarzan of the Apes
"""There, there, Alice,"" he said, stroking her forehead, ""try to sleep again, and do not worry your head about bad dreams.""",-0.2718,0.097,0.141,0.763,negative,Tarzan of the Apes
"That night a little son was born in the tiny cabin beside the primeval forest, while a leopard screamed before the door, and the deep notes of a lion's roar sounded from beyond the ridge.",-0.3182,0.0,0.069,0.931,negative,Tarzan of the Apes
"Lady Greystoke never recovered from the shock of the great ape's attack, and, though she lived for a year after her baby was born, she was never again outside the cabin, nor did she ever fully realize that she was not in England.",-0.1531,0.084,0.117,0.799,negative,Tarzan of the Apes
"Sometimes she would question Clayton as to the strange noises of the nights; the absence of servants and friends, and the strange rudeness of the furnishings within her room, but, though he made no effort to deceive her, never could she grasp the meaning of it all.",-0.7814,0.038,0.202,0.76,negative,Tarzan of the Apes
"In other ways she was quite rational, and the joy and happiness she took in the possession of her little son and the constant attentions of her husband made that year a very happy one for her, the happiest of her young life.",0.9485,0.291,0.0,0.709,positive,Tarzan of the Apes
"That it would have been beset by worries and apprehension had she been in full command of her mental faculties Clayton well knew; so that while he suffered terribly to see her so, there were times when he was almost glad, for her sake, that she could not understand.",-0.8357,0.079,0.21,0.711,negative,Tarzan of the Apes
"Long since had he given up any hope of rescue, except through accident.",0.4767,0.321,0.161,0.518,positive,Tarzan of the Apes
With unremitting zeal he had worked to beautify the interior of the cabin.,0.5106,0.216,0.0,0.784,positive,Tarzan of the Apes
Skins of lion and panther covered the floor.,0.0,0.0,0.0,1.0,neutral,Tarzan of the Apes
Cupboards and bookcases lined the walls.,0.0,0.0,0.0,1.0,neutral,Tarzan of the Apes
Odd vases made by his own hand from the clay of the region held beautiful tropical flowers.,0.7003,0.303,0.098,0.598,positive,Tarzan of the Apes
"Curtains of grass and bamboo covered the windows, and, most arduous task of all, with his meager assortment of tools he had fashioned lumber to neatly seal the walls and ceiling and lay a smooth floor within the cabin.",0.34,0.061,0.0,0.939,positive,Tarzan of the Apes
That he had been able to turn his hands at all to such unaccustomed labor was a source of mild wonder to him.,0.0,0.0,0.0,1.0,neutral,Tarzan of the Apes
"But he loved the work because it was for her and the tiny life that had come to cheer them, though adding a hundredfold to his responsibilities and to the terribleness of their situation.",0.7876,0.225,0.088,0.687,positive,Tarzan of the Apes
"During the year that followed, Clayton was several times attacked by the great apes which now seemed to continually infest the vicinity of the cabin; but as he never again ventured outside without both rifle and revolvers he had little fear of the huge beasts.",-0.0927,0.105,0.112,0.783,negative,Tarzan of the Apes
"He had strengthened the window protections and fitted a unique wooden lock to the cabin door, so that when he hunted for game and fruits, as it was constantly necessary for him to do to insure sustenance, he had no fear that any anim",-0.3818,0.058,0.112,0.83,negative,Tarzan of the Apes
