sentence,compound,positive,negative,neutral,label,title
"Indeed, at moments of the kind his discourse had assumed something of a literary vein, in that invariably he had stated that, being a worm of no account in the world, he was deserving of no consideration at the hands of his fellows; that in his time he had undergone many strange experiences; that subsequently he had suffered much in the cause of Truth; that he had many enemies seeking his life; and that, being desirous of rest, he was now engaged in searching for a spot wherein to dwell--wherefore, having stumbled upon the town in which he now found himself, he had considered it his bounden duty to evince his respect for the chief authorities of the place.",0.296,0.104,0.095,0.801,positive,Dead Souls
"This, and no more, was all that, for the moment, the town succeeded in learning about the new arrival.",0.1531,0.127,0.1,0.773,positive,Dead Souls
Naturally he lost no time in presenting himself at the Governor's evening party.,-0.2023,0.157,0.262,0.581,negative,Dead Souls
"First, however, his preparations for that function occupied a space of over two hours, and necessitated an attention to his toilet of a kind not commonly seen.",0.5267,0.124,0.0,0.876,positive,Dead Souls
"That is to say, after a brief post-prandial nap he called for soap and water, and spent a considerable period in the task of scrubbing his cheeks (which, for the purpose, he supported from within with his tongue) and then of drying his full, round face, from the ears downwards, with a towel which he took from the waiter's shoulder.",0.3182,0.039,0.0,0.961,positive,Dead Souls
"Twice he snorted into the waiter's countenance as he did this, and then he posted himself in front of the mirror, donned a false shirt-front, plucked out a couple of hairs which were protruding from his nose, and appeared vested in a frockcoat of bilberry-coloured check.",0.1531,0.037,0.0,0.963,positive,Dead Souls
"Thereafter driving through broad streets sparsely lighted with lanterns, he arrived at the Governor's residence to find it illuminated as for a ball.",0.0,0.0,0.0,1.0,neutral,Dead Souls
"Barouches with gleaming lamps, a couple of gendarmes posted before the doors, a babel of postillions' cries--nothing of a kind likely to be impressive was wanting; and, on reaching the salon, the visitor actually found himself obliged to close his eyes for a moment, so strong was the mingled sheen of lamps, candles, and feminine apparel.",0.9143,0.21,0.0,0.79,positive,Dead Souls
"Everything seemed suffused with light, and everywhere, flitting and flashing, were to be seen black coats--even as on a hot summer's day flies revolve around a sugar loaf while the old housekeeper is cutting it into cubes before the open window, and the children of the house crowd around her to watch the movements of her rugged hands as those members ply the smoking pestle; and airy squadrons of flies, borne on the breeze, enter boldly, as though free of the house, and, taking advantage of the fact that the glare of the sunshine is troubling the old lady's sight, disperse themselves over broken and unbroken fragments alike, even though the lethargy induced by the opulence of summer and the rich shower of dainties to be encountered at every step has induced them to enter less for the purpose of eating than for that of showing themselves in public, of parading up and down the sugar loaf, of rubbing both their hindquarters and their fore against one another, of cleaning their bodies under the wings, of extending their forelegs over their heads and grooming themselves, and of flying out of the window again to return with other predatory squadrons.",0.6249,0.069,0.049,0.882,positive,Dead Souls
"Indeed, so dazed was Chichikov that scarcely did he realise that the Governor was taking him by the arm and presenting him to his (the Governor's) lady.",-0.2484,0.0,0.071,0.929,negative,Dead Souls
Yet the newly-arrived guest kept his head sufficiently to contrive to murmur some such compliment as might fittingly come from a middle-aged individual of a rank neither excessively high nor excessively low.,0.6012,0.149,0.0,0.851,positive,Dead Souls
"Next, when couples had been formed for dancing and the remainder of the company found itself pressed back against the walls, Chichikov folded his arms, and carefully scrutinised the dancers.",0.128,0.049,0.0,0.951,positive,Dead Souls
"Some of the ladies were dressed well and in the fashion, while the remainder were clad in such garments as God usually bestows upon a provincial town.",0.4939,0.149,0.0,0.851,positive,Dead Souls
"Also here, as elsewhere, the men belonged to two separate and distinct categories; one of which comprised slender individuals who, flitting around the ladies, were scarcely to be distinguished from denizens of the metropolis, so carefully, so artistically, groomed were their whiskers, so presentable their oval, clean-shaven faces, so easy the manner of their dancing attendance upon their womenfolk, so glib their French conversation as they quizzed their female companions.",0.6939,0.078,0.0,0.922,positive,Dead Souls
"As for the other category, it comprised individuals who, stout, or of the same build as Chichikov (that is to say, neither very portly nor very lean), backed and sidled away from the ladies, and kept peering hither and thither to see whether the Governor's footmen had set out green tables for whist.",0.1078,0.031,0.024,0.945,positive,Dead Souls
"Their features were full and plump, some of them had beards, and in no case was their hair curled or waved or arranged in what the French call ""the devil-may-care"" style.",-0.296,0.0,0.068,0.932,negative,Dead Souls
"On the contrary, their heads were either close-cropped or brushed very smooth, and their faces were round and firm.",0.0,0.0,0.0,1.0,neutral,Dead Souls
This category represented the more respectable officials of the town.,0.4927,0.262,0.0,0.738,positive,Dead Souls
"In passing, I may say that in business matters fat men always prove superior to their leaner brethren; which is probably the reason why the latter are mostly to be found in the Political Police, or acting as mere ciphers whose existence is a purely hopeless, airy, trivial one.",-0.0146,0.088,0.089,0.823,neutral,Dead Souls
"Again, stout individuals never take a back seat, but always a front one, and, wheresoever it be, they sit firmly, and with confidence, and decline to budge even though the seat crack and bend with their weight.",0.7003,0.149,0.0,0.851,positive,Dead Souls
"For comeliness of exterior they care not a rap, and therefore a dress coat sits less easily on their figures than is the case with figures of leaner individuals.",0.6494,0.175,0.0,0.825,positive,Dead Souls
Yet invariably fat men amass the greater wealth.,0.6908,0.487,0.0,0.513,positive,Dead Souls
"In three years' time a thin man will not have a single serf whom he has left unpledged; whereas--well, pray look at a fat man's fortunes, and what will you see?",0.3182,0.078,0.0,0.922,positive,Dead Souls
"First of all a suburban villa, and then a larger suburban villa, and then a villa close to a town, and lastly a country estate which comprises every amenity!",0.0,0.0,0.0,1.0,neutral,Dead Souls
"That is to say, having served both God and the State, the stout individual has won universal respect, and will end by retiring from business, reordering his mode of life, and becoming a Russian landowner--in other words, a fine gentleman who dispenses hospitality, lives in comfort and luxury, and is destined to leave his property to heirs who are purposing to squander the same on foreign travel.",0.9136,0.201,0.016,0.783,positive,Dead Souls
That the foregoing represents pretty much the gist of Chichikov's reflections as he stood watching the company I will not attempt to deny.,0.6412,0.207,0.0,0.793,positive,Dead Souls
"And of those reflections the upshot was that he decided to join himself to the stouter section of the guests, among whom he had already recognised several familiar faces--namely, those of the Public Prosecutor (a man with beetling brows over eyes which seemed to be saying with a wink, ""Come into the next room, my friend, for I have something to say to you""--though, in the main, their owner was a man of grave and taciturn habit), of the Postmaster (an insignificant-looking individual, yet a would-be wit and a philosopher), and of the President of the Local Council (a man of much amiability and good sense).",0.6908,0.077,0.024,0.899,positive,Dead Souls
"These three personages greeted Chichikov as an old acquaintance, and to their salutations he responded with a sidelong, yet a sufficiently civil, bow.",0.2732,0.095,0.0,0.905,positive,Dead Souls
"Also, he became acquainted with an extremely unctuous and approachable landowner named Manilov, and with a landowner of more uncouth exterior named Sobakevitch--the latter of whom began the acquaintance by treading heavily upon Chichikov's toes, and then begging his pardon.",0.3182,0.057,0.0,0.943,positive,Dead Souls
"Next, Chichikov received an offer of a ""cut in"" at whist, and accepted the same with his usual courteous inclination of the head.",0.5106,0.204,0.079,0.717,positive,Dead Souls
"Seating themselves at a green table, the party did not rise therefrom till supper time; and during that period all conversation between the players became hushed, as is the custom when men have given themselves up to a really serious pursuit.",0.2748,0.065,0.039,0.896,positive,Dead Souls
"Even the Postmaster--a talkative man by nature--had no sooner taken the cards into his hands than he assumed an expression of profound thought, pursed his lips, and retained this attitude unchanged throughout the game.",-0.2732,0.031,0.062,0.907,negative,Dead Souls
"Only when playing a court card was it his custom to strike the table with his fist, and to exclaim (if the card happened to be a queen), ""Now, old popadia 7 !""",0.1511,0.066,0.047,0.886,positive,Dead Souls
"and (if the card happened to be a king), ""Now, peasant of Tambov!""",0.0,0.0,0.0,1.0,neutral,Dead Souls
"To which ejaculations invariably the President of the Local Council retorted, ""Ah, I have him by the ears, I have him by the ears!""",0.0,0.0,0.0,1.0,neutral,Dead Souls
"And from the neighbourhood of the table other strong ejaculations relative to the play would arise, interposed with one or another of those nicknames which participants in a game are apt to apply to me",0.6908,0.151,0.0,0.849,positive,Dead Souls
