sentence,compound,positive,negative,neutral,label,title
His chin was large and extraordinarily long.,0.0,0.0,0.0,1.0,neutral,The Ragged Trousered Philanthropists
"The eyes were pale blue, very small and close together, surmounted by spare, light-coloured, almost invisible eyebrows, with a deep vertical cleft between them over the nose.",0.0,0.0,0.0,1.0,neutral,The Ragged Trousered Philanthropists
"His head, covered with thick, coarse brown hair, was very large at the back; the ears were small and laid close to the head.",0.0,0.0,0.0,1.0,neutral,The Ragged Trousered Philanthropists
If one were to make a full-face drawing of his cadaverous visage it would be found that the outline resembled that of the lid of a coffin.,0.0,0.0,0.0,1.0,neutral,The Ragged Trousered Philanthropists
"This man had been with Rushton--no one had ever seen the ""Co.""--for fifteen years, in fact almost from the time when the latter commenced business.",0.0,0.0,0.0,1.0,neutral,The Ragged Trousered Philanthropists
Rushton had at that period realized the necessity of having a deputy who could be used to do all the drudgery and running about so that he himself might be free to attend to the more pleasant or profitable matters.,0.8795,0.242,0.0,0.758,positive,The Ragged Trousered Philanthropists
"Hunter was then a journeyman, but was on the point of starting on his own account, when Rushton offered him a constant job as foreman, two pounds a week, and two and a half per cent of the profits of all work done.",0.5927,0.092,0.0,0.908,positive,The Ragged Trousered Philanthropists
On the face of it this appeared a generous offer.,0.5106,0.292,0.0,0.708,positive,The Ragged Trousered Philanthropists
"Hunter closed with it, gave up the idea of starting for himself, and threw himself heart and mind into the business.",0.0,0.0,0.0,1.0,neutral,The Ragged Trousered Philanthropists
When an estimate was to be prepared it was Hunter who measured up the work and laboriously figured out the probable cost.,0.2263,0.083,0.0,0.917,positive,The Ragged Trousered Philanthropists
"When their tenders were accepted it was he who superintended the work and schemed how to scamp it, where possible, using mud where mortar was specified, mortar where there ought to have been cement, sheet zinc where they were supposed to put sheet lead, boiled oil instead of varnish, and three coats of paint where five were paid for.",0.4019,0.061,0.0,0.939,positive,The Ragged Trousered Philanthropists
"In fact, scamping the work was with this man a kind of mania.",0.0,0.0,0.0,1.0,neutral,The Ragged Trousered Philanthropists
It grieved him to see anything done properly.,-0.4588,0.0,0.3,0.7,negative,The Ragged Trousered Philanthropists
"Even when it was more economical to do a thing well, he insisted from force of habit on having it scamped.",0.2732,0.1,0.0,0.9,positive,The Ragged Trousered Philanthropists
"Then he was almost happy, because he felt that he was doing someone down.",0.5279,0.208,0.0,0.792,positive,The Ragged Trousered Philanthropists
"If there were an architect superintending the work, Misery would square him or bluff him.",-0.5719,0.0,0.209,0.791,negative,The Ragged Trousered Philanthropists
If it w,0.0,0.0,0.0,1.0,neutral,The Ragged Trousered Philanthropists
