sentence,compound,positive,negative,neutral,label,title
"Sam Bolton, with a muttered word of thanks, stuffed his awkwardly into his shirt bosom.",0.1531,0.169,0.134,0.698,positive,The silent places
"Dick, on the other hand, with a gesture half of gallantry, half of bravado, stripped his own handkerchief from his neck and cast it far into the current, knotting the girl's gift in its place.",0.7506,0.226,0.077,0.698,positive,The silent places
Virginia smiled.,0.5423,0.778,0.0,0.222,positive,The silent places
A strong push sent the canoe into the current.,0.5106,0.32,0.0,0.68,positive,The silent places
They began to paddle up-stream.,0.0,0.0,0.0,1.0,neutral,The silent places
"For perhaps a mile their course threaded in and out the channel of a number of islands, then shot them into the broad reach of the Moose itself.",0.1027,0.091,0.0,0.909,positive,The silent places
"There they set themselves to straight-forward paddling, hugging closely the shore that they might escape as much as possible the full strength of the current.",0.7717,0.259,0.0,0.741,positive,The silent places
"In this manner they made rapid progress, for, of course, they paddled in the Indian fashion--without bending either elbow, and with a strong thrust forward of the shoulders at the end of the stroke--and they understood well how to take advantage of each little back eddy.",0.8481,0.199,0.0,0.801,positive,The silent places
"After an hour and a half they came to the first unimportant rapids, where they were forced to drop their paddles and to use the long spruce-poles they had cut and peeled that morning.",-0.8176,0.0,0.247,0.753,negative,The silent places
Dick had the bow.,-0.5106,0.0,0.524,0.476,negative,The silent places
"It was beautiful to see him standing boldly upright, his feet apart, leaning back against the pressure, making head against the hurrying water.",0.6369,0.224,0.077,0.699,positive,The silent places
"In a moment the canoe reached the point of hardest suction, where the river broke over the descent.",-0.34,0.073,0.146,0.781,negative,The silent places
"Then the young man, taking a deep breath, put forth the strength that was in him.",0.4939,0.186,0.0,0.814,positive,The silent places
"Sam Bolton, poised in the stern, holding the canoe while his companion took a fresh hold, noted with approval the boy's physical power, the certainty of his skill at the difficult river work, the accuracy of his calculations.",0.7096,0.214,0.057,0.729,positive,The silent places
"Whatever his heedlessness, Dick Herron knew his trade.",-0.5106,0.0,0.32,0.68,negative,The silent places
"It was, indeed, a powerful Instrument that Galen Albret in his wisdom had placed in Sam Bolton's hands.",0.7351,0.292,0.0,0.708,positive,The silent places
"The canoe, torn from the rapid's grasp, shot into the smooth water above.",-0.25,0.0,0.143,0.857,negative,The silent places
Calmly Sam and Dick shook the water from their poles and laid them across the thwarts.,-0.4215,0.113,0.299,0.588,negative,The silent places
The swish click!,0.0,0.0,0.0,1.0,neutral,The silent places
swish click!,0.0,0.0,0.0,1.0,neutral,The silent places
of the paddles resumed.,0.0,0.0,0.0,1.0,neutral,The silent places
Now the river began to hurry in the ten-mile descent below the Abítibi.,0.0,0.0,0.0,1.0,neutral,The silent places
"Although the smooth rush of water was unbroken by the swirls of rapids, nevertheless the current proved too strong for paddling.",0.5106,0.142,0.0,0.858,positive,The silent places
"The voyagers were forced again to the canoe poles, and so toiled in graceful but strenuous labour the remaining hours of their day's journey.",0.034,0.082,0.077,0.842,neutral,The silent places
"When finally they drew ashore for the night, they had but just passed the mouth of French River.",0.0,0.0,0.0,1.0,neutral,The silent places
"To men as skilled as they, the making of camp was a brief affair.",0.0,0.0,0.0,1.0,neutral,The silent places
"Dick, with his axe, cleared the space of underbrush, and sought dry wood for fuel.",-0.5106,0.077,0.26,0.663,negative,The silent places
The older man in the meantime hunted about until he found a dead white-birch sapling.,-0.6486,0.0,0.249,0.751,negative,The silent places
This he easily thrust to the ground with a strong push of his hand.,0.836,0.471,0.0,0.529,positive,The silent places
"The jar burst here and there the hard envelope of the birch bark to expose a quantity of half-powdery, decayed wood, dry as tinder and almost as inflammable as gunpowder.",-0.5574,0.0,0.177,0.823,negative,The silent places
Into a handful of this Sam threw the sparks from his flint and steel.,0.0,0.0,0.0,1.0,neutral,The silent places
The bark itself fed admirably the first flame.,0.5423,0.333,0.0,0.667,positive,The silent places
"By the time Dick returned, the fire was ready for his fuel.",-0.4939,0.145,0.331,0.523,negative,The silent places
"They cooked tea in the copper pail, and roasted bacon on the ends of switches.",0.0,0.0,0.0,1.0,neutral,The silent places
"This, with bread from the Post, constituted their meal.",0.0,0.0,0.0,1.0,neutral,The silent places
"After supper they smoked, banked the fire with green wood, and rolled themselves in their blankets to sleep.",-0.34,0.0,0.124,0.876,negative,The silent places
"It was summer, so they did not trouble to pitch their shelter.",0.3089,0.17,0.0,0.83,positive,The silent places
The night died into silence.,-0.5574,0.0,0.474,0.526,negative,The silent places
Slowly the fire worked from within through the chinks of the green logs.,-0.34,0.0,0.167,0.833,negative,The silent places
"Forest creatures paused to stare at it with steady eyes, from which flashed back a blaze as intense as the fire's own.",0.0772,0.061,0.0,0.939,positive,The silent places
An owl took his station near and began to call.,0.0,0.0,0.0,1.0,neutral,The silent places
Overhead the brilliant aurora of the Far North palpitated in a silence that seemed uncanny when coupled with such intensity of movement.,0.5859,0.16,0.0,0.84,positive,The silent places
Shadows stole here and there like acolytes.,0.3612,0.294,0.0,0.706,positive,The silent places
Breezes rose and died like the passing of a throng.,-0.2732,0.191,0.275,0.534,negative,The silent places
"The woods were peopled with uncanny influences, intangible, unreal, yet potent with the symbolism of the unknown Presence watching these men.",0.0,0.0,0.0,1.0,neutral,The silent places
"The North, calm, patient, biding her time, serene in the assurance of might, drew close to the camp in the wilderness.",0.7717,0.3,0.0,0.7,positive,The silent places
By and by a little pack of wolves came and squatted on their haunches just in the shadow.,0.0,0.0,0.0,1.0,neutral,The silent places
"They were well fed and harmless, but they sat there blinking lazily at the flames, their tongues lolling, exactly like so many shaggy and good-humoured dogs.",0.6486,0.215,0.0,0.785,positive,The silent places
About two o'clock Dick rolled out of his blanket and replenished the fire.,-0.6908,0.0,0.341,0.659,negative,The silent places
"He did it somnolently, his eyes vacant, his expression that of a child.",0.0,0.0,0.0,1.0,neutral,The silent places
"Then he took a half-comprehending glance at the heaven's promise of fair weather, and sank again into the warmth of his blanket.",0.765,0.297,0.0,0.703,positive,The silent places
The wolves had not stirred.,0.0,0.0,0.0,1.0,neutral,The silent places
"CHAPTER FIVE Now the small sack of flour and the side of bacon and the loose provisions brought from the Post could last but a little time, and the journey was like to be long.",0.3818,0.088,0.045,0.867,positive,The silent places
"The travellers were to be forced from now on, just as are the wolves, the eagles, the hawks, the carcajous, and other predatory creatures of the woods, to give their first thoughts to the day's sustenance.",-0.4588,0.0,0.079,0.921,negative,The silent places
All other considerations gave way to this.,0.0,0.0,0.0,1.0,neutral,The silent places
"This was the first, the daily tribute to be wrested from the stubborn grasp of the North.",-0.4019,0.0,0.144,0.856,negative,The silent places
"Winning that, anything was possible; failing that, nothing could follow but defeat.",-0.6059,0.127,0.354,0.519,negative,The silent places
"Therefore, valuable exceedingly were the two little steel traps and the twelve-foot length of gill-net, the sharp, thin knives in the beaded sheaths, and especially precious, precious above all things else, the three hundred rounds of ammunition for the rifles.",0.9019,0.231,0.0,0.769,positive,The silent places
They must be guarded and cared for and saved.,0.6808,0.444,0.0,0.556,positive,The silent places
Therefore an incident of the early afternoon was more than welcome.,0.507,0.247,0.0,0.753,positive,The silent places
"All the morning they had toiled against the current, sometimes poling, sometimes ""tracking"" by means of a sixty-foot cod-line.",0.0,0.0,0.0,1.0,neutral,The silent places
"Dick looped this across his chest and pulled like a horse on the tow-path, while Sam Bolton sat in the stern with the steering-paddle.",-0.2023,0.093,0.123,0.784,negative,The silent places
"The banks were sometimes precipitous, sometimes stony, sometimes grown to the water's edge with thick vegetation.",0.0,0.0,0.0,1.0,neutral,The silent places
"Dick had often to wade, often to climb and scramble, sometimes even to leap from one foothold to another.",-0.5106,0.0,0.155,0.845,negative,The silent places
Only rarely did he enjoy level footing and the opportunity for a straight pull.,0.2668,0.271,0.152,0.577,positive,The silent places
"Suddenly in a shallow pool, near the river's edge, and bordered with waist-high grass, he came upon a flock of black ducks.",0.0,0.0,0.0,1.0,neutral,The silent places
"They were full grown, but as yet unable to fly.",0.0,0.0,0.0,1.0,neutral,The silent places
Dick dropped his tow-line and ran forward with a shout.,-0.5106,0.0,0.292,0.708,negative,The silent places
"At once the ducks became confused, scattering in all directions, squawking madly, spattering the water.",-0.6124,0.0,0.278,0.722,negative,The silent places
The mother flew.,0.0,0.0,0.0,1.0,neutral,The silent places
"The brood, instead of making for the open river, where it would have been safe, scuttled into the tall grasses.",0.4404,0.132,0.0,0.868,positive,The silent places
Here was the chance for fresh meat without the expenditure of a shot.,0.5106,0.301,0.0,0.699,positive,The silent places
Sam Bolton promptly disembarked.,0.0,0.0,0.0,1.0,neutral,The silent places
To us it would have seemed a simple matter.,0.0258,0.136,0.0,0.864,neutral,The silent places
"But the black duck is an expert at concealment, even in the open.",0.0,0.0,0.0,1.0,neutral,The silent places
He can do wonders at it when assisted by the shadows of long grass.,0.0,0.0,0.0,1.0,neutral,The silent places
"And when too closely approached he can glide away to right and left like a snake, leaving no rustle to betray his passage.",-0.5994,0.09,0.229,0.681,negative,The silent places
Five minutes passed before the first was discovered.,0.0,0.0,0.0,1.0,neutral,The silent places
"Then it was only because Dick's keen eye had detected a faintly stirring grass-blade ten feet away, and because Dick's quick muscles had brought him like a tiger to the spot.",0.6124,0.156,0.0,0.844,positive,The silent places
He held up his victim by the neck.,-0.2732,0.0,0.231,0.769,negative,The silent places
"""Good enough,"" growled Sam.",0.4404,0.492,0.0,0.508,positive,The silent places
"And although they had seen nine ducks go into the grass plot, which was not more than fifty feet across, they succeeded in finding but three.",0.2263,0.071,0.0,0.929,positive,The silent places
"However, they were satisfied.",0.4215,0.483,0.0,0.517,positive,The silent places
"In spite of the deliberation of their journeying, the Indians did not overtake them until nearly dark.",-0.5267,0.0,0.175,0.825,negative,The silent places
It was just above the junction of the Abítibi.,0.0,0.0,0.0,1.0,neutral,The silent places
"The river was without current, the atmosphere without the suspicion of a breeze.",0.2924,0.166,0.0,0.834,positive,The silent places
"Down to the very water's edge grew the forest, so velvet-dark that one could not have guessed where the shadow left off and the reflection began.",0.0,0.0,0.0,1.0,neutral,The silent places
"Not a ripple disturbed the peace of the water, nor a harsh sound the twilight peace of the air.",0.8907,0.471,0.0,0.529,positive,The silent places
"Sam and Dick had paddled for some time close to one bank, and now had paused to enjoy their pipes and the cool of the evening.",0.296,0.173,0.104,0.723,positive,The silent places
"Suddenly against the reflected sky at the lower bend a canoe loomed into sight, and crept smoothly and noiselessly under the forest shadow of the opposite bank.",-0.5106,0.0,0.152,0.848,negative,The silent places
"Another followed, then another, and another and still another in regular interval.",0.0,0.0,0.0,1.0,neutral,The silent places
Not a sound could be heard.,0.0,0.0,0.0,1.0,neutral,The silent places
"In the distance their occupants gave the illusion of cowled figures,--the Indian women close wrapped in their shawls, dropping their heads modestly or turning them aside as their customs commanded them to do on encountering strangers.",0.0,0.0,0.0,1.0,neutral,The silent places
"Against the evening glow of the reflected sky for a single instant they stood out in the bright yellow of the new birch-bark, the glow of warm colour on the women's dress.",0.5859,0.142,0.0,0.858,positive,The silent places
"Then instantaneously, in the darkness of the opposite bank, they faded wraith-like and tenuous.",-0.25,0.0,0.133,0.867,negative,The silent places
"Like phantoms of the past they glided by, a river's width away; then vanished around the upper bend.",0.3612,0.135,0.0,0.865,positive,The silent places
A moment later the river was empty.,-0.2023,0.0,0.265,0.735,negative,The silent places
"""Th' squaws goin' ahead to start camp,"" commented Sam Bolton, indifferently; ""we'll have th' bucks along pretty quick.""",0.4939,0.158,0.0,0.842,positive,The silent places
"They drove their paddles strongly, and drifted to the middle of the river.",0.2732,0.149,0.0,0.851,positive,The silent places
"Soon became audible shouts, cries, and laughter, the click of canoe poles.",0.128,0.201,0.17,0.629,positive,The silent places
The business of the day was over.,0.0,0.0,0.0,1.0,neutral,The silent places
"Until nearly sundown the men's canoes had led, silent, circumspect, seeking game at every bend of the river.",0.0,0.0,0.0,1.0,neutral,The silent places
Now the squaws had gone on to make camp.,0.0,0.0,0.0,1.0,neutral,The silent places
No more game was to be expected.,-0.296,0.0,0.268,0.732,negative,The silent places
"The band relaxed, joking, skylarking, glad to be relieved for a little while of the strain of attention.",0.8591,0.448,0.05,0.502,positive,The silent places
"In a moment the canoes appeared, a long, unbroken string, led by Haukemah.",0.0,0.0,0.0,1.0,neutral,The silent places
"In the bow sat the chief's son, a lad of nine, wielding his little paddle skilfully, already intelligent to twist the prow sharply away from submerged rocks, learning to be a canoe-man so that in the time to come he might go on the Long Trail.",0.4588,0.065,0.0,0.935,positive,The silent places
"Each canoe contained, besides its two occupants, a variety of household goods, and a dog or two coiled and motionless, his sharp nose resting between his outstretched forepaws.",0.0,0.0,0.0,1.0,neutral,The silent places
The tame crow occupied an ingenious cage of twisted osiers.,0.0,0.0,0.0,1.0,neutral,The silent places
"Haukemah greeted the two white men cordially, and stopped paddling to light his pipe.",0.0516,0.131,0.119,0.75,positive,The silent places
One by one the other canoes joined them.,0.0,0.0,0.0,1.0,neutral,The silent places
A faint haze of tobacco rose from the drifting group.,0.0,0.0,0.0,1.0,neutral,The silent places
"""My brothers have made a long sun,"" observed old Haukemah.",0.0,0.0,0.0,1.0,neutral,The silent places
"""We, too, have hastened.",0.0,0.0,0.0,1.0,neutral,The silent places
"Now we have met, and it is well.",0.2732,0.231,0.0,0.769,positive,The silent places
Down past the white rock it became the fortune of Two-fingers to slay a caribou that stood by the little water [3] .,0.0,0.0,0.0,1.0,neutral,The silent places
Also had we whitefish the evening before.,0.0,0.0,0.0,1.0,neutral,The silent places
"Past the Island of the Three Trees were signs of moose.""",0.0,0.0,0.0,1.0,neutral,The silent places
"He was telling them the news, as one who passed the time of day.",0.0,0.0,0.0,1.0,neutral,The silent places
[3] A spring.,0.0,0.0,0.0,1.0,neutral,The silent places
"""We have killed but neenee-sheeb, the duck,"" replied Dick, holding up one of the victims by the neck, ""nor have we seen the trail of game.""",-0.8793,0.0,0.306,0.694,negative,The silent places
"""Ah hah,"" replied Haukemah, politely.",0.0,0.0,0.0,1.0,neutral,The silent places
He picked up his paddle.,0.0,0.0,0.0,1.0,neutral,The silent places
It was the signal to start.,0.0,0.0,0.0,1.0,neutral,The silent places
"""Drop in astern,"" said Dick to his companion in English, ""it's the light of the evening, and I'm going to troll for a pickerel.""",-0.6597,0.0,0.205,0.795,negative,The silent places
One by one the canoes fell into line.,0.0,0.0,0.0,1.0,neutral,The silent places
"Now, late in the day, the travel was most leisurely.",0.0,0.0,0.0,1.0,neutral,The silent places
A single strong stroke of the paddle was always succeeded by a pause of contemplation.,0.7269,0.357,0.0,0.643,positive,The silent places
"Nevertheless the light craft skimmed on with almost extraordinary buoyancy, and in silent regularity the wooded points of the river succeeded one another.",0.4215,0.113,0.0,0.887,positive,The silent places
"Sam busied himself with the trolling-spoon, but as soon as the last canoe was well beyond hearing he burst out: ""Dick, did you notice the Chippewa?""",0.3919,0.096,0.0,0.904,positive,The silent places
"""No.",0.0,0.0,0.0,1.0,neutral,The silent places
"What?""",0.0,0.0,0.0,1.0,neutral,The silent places
"""He understands English.""",0.0,0.0,0.0,1.0,neutral,The silent places
"""How do you know?""",0.0,0.0,0.0,1.0,neutral,The silent places
"""He was right behind us when you told me you were goin' to try the fishing, and he moved out th' way before we'd raised our paddles.""",0.0,0.0,0.0,1.0,neutral,The silent places
"""Might have been an accident.""",0.0,0.0,0.0,1.0,neutral,The silent places
"""Perhaps, but I don't believe it.",0.0,0.0,0.0,1.0,neutral,The silent places
He looked too almighty innocent.,0.34,0.375,0.0,0.625,positive,The silent places
"Another thing, did you notice he was alone in his canoe?""",-0.25,0.0,0.167,0.833,negative,The silent places
"""What of it?""",0.0,0.0,0.0,1.0,neutral,The silent places
"""Shows he ain't noways popular with th' rest.",-0.3252,0.0,0.25,0.75,negative,The silent places
Generally they pair off.,0.0,0.0,0.0,1.0,neutral,The silent places
"There's mostly something shady about these renegades.""",0.0,0.0,0.0,1.0,neutral,The silent places
"""Well?""",0.0,0.0,0.0,1.0,neutral,The silent places
"""Oh, nothing.",0.0,0.0,0.0,1.0,neutral,The silent places
"Only we got to be careful.""",0.0,0.0,0.0,1.0,neutral,The silent places
CHAPTER SIX Camp was made among the trees of an elevated bank above a small brook.,0.0,0.0,0.0,1.0,neutral,The silent places
"Already the Indian women had pitched the shelters, spreading squares of canvas, strips of birch-bark or tanned skins over roughly improvised lean-to poles.",0.0,0.0,0.0,1.0,neutral,The silent places
"A half dozen tiny fires, too, they had built, over which some were at the moment engaged in hanging as many kettles.",0.4019,0.119,0.0,0.881,positive,The silent places
Several of the younger women were cleaning fish and threading them on switches.,0.0,0.0,0.0,1.0,neutral,The silent places
Others brought in the small twigs for fuel.,0.0,0.0,0.0,1.0,neutral,The silent places
"Among them could be seen May-may-gwán, the young Ojibway girl, gliding here and there, eyes downcast, inexpressibly graceful in contrast with the Crees.",0.0516,0.112,0.104,0.784,positive,The silent places
At once on landing the men took up their share of the work.,0.296,0.155,0.0,0.845,positive,The silent places
Like the birds of the air and the beasts of the wood their first thoughts turned to the assurance of food.,0.5994,0.205,0.0,0.795,positive,The silent places
Two young fellows stretched a gill-net across the mouth of the creek.,0.0,0.0,0.0,1.0,neutral,The silent places
"Others scattered in search of favourable spots in which to set the musk-rat traps, to hang snares for rabbits and grouse.",0.0,0.0,0.0,1.0,neutral,The silent places
"Soon the camp took on the air of age, of long establishment, that is so suddenly to be won in the forest.",0.5719,0.15,0.0,0.85,positive,The silent places
The kettles began to bubble; the impaled fish to turn brown.,0.0,0.0,0.0,1.0,neutral,The silent places
A delicious odour of open-air cooking permeated the air.,0.5719,0.346,0.0,0.654,positive,The silent places
Men filled pipes and smoked in contemplation; children warmed themselves as near the tiny fires as they dared.,0.2732,0.11,0.0,0.89,positive,The silent places
"Out of the dense blackness of the forest from time to time staggered what at first looked to be an uncouth and misshapen monster, but which presently resolved itself into an Indian leaning under a burden of spruce-boughs, so smoothly laid along the haft of a long forked stick that the bearer of the burden could sling it across his shoulder like a bale of hay.",-0.5267,0.074,0.107,0.819,negative,The silent places
"As he threw it to the ground, a delicate spice-like aroma disengaged itself to mingle with the smell of cooking.",0.0516,0.062,0.0,0.938,positive,The silent places
"Just at the edge of camp sat the wolf-dogs, their yellow eyes gleaming, waiting in patience for their tardy share.",0.296,0.104,0.0,0.896,positive,The silent places
After the meal the women drew apart.,0.0,0.0,0.0,1.0,neutral,The silent places
"Dick's eyes roved in vain, seeking a glimpse of the Ojibway girl.",-0.4215,0.0,0.219,0.781,negative,The silent places
"He was too familiar with Indian etiquette to make an advance, and in fact his interest was but languidly aroused.",0.25,0.095,0.0,0.905,positive,The silent places
The men sat about the larger fire smoking.,-0.34,0.0,0.255,0.745,negative,The silent places
It was the hour of relaxation.,0.5267,0.405,0.0,0.595,positive,The silent places
In the blaze their handsome or strong-lined brown faces lighted good-humouredly.,0.4939,0.242,0.0,0.758,positive,The silent places
"They talked and laughed in low tones, the long syllables of their language lisping and hissing in strange analogy to the noises of the fire or the forest or the rapids or some other natural thing.",0.0516,0.129,0.147,0.724,positive,The silent places
Their speech was of the chances of the woods and the approaching visit to their Ojibway brothers in the south.,0.2023,0.087,0.0,0.913,positive,The silent places
"For this they had brought their grand ceremonial robes of deerskin, now stowed securely in bags.",0.6597,0.278,0.0,0.722,positive,The silent places
The white men were silent.,0.0,0.0,0.0,1.0,neutral,The silent places
In a little while the pipes were finished.,0.0,0.0,0.0,1.0,neutral,The silent places
The camp was asleep.,0.0,0.0,0.0,1.0,neutral,The silent places
"Through the ashes and the embers prowled the wolf-dogs, but half-fed, seeking scraps.",0.0,0.0,0.0,1.0,neutral,The silent places
Soon they took to the beach in search of cast-up fish.,0.0,0.0,0.0,1.0,neutral,The silent places
There they wandered all night long under the moon voicing their immemorial wrongs to the silenced forest.,0.0,0.0,0.0,1.0,neutral,The silent places
Almost at first streak of dawn the women were abroad.,0.0,0.0,0.0,1.0,neutral,The silent places
"Shortly after, the men visited their traps and lifted the nets.",0.0,0.0,0.0,1.0,neutral,The silent places
In this land and season of plenty the catch had been good.,0.4404,0.209,0.0,0.791,positive,The silent places
"The snares had strangled three hares; the steel traps had caught five muskrats, which are very good eating in spite of their appearance; the net had intercepted a number of pickerel, suckers, and river whitefish.",-0.7722,0.103,0.233,0.664,negative,The silent places
"This, with the meat of the caribou, shot by Three Fingers the day before, and the supplies brought from the Post, made ample provision.",0.0,0.0,0.0,1.0,neutral,The silent places
"Nevertheless, when the camp had been struck and the canoes loaded, the order of march was reversed.",-0.25,0.0,0.111,0.889,negative,The silent places
"Now the men took the lead by a good margin, and the women and children followed.",0.4404,0.172,0.0,0.828,positive,The silent places
For in the wooded country game drinks early.,0.0,0.0,0.0,1.0,neutral,The silent places
"Before setting out, however, old Haukemah blazed a fair clean place on a fir-tree, and with hard charcoal from the fire marked on it these characters: ""Can you read Injun writin'?""",0.296,0.148,0.112,0.74,positive,The silent places
asked Dick.,-0.5106,0.0,0.767,0.233,negative,The silent places
"""I can't.""",0.0,0.0,0.0,1.0,neutral,The silent places
"""Yes,"" replied Sam, ""learned her when I was snowed up one winter with Scar-Face down by the Burwash Lake country.""",0.0,0.0,0.0,1.0,neutral,The silent places
"He squinted his eyes, reading the syllables slowly.",0.0,0.0,0.0,1.0,neutral,The silent places
"""'Abichi-kā-menót Moosamík-kā-jā yank.",0.0,0.0,0.0,1.0,neutral,The silent places
