sentence,compound,positive,negative,neutral,label,title
"And that, let me tell you, when you have got such a job as mine in hand, is a real comfort at starting.",0.6908,0.231,0.0,0.769,positive,The Moonstone
"If you know anything of the fashionable world, you have heard tell of the three beautiful Miss Herncastles.",0.5106,0.181,0.074,0.744,positive,The Moonstone
"Miss Adelaide; Miss Caroline; and Miss Julia--this last being the youngest and the best of the three sisters, in my opinion; and I had opportunities of judging, as you shall presently see.",0.6124,0.181,0.128,0.691,positive,The Moonstone
"I went into the service of the old lord, their father (thank God, we have got nothing to do with him, in this business of the Diamond; he had the longest tongue and the shortest temper of any man, high or low, I ever met with)--I say, I went into the service of the old lord, as page-boy in waiting on the three honourable young ladies, at the age of fifteen years.",0.4019,0.099,0.064,0.837,positive,The Moonstone
There I lived till Miss Julia married the late Sir John Verinder.,-0.1531,0.0,0.138,0.862,negative,The Moonstone
"An excellent man, who only wanted somebody to manage him; and, between ourselves, he found somebody to do it; and what is more, he throve on it and grew fat on it, and lived happy and died easy on it, dating from the day when my lady took him to church to be married, to the day when she relieved him of his last breath, and closed his eyes for ever.",0.8519,0.156,0.044,0.8,positive,The Moonstone
I have omitted to state that I went with the bride to the bride's husband's house and lands down here.,0.0,0.0,0.0,1.0,neutral,The Moonstone
"""Sir John,"" she says, ""I can't do without Gabriel Betteredge.""",0.0,0.0,0.0,1.0,neutral,The Moonstone
"""My lady,"" says Sir John, ""I can't do without him, either.""",0.0,0.0,0.0,1.0,neutral,The Moonstone
That was his way with her--and that was how I went into his service.,0.0,0.0,0.0,1.0,neutral,The Moonstone
"It was all one to me where I went, so long as my mistress and I were together.",0.0,0.0,0.0,1.0,neutral,The Moonstone
"Seeing that my lady took an interest in the out-of-door work, and the farms, and such like, I took an interest in them too--with all the more reason that I was a small farmer's seventh son myself.",0.8176,0.215,0.0,0.785,positive,The Moonstone
"My lady got me put under the bailiff, and I did my best, and gave satisfaction, and got promotion accordingly.",0.7964,0.295,0.0,0.705,positive,The Moonstone
"Some years later, on the Monday as it might be, my lady says, ""Sir John, your bailiff is a stupid old man.",-0.5267,0.0,0.145,0.855,negative,The Moonstone
"Pension him liberally, and let Gabriel Betteredge have his place.""",0.0,0.0,0.0,1.0,neutral,The Moonstone
"On the Tuesday as it might be, Sir John says, ""My lady, the bailiff is pensioned liberally; and Gabriel Betteredge has got his place.""",0.0,0.0,0.0,1.0,neutral,The Moonstone
You hear more than enough of married people living together miserably.,-0.4767,0.0,0.237,0.763,negative,The Moonstone
Here is an example to the contrary.,0.0,0.0,0.0,1.0,neutral,The Moonstone
"Let it be a warning to some of you, and an encouragement to others.",0.1027,0.173,0.148,0.679,positive,The Moonstone
"In the meantime, I will go on with my story.",0.0,0.0,0.0,1.0,neutral,The Moonstone
"Well, there I was in clover, you will say.",0.2732,0.231,0.0,0.769,positive,The Moonstone
"Placed in a position of trust and honour, with a little cottage of my own to live in, with my rounds on the estate to occupy me in the morning, and my accounts in the afternoon, and my pipe and my Robinson Crusoe in the evening--what more could I possibly want to make me happy?",0.9055,0.204,0.0,0.796,positive,The Moonstone
"Remember what Adam wanted when he was alone in the Garden of Eden; and if you don't blame it in Adam, don't blame it in me.",0.2668,0.14,0.069,0.791,positive,The Moonstone
"The woman I fixed my eye on, was the woman who kept house for me at my cottage.",0.0,0.0,0.0,1.0,neutral,The Moonstone
Her name was Selina Goby.,0.0,0.0,0.0,1.0,neutral,The Moonstone
I agree with the late William Cobbett about picking a wife.,0.3612,0.238,0.0,0.762,positive,The Moonstone
"See that she chews her food well and sets her foot down firmly on the ground when she walks, and you're all right.",0.2732,0.087,0.0,0.913,positive,The Moonstone
"Selina Goby was all right in both these respects, which was one reason for marrying her.",0.3182,0.133,0.0,0.867,positive,The Moonstone
"I had another reason, likewise, entirely of my own discovering.",0.0,0.0,0.0,1.0,neutral,The Moonstone
"Selina, being a single woman, made me pay so much a week for her board and services.",-0.1027,0.0,0.091,0.909,negative,The Moonstone
"Selina, being my wife, couldn't charge for her board, and would have to give me her services for nothing.",0.0,0.0,0.0,1.0,neutral,The Moonstone
That was the point of view I looked at it from.,0.0,0.0,0.0,1.0,neutral,The Moonstone
Economy--with a dash of love.,0.6369,0.583,0.0,0.417,positive,The Moonstone
"I put it to my mistress, as in duty bound, just as I had put it to myself.",0.0,0.0,0.0,1.0,neutral,The Moonstone
"""I have been turning Selina Goby over in my mind,"" I said, ""and I think, my lady, it will be cheaper to marry her than to keep her.""",0.0,0.0,0.0,1.0,neutral,The Moonstone
"My lady burst out laughing, and said she didn't know which to be most shocked at--my language or my principles.",0.1548,0.134,0.109,0.757,positive,The Moonstone
"Some joke tickled her, I suppose, of the sort that you can't take unless you are a person of quality.",0.296,0.115,0.0,0.885,positive,The Moonstone
"Understanding nothing myself but that I was free to put it next to Selina, I went and put it accordingly.",0.6652,0.207,0.0,0.793,positive,The Moonstone
And what did Selina say?,0.0,0.0,0.0,1.0,neutral,The Moonstone
Lord!,0.0,0.0,0.0,1.0,neutral,The Moonstone
"how little you must know of women, if you ask that.",0.0,0.0,0.0,1.0,neutral,The Moonstone
"Of course she said, Yes.",0.4019,0.403,0.0,0.597,positive,The Moonstone
"As my time drew nearer, and there got to be talk of my having a new coat for the ceremony, my mind began to misgive me.",0.0,0.0,0.0,1.0,neutral,The Moonstone
"I have compared notes with other men as to what they felt while they were in my interesting situation; and they have all acknowledged that, about a week before it happened, they privately wished themselves out of it.",0.4019,0.072,0.0,0.928,positive,The Moonstone
"I went a trifle further than that myself; I actually rose up, as it were, and tried to get out of it.",0.0,0.0,0.0,1.0,neutral,The Moonstone
Not for nothing!,0.0,0.0,0.0,1.0,neutral,The Moonstone
I was too just a man to expect she would let me off for nothing.,0.0,0.0,0.0,1.0,neutral,The Moonstone
"Compensation to the woman when the man gets out of it, is one of the laws of England.",0.0,0.0,0.0,1.0,neutral,The Moonstone
"In obedience to the laws, and after turning it over carefully in my mind, I offered Selina Goby a feather-bed and fifty shillings to be off the bargain.",0.3182,0.121,0.0,0.879,positive,The Moonstone
"You will hardly believe it, but it is nevertheless true--she was fool enough to refuse.",-0.7684,0.0,0.338,0.662,negative,The Moonstone
"After that it was all over with me, of course.",0.0,0.0,0.0,1.0,neutral,The Moonstone
"I got the new coat as cheap as I could, and I went through all the rest of it as cheap as I could.",0.0,0.0,0.0,1.0,neutral,The Moonstone
"We were not a happy couple, and not a miserable couple.",-0.0951,0.208,0.237,0.554,negative,The Moonstone
We were six of one and half-a-dozen of the other.,0.0,0.0,0.0,1.0,neutral,The Moonstone
"How it was I don't understand, but we always seemed to be getting, with the best of motives, in one another's way.",0.7783,0.225,0.0,0.775,positive,The Moonstone
"When I wanted to go upstairs, there was my wife coming down; or when my wife wanted to go down, there was I coming up.",0.0,0.0,0.0,1.0,neutral,The Moonstone
"That is married life, according to my experience of it.",0.0,0.0,0.0,1.0,neutral,The Moonstone
"After five years of misunderstandings on the stairs, it pleased an all-wise Providence to relieve us of each other by taking my wife.",0.6597,0.205,0.0,0.795,positive,The Moonstone
"I was left with my little girl Penelope, and with no other child.",-0.296,0.0,0.167,0.833,negative,The Moonstone
"Shortly afterwards Sir John died, and my lady was left with her little girl, Miss Rachel, and no other child.",-0.7287,0.0,0.295,0.705,negative,The Moonstone
"I have written to very poor purpose of my lady, if you require to be told that my little Penelope was taken care of, under my good mistress's own eye, and was sent to school and taught, and made a sharp girl, and promoted, when old enough, to be Miss Rachel's own maid.",0.6003,0.149,0.083,0.768,positive,The Moonstone
"As for me, I went on with my business as bailiff year after year up to Christmas 1847, when there came a change in my life.",0.0,0.0,0.0,1.0,neutral,The Moonstone
"On that day, my lady invited herself to a cup of tea alone with me in my cottage.",-0.25,0.0,0.111,0.889,negative,The Moonstone
"She remarked that, reckoning from the year when I started as page-boy in the time of the old lord, I had been more than fifty years in her service, and she put into my hands a beautiful waistcoat of wool that she had worked herself, to keep me warm in the bitter winter weather.",0.4588,0.102,0.049,0.848,positive,The Moonstone
I received this magnificent present quite at a loss to find words to thank my mistress with for the honour she had done me.,0.8187,0.329,0.084,0.587,positive,The Moonstone
"To my great astonishment, it turned out, however, that the waistcoat was not an honour, but a bribe.",-0.1653,0.123,0.202,0.675,negative,The Moonstone
"My lady had discovered that I was getting old before I had discovered it myself, and she had come to my cottage to wheedle me (if I may use such an expression) into giving up my hard out-of-door work as bailiff, and taking my ease for the rest of my days as steward in the house.",0.5423,0.087,0.025,0.888,positive,The Moonstone
I made as good a fight of it against the indignity of taking my ease as I could.,0.4215,0.27,0.13,0.6,positive,The Moonstone
But my mistress knew the weak side of me; she put it as a favour to herself.,0.0,0.177,0.177,0.645,neutral,The Moonstone
"The dispute between us ended, after that, in my wiping my eyes, like an old fool, with my new woollen waistcoat, and saying I would think about it.",-0.4767,0.078,0.174,0.748,negative,The Moonstone
"The perturbation in my mind, in regard to thinking about it, being truly dreadful after my lady had gone away, I applied the remedy which I have never yet found to fail me in cases of doubt and emergency.",-0.8225,0.062,0.248,0.69,negative,The Moonstone
I smoked a pipe and took a turn at Robinson Crusoe .,0.0,0.0,0.0,1.0,neutral,The Moonstone
"Before I had occupied myself with that extraordinary book five minutes, I came on a comforting bit (page one hundred and fifty-eight), as follows: ""Today we love, what tomorrow we hate.""",0.7845,0.21,0.0,0.79,positive,The Moonstone
I saw my way clear directly.,0.3818,0.394,0.0,0.606,positive,The Moonstone
"Today I was all for continuing to be farm-bailiff; tomorrow, on the authority of Robinson Crusoe , I should be all the other way.",0.0772,0.061,0.0,0.939,positive,The Moonstone
"Take myself tomorrow while in tomorrow's humour, and the thing was done.",0.4767,0.22,0.0,0.78,positive,The Moonstone
"My mind being relieved in this manner, I went to sleep that night in the character of Lady Verinder's farm-bailiff, and I woke up the next morning in the character of Lady Verinder's house-steward.",0.3818,0.077,0.0,0.923,positive,The Moonstone
"All quite comfortable, and all through Robinson Crusoe !",0.5974,0.357,0.0,0.643,positive,The Moonstone
My daughter Penelope has just looked over my shoulder to see what I have done so far.,0.0,0.0,0.0,1.0,neutral,The Moonstone
"She remarks that it is beautifully written, and every word of it true.",0.7579,0.371,0.0,0.629,positive,The Moonstone
But she points out one objection.,0.0,0.0,0.0,1.0,neutral,The Moonstone
She says what I have done so far isn't in the least what I was wanted to do.,0.0,0.0,0.0,1.0,neutral,The Moonstone
"I am asked to tell the story of the Diamond and, instead of that, I have been telling the story of my own self.",0.34,0.103,0.0,0.897,positive,The Moonstone
"Curious, and quite beyond me to account for.",0.3182,0.247,0.0,0.753,positive,The Moonstone
"I wonder whether the gentlemen who make a business and a living out of writing books, ever find their own selves getting in the way of their subjects, like me?",0.3612,0.088,0.0,0.912,positive,The Moonstone
"If they do, I can feel for them.",0.0,0.0,0.0,1.0,neutral,The Moonstone
"In the meantime, here is another false start, and more waste of good writing-paper.",0.0183,0.173,0.169,0.657,neutral,The Moonstone
What's to be done now?,0.0,0.0,0.0,1.0,neutral,The Moonstone
"Nothing that I know of, except for you to keep your temper, and for me to begin it all over again for the third time.",-0.4215,0.0,0.109,0.891,negative,The Moonstone
CHAPTER III The question of how I am to start the story properly I have tried to settle in two ways.,0.0,0.0,0.0,1.0,neutral,The Moonstone
"First, by scratching my head, which led to nothing.",0.0,0.0,0.0,1.0,neutral,The Moonstone
"Second, by consulting my daughter Penelope, which has resulted in an entirely new idea.",0.0,0.0,0.0,1.0,neutral,The Moonstone
"Penelope's notion is that I should set down what happened, regularly day by day, beginning with the day when we got the news that Mr. Franklin Blake was expected on a visit to the house.",0.0,0.0,0.0,1.0,neutral,The Moonstone
"When you come to fix your memory with a date in this way, it is wonderful what your memory will pick up for you upon that compulsion.",0.5719,0.129,0.0,0.871,positive,The Moonstone
"The only difficulty is to fetch out the dates, in the first place.",-0.34,0.0,0.167,0.833,negative,The Moonstone
"This Penelope offers to do for me by looking into her own diary, which she was taught to keep when she was at school, and which she has gone on keeping ever since.",0.0,0.0,0.0,1.0,neutral,The Moonstone
"In answer to an improvement on this notion, devised by myself, namely, that she should tell the story instead of me, out of her own diary, Penelope observes, with a fierce look and a red face, that her journal is for her own private eye, and that no living creature shall ever know what is in it but herself.",0.1027,0.034,0.027,0.939,positive,The Moonstone
"When I inquire what this means, Penelope says, ""Fiddlesticks!""",0.0,0.0,0.0,1.0,neutral,The Moonstone
"I say, Sweethearts.",0.5859,0.792,0.0,0.208,positive,The Moonstone
"Beginning, then, on Penelope's plan, I beg to mention that I was specially called one Wednesday morning into my lady's own sitting-room, the date being the twenty-fourth of May, eighteen hundred and forty-eight.",0.0,0.0,0.0,1.0,neutral,The Moonstone
"""Gabriel,"" says my lady, ""here is news that will surprise you.",0.2732,0.174,0.0,0.826,positive,The Moonstone
Franklin Blake has come back from abroad.,0.0,0.0,0.0,1.0,neutral,The Moonstone
"He has been staying with his father in London, and he is coming to us tomorrow to stop till next month, and keep Rachel's birthday.""",-0.296,0.0,0.084,0.916,negative,The Moonstone
"If I had had a hat in my hand, nothing but respect would have prevented me from throwing that hat up to the ceiling.",-0.2688,0.127,0.13,0.743,negative,The Moonstone
"I had not seen Mr. Franklin since he was a boy, living along with us in this house.",0.0,0.0,0.0,1.0,neutral,The Moonstone
"He was, out of all sight (as I remember him), the nicest boy that ever spun a top or broke a window.",0.296,0.21,0.118,0.672,positive,The Moonstone
"Miss Rachel, who was present, and to whom I made that remark, observed, in return, that she remembered him as the most atrocious tyrant that ever tortured a doll, and the hardest driver of an exhausted little girl in string harness that England could produce.",-0.7717,0.0,0.161,0.839,negative,The Moonstone
"""I burn with indignation, and I ache with fatigue,"" was the way Miss Rachel summed it up, ""when I think of Franklin Blake.""",-0.765,0.0,0.297,0.703,negative,The Moonstone
"Hearing what I now tell you, you will naturally ask how it was that Mr. Franklin should have passed all the years, from the time when he was a boy to the time when he was a man, out of his own country.",0.0,0.0,0.0,1.0,neutral,The Moonstone
"I answer, because his father had the misfortune to be next heir to a Dukedom, and not to be able to prove it.",0.0,0.0,0.0,1.0,neutral,The Moonstone
"In two words, this was how the thing happened: My lady's eldest sister married the celebrated Mr. Blake--equally famous for his great riches, and his great suit at law.",0.946,0.38,0.0,0.62,positive,The Moonstone
"How many years he went on worrying the tribunals of his country to turn out the Duke in possession, and to put himself in the Duke's place--how many lawyer's purses he filled to bursting, and how many otherwise harmless people he set by the ears together disputing whether he was right or wrong--is more by a great deal than I can reckon up.",0.3134,0.093,0.074,0.832,positive,The Moonstone
"His wife died, and two of his three children died, before the tribunals could make up their minds to show him the door and take no more of his money.",-0.8555,0.0,0.258,0.742,negative,The Moonstone
"When it was all over, and the Duke in possession was left in possession, Mr. Blake discovered that the only way of being even with his country for the manner in which it had treated him, was not to let his country have the honour of educating his son.",0.5719,0.072,0.0,0.928,positive,The Moonstone
"""How can I trust my native institutions,"" was the form in which he put it, ""after the way in which my native institutions have behaved to me? """,0.5106,0.117,0.0,0.883,positive,The Moonstone
"Add to this, that Mr. Blake disliked all boys, his own included, and you will admit that it could only end in one way.",-0.2263,0.068,0.102,0.83,negative,The Moonstone
"Master Franklin was taken from us in England, and was sent to institutions which his father could trust, in that superior country, Germany; Mr. Blake himself, you will observe, remaining snug in England, to improve his fellow-countrymen in the Parliament House, and to publish a statement on the subject of the Duke in possession, which has remained an unfinished statement from that day to this.",0.8658,0.137,0.0,0.863,positive,The Moonstone
There!,0.0,0.0,0.0,1.0,neutral,The Moonstone
"thank God, that's told!",0.5983,0.71,0.0,0.29,positive,The Moonstone
"Neither you nor I need trouble our heads any more about Mr. Blake, senior.",0.3089,0.158,0.0,0.842,positive,The Moonstone
Leave him to the Dukedom; and let you and I stick to the Diamond.,0.296,0.164,0.082,0.753,positive,The Moonstone
"The Diamond takes us back to Mr. Franklin, who was the innocent means of bringing that unlucky jewel into the house.",0.743,0.289,0.0,0.711,positive,The Moonstone
Our nice boy didn't forget us after he went abroad.,0.5371,0.358,0.0,0.642,positive,The Moonstone
"He wrote every now and then; sometimes to my lady, sometimes to Miss Rachel, and sometimes to me.",-0.1531,0.0,0.086,0.914,negative,The Moonstone
"We had had a transaction together, before he left, which consisted in his borrowing of me a ball of string, a four-bladed knife, and seven-and-sixpence in money--the colour of which last I have not seen, and never expect to see again.",0.0,0.0,0.0,1.0,neutral,The Moonstone
His letters to me chiefly related to borrowing more.,0.0,0.0,0.0,1.0,neutral,The Moonstone
"I heard, however, from my lady, how he got on abroad, as he grew in years and stature.",0.0,0.0,0.0,1.0,neutral,The Moonstone
"After he had learnt what the institutions of Germany could teach him, he gave the French a turn next, and the Italians a turn after that.",0.0,0.0,0.0,1.0,neutral,The Moonstone
"They made him among them a sort of universal genius, as well as I could understand it.",0.2732,0.13,0.0,0.87,positive,The Moonstone
"He wrote a little; he painted a little; he sang and played and composed a little--borrowing, as I suspect, in all these cases, just as he had borrowed from me.",0.0516,0.084,0.077,0.839,positive,The Moonstone
"His mother's fortune (seven hundred a year) fell to him when he came of age, and ran through him, as it might be through a sieve.",0.0,0.0,0.0,1.0,neutral,The Moonstone
"The more money he had, the more he wanted; there was a hole in Mr. Franklin's pocket that nothing would sew up.",0.0,0.0,0.0,1.0,neutral,The Moonstone
"Wherever he went, the lively, easy way of him made him welcome.",0.8316,0.494,0.0,0.506,positive,The Moonstone
"He lived here, there, and everywhere; his address (as he used to put it himself) being ""Post Office, Europe--to be left till called for.""",0.0,0.0,0.0,1.0,neutral,The Moonstone
"Twice over, he made up his mind to come back to England and see us; and twice over (saving your presence), some unmentionable woman stood in the way and stopped him.",-0.2263,0.0,0.06,0.94,negative,The Moonstone
"His third attempt succeeded, as you know already from what my lady told me.",0.4215,0.177,0.0,0.823,positive,The Moonstone
"On Thursday the twenty-fifth of May, we were to see for the first time what our nice boy had grown to be as a man.",0.4215,0.109,0.0,0.891,positive,The Moonstone
"He came of good blood; he had a high courage; and he was five-and-twenty years of age, by our reckoning.",0.7269,0.264,0.0,0.736,positive,The Moonstone
Now you know as much of Mr. Franklin Blake as I did--before Mr. Franklin Blake came down to our house.,0.0,0.0,0.0,1.0,neutral,The Moonstone
The Thursday was as fine a summer's day as ever you saw: and my lady and Miss Rachel (not expecting Mr. Franklin till dinner-time) drove out to lunch with some friends in the neighbourhood.,0.5106,0.134,0.044,0.822,positive,The Moonstone
"When they were gone, I went and had a look at the bedroom which had been got ready for our guest, and saw that all was straight.",0.5267,0.161,0.0,0.839,positive,The Moonstone
"Then, being butler in my lady's establishment, as well as steward (at my own particular request, mind, and because it vexed me to see anybody but myself in possession of the key of the late Sir John's cellar)--then, I say, I fetched up some of our famous Latour claret, and set it in the warm summer air to take off the chill before dinner.",0.4404,0.061,0.0,0.939,positive,The Moonstone
"Concluding to set myself in the warm summer air next--seeing that what is good for old claret is equally good for old age--I took up my beehive chair to go out into the back court, when I was stopped by hearing a sound like the soft beating of a drum, on the terrace in front of my lady's residence.",0.6486,0.157,0.075,0.768,positive,The Moonstone
"Going round to the terrace, I found three mahogany-coloured Indians, in white linen frocks and trousers, looking up at the house.",0.0,0.0,0.0,1.0,neutral,The Moonstone
"The Indians, as I saw on looking closer, had small hand-drums slung in front of them.",0.0,0.0,0.0,1.0,neutral,The Moonstone
Behind them stood a little delicate-looking light-haired English boy carrying a bag.,0.0,0.0,0.0,1.0,neutral,The Moonstone
"I judged the fellows to be strolling conjurors, and the boy with the bag to be carrying the tools of their trade.",0.0,0.0,0.0,1.0,neutral,The Moonstone
"One of the three, who spoke English and who exhibited, I must own, the most elegant manners, presently informed me that my judgment was right.",0.5256,0.129,0.0,0.871,positive,The Moonstone
He requested permission to show his tricks in the presence of the lady of the house.,-0.128,0.0,0.091,0.909,negative,The Moonstone
Now I am not a sour old man.,0.0,0.0,0.0,1.0,neutral,The Moonstone
"I am generally all for amusement, and the last person in the world to distrust another person because he happens to be a few shades darker than myself.",-0.0772,0.085,0.096,0.819,negative,The Moonstone
"But the best of us have our weaknesses--and my weakness, when I know a family plate-basket to be out on a pantry-table, is to be instantly reminded of that basket by the sight of a strolling stranger whose manners are superior to my own.",0.8338,0.206,0.072,0.722,positive,The Moonstone
I accordingly informed the Indian that the lady of the house was out; and I warned him and his party off the premises.,0.1531,0.113,0.088,0.798,positive,The Moonstone
He made me a beautiful bow in return; and he and his party went off the premises.,0.765,0.32,0.0,0.68,positive,The Moonstone
"On my side, I returned to my beehive chair, and set myself down on the sunny side of the court, and fell (if the truth must be owned), not exactly into a sleep, but into the next best thing to it.",0.8537,0.206,0.0,0.794,positive,The Moonstone
I was roused up by my daughter Penelope running out at me as if the house was on fire.,-0.34,0.0,0.124,0.876,negative,The Moonstone
What do you think she wanted?,0.0,0.0,0.0,1.0,neutral,The Moonstone
"She wanted to have the three Indian jugglers instantly taken up; for this reason, namely, that they knew who was coming from London to visit us, and that they meant some mischief to Mr. Franklin Blake.",-0.3612,0.0,0.067,0.933,negative,The Moonstone
Mr. Franklin's name roused me.,0.0,0.0,0.0,1.0,neutral,The Moonstone
"I opened my eyes, and made my girl explain herself.",0.0,0.0,0.0,1.0,neutral,The Moonstone
