sentence,compound,positive,negative,neutral,label,title
"As a rule, Perrault travelled ahead of the team, packing the snow with webbed shoes to make it easier for them.",0.4215,0.128,0.0,0.872,positive,The call of the wild
"François, guiding the sled at the gee-pole, sometimes exchanged places with him, but not often.",0.0,0.0,0.0,1.0,neutral,The call of the wild
"Perrault was in a hurry, and he prided himself on his knowledge of ice, which knowledge was indispensable, for the fall ice was very thin, and where there was swift water, there was no ice at all.",-0.1027,0.047,0.058,0.895,negative,The call of the wild
"Day after day, for days unending, Buck toiled in the traces.",0.0,0.0,0.0,1.0,neutral,The call of the wild
"Always, they broke camp in the dark, and the first gray of dawn found them hitting the trail with fresh miles reeled off behind them.",-0.128,0.082,0.1,0.819,negative,The call of the wild
"And always they pitched camp after dark, eating their bit of fish, and crawling to sleep into the snow.",0.0,0.0,0.0,1.0,neutral,The call of the wild
Buck was ravenous.,0.0,0.0,0.0,1.0,neutral,The call of the wild
"The pound and a half of sun-dried salmon, which was his ration for each day, seemed to go nowhere.",0.0,0.0,0.0,1.0,neutral,The call of the wild
"He never had enough, and suffered from perpetual hunger pangs.",-0.6369,0.0,0.394,0.606,negative,The call of the wild
"Yet the other dogs, because they weighed less and were born to the life, received a pound only of the fish and managed to keep in good condition.",0.4404,0.1,0.0,0.9,positive,The call of the wild
He swiftly lost the fastidiousness which had characterized his old life.,-0.0258,0.163,0.17,0.667,neutral,The call of the wild
"A dainty eater, he found that his mates, finishing first, robbed him of his unfinished ration.",0.0,0.0,0.0,1.0,neutral,The call of the wild
There was no defending it.,-0.296,0.0,0.355,0.645,negative,The call of the wild
"While he was fighting off two or three, it was disappearing down the throats of the others.",-0.3612,0.0,0.135,0.865,negative,The call of the wild
"To remedy this, he ate as fast as they; and, so greatly did hunger compel him, he was not above taking what did not belong to him.",-0.3699,0.0,0.089,0.911,negative,The call of the wild
He watched and learned.,0.0,0.0,0.0,1.0,neutral,The call of the wild
"When he saw Pike, one of the new dogs, a clever malingerer and thief, slyly steal a slice of bacon when Perrault's back was turned, he duplicated the performance the following day, getting away with the whole chunk.",-0.5574,0.07,0.155,0.775,negative,The call of the wild
"A great uproar was raised, but he was unsuspected; while Dub, an awkward blunderer who was always getting caught, was punished for Buck's misdeed.",-0.5187,0.09,0.207,0.703,negative,The call of the wild
This first theft marked Buck as fit to survive in the hostile Northland environment.,-0.0258,0.146,0.152,0.702,neutral,The call of the wild
"It marked his adaptability, his capacity to adjust himself to changing conditions, the lack of which would have meant swift and terrible death.",-0.8176,0.06,0.309,0.631,negative,The call of the wild
"It marked, further, the decay or going to pieces of his moral nature, a vain thing and a handicap in the ruthless struggle for existence.",-0.7783,0.0,0.281,0.719,negative,The call of the wild
"It was all well enough in the Southland, under the law of love and fellowship, to respect private property and personal feelings; but in the Northland, under the law of club and fang, whoso took such things into account was a fool, and in so far as he observed them he would fail to prosper.",-0.6597,0.097,0.135,0.768,negative,The call of the wild
Not that Buck reasoned it out.,0.0,0.0,0.0,1.0,neutral,The call of the wild
"He was fit, that was all, and unconsciously he accommodated himself to the new mode of life.",0.3612,0.135,0.0,0.865,positive,The call of the wild
"All his days, no matter what the odds, he had never run from a fight.",0.0217,0.199,0.133,0.667,neutral,The call of the wild
But the club of the man in the red sweater had beaten into him a more fundamental and primitive code.,-0.5719,0.0,0.171,0.829,negative,The call of the wild
"Civilized, he could have died for a moral consideration, say the defence of Judge Miller's riding-whip; but the completeness of his decivilization was now evidenced by his ability to flee from the defence of a moral consideration and so save his hide.",0.7703,0.228,0.095,0.678,positive,The call of the wild
"He did not steal for joy of it, but because of the clamor of his stomach.",-0.0572,0.102,0.114,0.784,negative,The call of the wild
"He did not rob openly, but stole secretly and cunningly, out of respect for club and fang.",0.7279,0.29,0.0,0.71,positive,The call of the wild
"In short, the things he did were done because it was easier to do them than not to do them.",0.4215,0.128,0.0,0.872,positive,The call of the wild
His development (or retrogression) was rapid.,0.0,0.0,0.0,1.0,neutral,The call of the wild
"His muscles became hard as iron, and he grew callous to all ordinary pain.",-0.5719,0.0,0.281,0.719,negative,The call of the wild
He achieved an internal as well as external economy.,0.2732,0.208,0.0,0.792,positive,The call of the wild
"He could eat anything, no matter how loathsome or indigestible; and, once eaten, the juices of his stomach extracted the last least particle of nutriment; and his blood carried it to the farthest reaches of his body, building it into the toughest and stoutest of tissues.",-0.296,0.048,0.073,0.879,negative,The call of the wild
"Sight and scent became remarkably keen, while his hearing developed such acuteness that in his sleep he heard the faintest sound and knew whether it heralded peace or peril.",0.5563,0.18,0.077,0.743,positive,The call of the wild
"He learned to bite the ice out with his teeth when it collected between his toes; and when he was thirsty and there was a thick scum of ice over the water hole, he would break it by rearing and striking it with stiff fore legs.",0.0,0.0,0.0,1.0,neutral,The call of the wild
His most conspicuous trait was an ability to scent the wind and forecast it a night in advance.,0.3182,0.126,0.0,0.874,positive,The call of the wild
"No matter how breathless the air when he dug his nest by tree or bank, the wind that later blew inevitably found him to leeward, sheltered and snug.",-0.2732,0.038,0.075,0.887,negative,The call of the wild
"And not only did he learn by experience, but instincts long dead became alive again.",-0.5499,0.152,0.266,0.582,negative,The call of the wild
The domesticated generations fell from him.,0.0,0.0,0.0,1.0,neutral,The call of the wild
"In vague ways he remembered back to the youth of the breed, to the time the wild dogs ranged in packs through the primeval forest and killed their meat as they ran it down.",-0.7096,0.0,0.156,0.844,negative,The call of the wild
It was no task for him to learn to fight with cut and slash and the quick wolf snap.,-0.7906,0.0,0.375,0.625,negative,The call of the wild
In this manner had fought forgotten ancestors.,-0.4939,0.0,0.457,0.543,negative,The call of the wild
"They quickened the old life within him, and the old tricks which they had stamped into the heredity of the breed were his tricks.",-0.25,0.0,0.12,0.88,negative,The call of the wild
"They came to him without effort or discovery, as though they had been his always.",0.0,0.0,0.0,1.0,neutral,The call of the wild
"And when, on the still cold nights, he pointed his nose at a star and howled long and wolflike, it was his ancestors, dead and dust, pointing nose at star and howling down through the centuries and through him.",-0.6486,0.0,0.104,0.896,negative,The call of the wild
"And his cadences were their cadences, the cadences which voiced their woe and what to them was the meaning of the stiffness, and the cold, and dark.",-0.4215,0.0,0.097,0.903,negative,The call of the wild
"Thus, as token of what a puppet thing life is, the ancient song surged through him and he came into his own again; and he came because men had found a yellow metal in the North, and because Manuel was a gardener's helper whose wages did not lap over the needs of his wife and divers small copies of himself.",0.34,0.041,0.0,0.959,positive,The call of the wild
Chapter III.,0.0,0.0,0.0,1.0,neutral,The call of the wild
"The Dominant Primordial Beast The dominant primordial beast was strong in Buck, and under the fierce conditions of trail life it grew and grew.",0.5106,0.125,0.0,0.875,positive,The call of the wild
Yet it was a secret growth.,0.3818,0.394,0.0,0.606,positive,The call of the wild
His newborn cunning gave him poise and control.,0.0,0.0,0.0,1.0,neutral,The call of the wild
"He was too busy adjusting himself to the new life to feel at ease, and not only did he not pick fights, but he avoided them whenever possible.",-0.183,0.107,0.098,0.794,negative,The call of the wild
A certain deliberateness characterized his attitude.,0.2732,0.344,0.0,0.656,positive,The call of the wild
"He was not prone to rashness and precipitate action; and in the bitter hatred between him and Spitz he betrayed no impatience, shunned all offensive acts.",-0.9584,0.0,0.487,0.513,negative,The call of the wild
"On the other hand, possibly because he divined in Buck a dangerous rival, Spitz never lost an opportunity of showing his teeth.",0.1356,0.245,0.191,0.563,positive,The call of the wild
"He even went out of his way to bully Buck, striving constantly to start the fight which could end only in the death of one or the other.",-0.8658,0.0,0.28,0.72,negative,The call of the wild
Early in the trip this might have taken place had it not been for an unwonted accident.,-0.4767,0.0,0.162,0.838,negative,The call of the wild
At the end of this day they made a bleak and miserable camp on the shore of Lake Le Barge.,-0.4939,0.0,0.151,0.849,negative,The call of the wild
"Driving snow, a wind that cut like a white-hot knife, and darkness had forced them to grope for a camping place.",-0.5574,0.106,0.301,0.593,negative,The call of the wild
They could hardly have fared worse.,-0.4284,0.0,0.362,0.638,negative,The call of the wild
"At their backs rose a perpendicular wall of rock, and Perrault and François were compelled to make their fire and spread their sleeping robes on the ice of the lake itself.",-0.34,0.038,0.113,0.849,negative,The call of the wild
The tent they had discarded at Dyea in order to travel light.,-0.34,0.0,0.179,0.821,negative,The call of the wild
A few sticks of driftwood furnished them with a fire that thawed down through the ice and left them to eat supper in the dark.,-0.34,0.0,0.098,0.902,negative,The call of the wild
Close in under the sheltering rock Buck made his nest.,0.0,0.0,0.0,1.0,neutral,The call of the wild
"So snug and warm was it, that he was loath to leave it when François distributed the fish which he had first thawed over the fire.",-0.1119,0.075,0.125,0.8,negative,The call of the wild
"But when Buck finished his ration and returned, he found his nest occupied.",0.0,0.0,0.0,1.0,neutral,The call of the wild
A warning snarl told him that the trespasser was Spitz.,-0.34,0.0,0.231,0.769,negative,The call of the wild
"Till now Buck had avoided trouble with his enemy, but this was too much.",-0.5859,0.0,0.345,0.655,negative,The call of the wild
The beast in him roared.,0.0,0.0,0.0,1.0,neutral,The call of the wild
"He sprang upon Spitz with a fury which surprised them both, and Spitz particularly, for his whole experience with Buck had gone to teach him that his rival was an unusually timid dog, who managed to hold his own only because of his great weight and size.",0.0018,0.111,0.111,0.778,neutral,The call of the wild
"François was surprised, too, when they shot out in a tangle from the disrupted nest and he divined the cause of the trouble.",0.0,0.146,0.106,0.748,neutral,The call of the wild
"""A-a-ah!""",0.0,0.0,0.0,1.0,neutral,The call of the wild
he cried to Buck.,-0.3818,0.0,0.464,0.536,negative,The call of the wild
"""Gif it to heem, by Gar!",0.0,0.0,0.0,1.0,neutral,The call of the wild
"Gif it to heem, the dirty t'eef!""",-0.4926,0.0,0.347,0.653,negative,The call of the wild
Spitz was equally willing.,0.0,0.0,0.0,1.0,neutral,The call of the wild
He was crying with sheer rage and eagerness as he circled back and forth for a chance to spring in.,-0.4588,0.178,0.254,0.568,negative,The call of the wild
"Buck was no less eager, and no less cautious, as he likewise circled back and forth for the advantage.",-0.0772,0.177,0.232,0.59,negative,The call of the wild
"But it was then that the unexpected happened, the thing which projected their struggle for supremacy far into the future, past many a weary mile of trail and toil.",-0.6486,0.041,0.176,0.784,negative,The call of the wild
"An oath from Perrault, the resounding impact of a club upon a bony frame, and a shrill yelp of pain, heralded the breaking forth of pandemonium.",-0.5106,0.0,0.13,0.87,negative,The call of the wild
"The camp was suddenly discovered to be alive with skulking furry forms,--starving huskies, four or five score of them, who had scented the camp from some Indian village.",0.3818,0.088,0.0,0.912,positive,The call of the wild
"They had crept in while Buck and Spitz were fighting, and when the two men sprang among them with stout clubs they showed their teeth and fought back.",-0.4767,0.054,0.152,0.794,negative,The call of the wild
They were crazed by the smell of the food.,-0.128,0.0,0.158,0.842,negative,The call of the wild
Perrault found one with head buried in the grub-box.,0.0,0.0,0.0,1.0,neutral,The call of the wild
"His club landed heavily on the gaunt ribs, and the grub-box was capsized on the ground.",0.0,0.0,0.0,1.0,neutral,The call of the wild
On the instant a score of the famished brutes were scrambling for the bread and bacon.,0.0,0.0,0.0,1.0,neutral,The call of the wild
The clubs fell upon them unheeded.,0.0,0.0,0.0,1.0,neutral,The call of the wild
"They yelped and howled under the rain of blows, but struggled none the less madly till the last crumb had been devoured.",-0.1376,0.1,0.121,0.779,negative,The call of the wild
In the meantime the astonished team-dogs had burst out of their nests only to be set upon by the fierce invaders.,0.3818,0.115,0.0,0.885,positive,The call of the wild
Never had Buck seen such dogs.,0.0,0.0,0.0,1.0,neutral,The call of the wild
It seemed as though their bones would burst through their skins.,0.0,0.0,0.0,1.0,neutral,The call of the wild
"They were mere skeletons, draped loosely in draggled hides, with blazing eyes and slavered fangs.",-0.1779,0.0,0.108,0.892,negative,The call of the wild
"But the hunger-madness made them terrifying, irresistible.",-0.4497,0.236,0.384,0.38,negative,The call of the wild
There was no opposing them.,-0.296,0.0,0.355,0.645,negative,The call of the wild
The team-dogs were swept back against the cliff at the first onset.,0.0,0.0,0.0,1.0,neutral,The call of the wild
"Buck was beset by three huskies, and in a trice his head and shoulders were ripped and slashed.",-0.2263,0.0,0.106,0.894,negative,The call of the wild
The din was frightful.,-0.5106,0.0,0.524,0.476,negative,The call of the wild
Billee was crying as usual.,-0.4767,0.0,0.437,0.563,negative,The call of the wild
"Dave and Sol-leks, dripping blood from a score of wounds, were fighting bravely side by side.",0.2023,0.176,0.133,0.691,positive,The call of the wild
Joe was snapping like a demon.,0.3612,0.385,0.0,0.615,positive,The call of the wild
"Once, his teeth closed on the fore leg of a husky, and he crunched down through the bone.",0.0,0.0,0.0,1.0,neutral,The call of the wild
"Pike, the malingerer, leaped upon the crippled animal, breaking its neck with a quick flash of teeth and a jerk, Buck got a frothing adversary by the throat, and was sprayed with blood when his teeth sank through the jugular.",-0.4939,0.0,0.107,0.893,negative,The call of the wild
The warm taste of it in his mouth goaded him to greater fierceness.,0.5267,0.286,0.0,0.714,positive,The call of the wild
"He flung himself upon another, and at the same time felt teeth sink into his own throat.",0.0,0.0,0.0,1.0,neutral,The call of the wild
"It was Spitz, treacherously attacking from the side.",-0.4588,0.0,0.3,0.7,negative,The call of the wild
"Perrault and François, having cleaned out their part of the camp, hurried to save their sled-dogs.",0.4939,0.176,0.0,0.824,positive,The call of the wild
"The wild wave of famished beasts rolled back before them, and Buck shook himself free.",0.4404,0.186,0.079,0.734,positive,The call of the wild
But it was only for a moment.,0.0,0.0,0.0,1.0,neutral,The call of the wild
"The two men were compelled to run back to save the grub, upon which the huskies returned to the attack on the team.",0.0772,0.16,0.113,0.727,positive,The call of the wild
"Billee, terrified into bravery, sprang through the savage circle and fled away over the ice.",-0.5859,0.144,0.315,0.541,negative,The call of the wild
"Pike and Dub followed on his heels, with the rest of the team behind.",0.0,0.0,0.0,1.0,neutral,The call of the wild
"As Buck drew himself together to spring after them, out of the tail of his eye he saw Spitz rush upon him with the evident intention of overthrowing him.",0.0,0.0,0.0,1.0,neutral,The call of the wild
"Once off his feet and under that mass of huskies, there was no hope for him.",0.1779,0.152,0.115,0.733,positive,The call of the wild
"But he braced himself to the shock of Spitz's charge, then joined the flight out on the lake.",-0.5267,0.0,0.167,0.833,negative,The call of the wild
"Later, the nine team-dogs gathered together and sought shelter in the forest.",0.0,0.0,0.0,1.0,neutral,The call of the wild
"Though unpursued, they were in a sorry plight.",-0.0772,0.0,0.178,0.822,negative,The call of the wild
"There was not one who was not wounded in four or five places, while some were wounded grievously.",-0.4019,0.0,0.137,0.863,negative,The call of the wild
"Dub was badly injured in a hind leg; Dolly, the last husky added to the team at Dyea, had a badly torn throat; Joe had lost an eye; while Billee, the good-natured, with an ear chewed and rent to ribbons, cried and whimpered throughout the night.",-0.93,0.0,0.294,0.706,negative,The call of the wild
"At daybreak they limped warily back to camp, to find the marauders gone and the two men in bad tempers.",-0.7003,0.0,0.244,0.756,negative,The call of the wild
Fully half their grub supply was gone.,0.0,0.0,0.0,1.0,neutral,The call of the wild
The huskies had chewed through the sled lashings and canvas coverings.,0.0,0.0,0.0,1.0,neutral,The call of the wild
"In fact, nothing, no matter how remotely eatable, had escaped them.",0.2057,0.158,0.09,0.752,positive,The call of the wild
"They had eaten a pair of Perrault's moose-hide moccasins, chunks out of the leather traces, and even two feet of lash from the end of François's whip.",0.0,0.0,0.0,1.0,neutral,The call of the wild
He broke from a mournful contemplation of it to look over his wounded dogs.,-0.6597,0.0,0.329,0.671,negative,The call of the wild
"""Ah, my frien's,"" he said softly, ""mebbe it mek you mad dog, dose many bites.",-0.4939,0.0,0.186,0.814,negative,The call of the wild
"Mebbe all mad dog, sacredam!",-0.5411,0.0,0.466,0.534,negative,The call of the wild
"Wot you t'ink, eh, Perrault?""",0.0,0.0,0.0,1.0,neutral,The call of the wild
The courier shook his head dubiously.,-0.1027,0.0,0.219,0.781,negative,The call of the wild
"With four hundred miles of trail still between him and Dawson, he could ill afford to have madness break out among his dogs.",-0.6908,0.0,0.213,0.787,negative,The call of the wild
"Two hours of cursing and exertion got the harnesses into shape, and the wound-stiffened team was under way, struggling painfully over the hardest part of the trail they had yet encountered, and for that matter, the hardest between them and Dawson.",-0.7269,0.024,0.137,0.839,negative,The call of the wild
The Thirty Mile River was wide open.,0.0,0.0,0.0,1.0,neutral,The call of the wild
"Its wild water defied the frost, and it was in the eddies only and in the quiet places that the ice held at all.",0.0,0.0,0.0,1.0,neutral,The call of the wild
Six days of exhausting toil were required to cover those thirty terrible miles.,-0.6808,0.0,0.337,0.663,negative,The call of the wild
"And terrible they were, for every foot of them was accomplished at the risk of life to dog and man.",-0.3182,0.116,0.207,0.677,negative,The call of the wild
"A dozen times, Perrault, nosing the way broke through the ice bridges, being saved by the long pole he carried, which he so held that it fell each time across the hole made by his body.",0.0,0.073,0.073,0.855,neutral,The call of the wild
"But a cold snap was on, the thermometer registering fifty below zero, and each time he broke through he was compelled for very life to build a fire and dry his garments.",-0.7579,0.037,0.194,0.769,negative,The call of the wild
Nothing daunted him.,0.0,0.0,0.0,1.0,neutral,The call of the wild
It was because nothing daunted him that he had been chosen for government courier.,0.0,0.0,0.0,1.0,neutral,The call of the wild
"He took all manner of risks, resolutely thrusting his little weazened face into the frost and struggling on from dim dawn to dark.",-0.5994,0.0,0.189,0.811,negative,The call of the wild
He skirted the frowning shores on rim ice that bent and crackled under foot and upon which they dared not halt.,-0.34,0.0,0.107,0.893,negative,The call of the wild
"Once, the sled broke through, with Dave and Buck, and they were half-frozen and all but drowned by the time they were dragged out.",-0.8201,0.0,0.289,0.711,negative,The call of the wild
The usual fire was necessary to save them.,0.2023,0.276,0.207,0.517,positive,The call of the wild
"They were coated solidly with ice, and the two men kept them on the run around the fire, sweating and thawing, so close that they were singed by the flames.",-0.34,0.0,0.076,0.924,negative,The call of the wild
"At another time Spitz went through, dragging the whole team after him up to Buck, who strained backward with all his strength, his fore paws on the slippery edge and the ice quivering and snapping all around.",0.128,0.078,0.066,0.856,positive,The call of the wild
"But behind him was Dave, likewise straining backward, and behind the sled was François, pulling till his tendons cracked.",-0.4497,0.0,0.141,0.859,negative,The call of the wild
"Again, the rim ice broke away before and behind, and there was no escape except up the cliff.",-0.5106,0.078,0.23,0.691,negative,The call of the wild
"Perrault scaled it by a miracle, while François prayed for just that miracle; and with every thong and sled lashing and the last bit of harness rove into a long rope, the dogs were hoisted, one by one, to the cliff crest.",0.8225,0.167,0.0,0.833,positive,The call of the wild
"François came up last, after the sled and load.",0.0,0.0,0.0,1.0,neutral,The call of the wild
"Then came the search for a place to descend, which descent was ultimately made by the aid of the rope, and night found them back on the river with a quarter of a mile to the day's credit.",0.3818,0.071,0.0,0.929,positive,The call of the wild
"By the time they made the Hootalinqua and good ice, Buck was played out.",0.6486,0.306,0.0,0.694,positive,The call of the wild
"The rest of the dogs were in like condition; but Perrault, to make up lost time, pushed them late and early.",-0.296,0.074,0.124,0.802,negative,The call of the wild
"The first day they covered thirty-five miles to the Big Salmon; the next day thirty-five more to the Little Salmon; the third day forty miles, which brought them well up toward the Five Fingers.",0.2732,0.06,0.0,0.94,positive,The call of the wild
Buck's feet were not so compact and hard as the,-0.1689,0.0,0.156,0.844,negative,The call of the wild
