sentence,compound,positive,negative,neutral,label,title
The Project Gutenberg eBook of The Moonstone This eBook is for the use of anyone anywhere in the United States and most other parts of the world at no cost and with almost no restrictions whatsoever.,-0.1531,0.07,0.109,0.821,negative,The Moonstone
"You may copy it, give it away or re-use it under the terms of the Project Gutenberg License included with this eBook or online at www.gutenberg.org .",0.0,0.0,0.0,1.0,neutral,The Moonstone
"If you are not located in the United States, you will have to check the laws of the country where you are located before using this eBook.",0.4215,0.097,0.0,0.903,positive,The Moonstone
"Title : The Moonstone Author : Wilkie Collins Release date : January 12, 2006 [eBook #155] Most recently updated: January 10, 2026 Language : English Other information and formats : www.gutenberg.org/ebooks/155 Credits : John Hamm and David Widger *** START OF THE PROJECT GUTENBERG EBOOK THE MOONSTONE *** THE MOONSTONE A Romance by Wilkie Collins Contents PROLOGUE THE STORY FIRST PERIOD CHAPTER I CHAPTER II CHAPTER III CHAPTER IV CHAPTER V CHAPTER VI CHAPTER VII CHAPTER VIII CHAPTER IX CHAPTER X CHAPTER XI CHAPTER XII CHAPTER XIII CHAPTER XIV CHAPTER XV CHAPTER XVI CHAPTER XVII CHAPTER XVIII CHAPTER XIX CHAPTER XX CHAPTER XXI CHAPTER XXII CHAPTER XXIII SECOND PERIOD FIRST NARRATIVE CHAPTER I CHAPTER II CHAPTER III CHAPTER IV CHAPTER V CHAPTER VI CHAPTER VII CHAPTER VIII SECOND NARRATIVE CHAPTER I CHAPTER II CHAPTER III THIRD NARRATIVE CHAPTER I CHAPTER II CHAPTER III CHAPTER IV CHAPTER V CHAPTER VI CHAPTER VII CHAPTER VIII CHAPTER IX CHAPTER X FOURTH NARRATIVE FIFTH NARRATIVE SIXTH NARRATIVE I II III IV V SEVENTH NARRATIVE EIGHTH NARRATIVE EPILOGUE I II III PROLOGUE THE STORMING OF SERINGAPATAM (1799): (Extracted from a Family Paper.)",0.7269,0.036,0.0,0.964,positive,The Moonstone
I I address these lines--written in India--to my relatives in England.,0.0,0.0,0.0,1.0,neutral,The Moonstone
"My object is to explain the motive which has induced me to refuse the right hand of friendship to my cousin, John Herncastle.",0.5994,0.216,0.078,0.707,positive,The Moonstone
The reserve which I have hitherto maintained in this matter has been misinterpreted by members of my family whose good opinion I cannot consent to forfeit.,0.0152,0.144,0.142,0.715,neutral,The Moonstone
I request them to suspend their decision until they have read my narrative.,-0.3182,0.0,0.173,0.827,negative,The Moonstone
"And I declare, on my word of honour, that what I am now about to write is, strictly and literally, the truth.",0.7184,0.25,0.0,0.75,positive,The Moonstone
"The private difference between my cousin and me took its rise in a great public event in which we were both concerned--the storming of Seringapatam, under General Baird, on the 4th of May, 1799.",0.6249,0.114,0.0,0.886,positive,The Moonstone
"In order that the circumstances may be clearly understood, I must revert for a moment to the period before the assault, and to the stories current in our camp of the treasure in jewels and gold stored up in the Palace of Seringapatam.",0.4767,0.162,0.078,0.76,positive,The Moonstone
II One of the wildest of these stories related to a Yellow Diamond--a famous gem in the native annals of India.,0.0,0.0,0.0,1.0,neutral,The Moonstone
The earliest known traditions describe the stone as having been set in the forehead of the four-handed Indian god who typifies the Moon.,0.2732,0.087,0.0,0.913,positive,The Moonstone
"Partly from its peculiar colour, partly from a superstition which represented it as feeling the influence of the deity whom it adorned, and growing and lessening in lustre with the waxing and waning of the moon, it first gained the name by which it continues to be known in India to this day--the name of THE MOONSTONE.",0.7128,0.149,0.0,0.851,positive,The Moonstone
"A similar superstition was once prevalent, as I have heard, in ancient Greece and Rome; not applying, however (as in India), to a diamond devoted to the service of a god, but to a semi-transparent stone of the inferior order of gems, supposed to be affected by the lunar influences--the moon, in this latter case also, giving the name by which the stone is still known to collectors in our own time.",0.1901,0.11,0.073,0.817,positive,The Moonstone
The adventures of the Yellow Diamond begin with the eleventh century of the Christian era.,0.5859,0.27,0.0,0.73,positive,The Moonstone
"At that date, the Mohammedan conqueror, Mahmoud of Ghizni, crossed India; seized on the holy city of Somnauth; and stripped of its treasures the famous temple, which had stood for centuries--the shrine of Hindoo pilgrimage, and the wonder of the Eastern world.",0.4215,0.064,0.0,0.936,positive,The Moonstone
"Of all the deities worshipped in the temple, the moon-god alone escaped the rapacity of the conquering Mohammedans.",0.4019,0.171,0.092,0.737,positive,The Moonstone
"Preserved by three Brahmins, the inviolate deity, bearing the Yellow Diamond in its forehead, was removed by night, and was transported to the second of the sacred cities of India--the city of Benares.",0.34,0.07,0.0,0.93,positive,The Moonstone
"Here, in a new shrine--in a hall inlaid with precious stones, under a roof supported by pillars of gold--the moon-god was set up and worshipped.",0.8658,0.338,0.0,0.662,positive,The Moonstone
"Here, on the night when the shrine was completed, Vishnu the Preserver appeared to the three Brahmins in a dream.",0.25,0.1,0.0,0.9,positive,The Moonstone
The deity breathed the breath of his divinity on the Diamond in the forehead of the god.,0.802,0.369,0.0,0.631,positive,The Moonstone
And the Brahmins knelt and hid their faces in their robes.,-0.1027,0.0,0.123,0.877,negative,The Moonstone
"The deity commanded that the Moonstone should be watched, from that time forth, by three priests in turn, night and day, to the end of the generations of men.",0.0,0.0,0.0,1.0,neutral,The Moonstone
"And the Brahmins heard, and bowed before his will.",0.0,0.0,0.0,1.0,neutral,The Moonstone
"The deity predicted certain disaster to the presumptuous mortal who laid hands on the sacred gem, and to all of his house and name who received it after him.",-0.4588,0.063,0.123,0.813,negative,The Moonstone
And the Brahmins caused the prophecy to be written over the gates of the shrine in letters of gold.,0.0,0.0,0.0,1.0,neutral,The Moonstone
"One age followed another--and still, generation after generation, the successors of the three Brahmins watched their priceless Moonstone, night and day.",0.2732,0.095,0.0,0.905,positive,The Moonstone
"One age followed another until the first years of the eighteenth Christian century saw the reign of Aurungzebe, Emperor of the Moguls.",0.0,0.0,0.0,1.0,neutral,The Moonstone
At his command havoc and rapine were let loose once more among the temples of the worship of Brahmah.,-0.6124,0.09,0.254,0.656,negative,The Moonstone
The shrine of the four-handed god was polluted by the slaughter of sacred animals; the images of the deities were broken in pieces; and the Moonstone was seized by an officer of rank in the army of Aurungzebe.,-0.6124,0.049,0.141,0.81,negative,The Moonstone
"Powerless to recover their lost treasure by open force, the three guardian priests followed and watched it in disguise.",-0.6486,0.089,0.304,0.607,negative,The Moonstone
"The generations succeeded each other; the warrior who had committed the sacrilege perished miserably; the Moonstone passed (carrying its curse with it) from one lawless Mohammedan hand to another; and still, through all chances and changes, the successors of the three guardian priests kept their watch, waiting the day when the will of Vishnu the Preserver should restore to them their sacred gem.",0.6808,0.187,0.087,0.726,positive,The Moonstone
Time rolled on from the first to the last years of the eighteenth Christian century.,0.0,0.0,0.0,1.0,neutral,The Moonstone
"The Diamond fell into the possession of Tippoo, Sultan of Seringapatam, who caused it to be placed as an ornament in the handle of a dagger, and who commanded it to be kept among the choicest treasures of his armoury.",0.6369,0.123,0.0,0.877,positive,The Moonstone
Even then--in the palace of the Sultan himself--the three guardian priests still kept their watch in secret.,0.0,0.0,0.0,1.0,neutral,The Moonstone
"There were three officers of Tippoo's household, strangers to the rest, who had won their master's confidence by conforming, or appearing to conform, to the Mussulman faith; and to those three men report pointed as the three priests in disguise.",0.8316,0.205,0.042,0.753,positive,The Moonstone
"III So, as told in our camp, ran the fanciful story of the Moonstone.",0.0,0.0,0.0,1.0,neutral,The Moonstone
It made no serious impression on any of us except my cousin--whose love of the marvellous induced him to believe it.,0.5574,0.229,0.132,0.639,positive,The Moonstone
"On the night before the assault on Seringapatam, he was absurdly angry with me, and with others, for treating the whole thing as a fable.",-0.7964,0.0,0.244,0.756,negative,The Moonstone
A foolish wrangle followed; and Herncastle's unlucky temper got the better of him.,-0.25,0.173,0.292,0.536,negative,The Moonstone
"He declared, in his boastful way, that we should see the Diamond on his finger, if the English army took Seringapatam.",0.34,0.107,0.0,0.893,positive,The Moonstone
"The sally was saluted by a roar of laughter, and there, as we all thought that night, the thing ended.",0.4939,0.151,0.0,0.849,positive,The Moonstone
Let me now take you on to the day of the assault.,-0.5859,0.0,0.257,0.743,negative,The Moonstone
My cousin and I were separated at the outset.,0.0,0.0,0.0,1.0,neutral,The Moonstone
"I never saw him when we forded the river; when we planted the English flag in the first breach; when we crossed the ditch beyond; and, fighting every inch of our way, entered the town.",-0.3612,0.0,0.07,0.93,negative,The Moonstone
"It was only at dusk, when the place was ours, and after General Baird himself had found the dead body of Tippoo under a heap of the slain, that Herncastle and I met.",-0.6486,0.0,0.125,0.875,negative,The Moonstone
We were each attached to a party sent out by the general's orders to prevent the plunder and confusion which followed our conquest.,0.1531,0.152,0.088,0.76,positive,The Moonstone
"The camp-followers committed deplorable excesses; and, worse still, the soldiers found their way, by an unguarded door, into the treasury of the Palace, and loaded themselves with gold and jewels.",0.4215,0.192,0.086,0.722,positive,The Moonstone
"It was in the court outside the treasury that my cousin and I met, to enforce the laws of discipline on our own soldiers.",0.2023,0.076,0.0,0.924,positive,The Moonstone
"Herncastle's fiery temper had been, as I could plainly see, exasperated to a kind of frenzy by the terrible slaughter through which we had passed.",-0.9134,0.0,0.432,0.568,negative,The Moonstone
"He was very unfit, in my opinion, to perform the duty that had been entrusted to him.",0.2023,0.101,0.0,0.899,positive,The Moonstone
"There was riot and confusion enough in the treasury, but no violence that I saw.",-0.899,0.062,0.543,0.396,negative,The Moonstone
The men (if I may use such an expression) disgraced themselves good-humouredly.,-0.4588,0.0,0.231,0.769,negative,The Moonstone
"All sorts of rough jests and catchwords were bandied about among them; and the story of the Diamond turned up again unexpectedly, in the form of a mischievous joke.",0.5574,0.15,0.0,0.85,positive,The Moonstone
"""Who's got the Moonstone?""",0.0,0.0,0.0,1.0,neutral,The Moonstone
"was the rallying cry which perpetually caused the plundering, as soon as it was stopped in one place, to break out in another.",-0.6124,0.0,0.192,0.808,negative,The Moonstone
"While I was still vainly trying to establish order, I heard a frightful yelling on the other side of the courtyard, and at once ran towards the cries, in dread of finding some new outbreak of the pillage in that direction.",-0.8402,0.0,0.205,0.795,negative,The Moonstone
"I got to an open door, and saw the bodies of two Indians (by their dress, as I guessed, officers of the palace) lying across the entrance, dead.",-0.8271,0.0,0.243,0.757,negative,The Moonstone
"A cry inside hurried me into a room, which appeared to serve as an armoury.",-0.4767,0.0,0.205,0.795,negative,The Moonstone
"A third Indian, mortally wounded, was sinking at the feet of a man whose back was towards me.",0.0,0.0,0.0,1.0,neutral,The Moonstone
"The man turned at the instant when I came in, and I saw John Herncastle, with a torch in one hand, and a dagger dripping with blood in the other.",0.4939,0.113,0.0,0.887,positive,The Moonstone
"A stone, set like a pommel, in the end of the dagger's handle, flashed in the torchlight, as he turned on me, like a gleam of fire.",0.3818,0.176,0.085,0.739,positive,The Moonstone
"The dying Indian sank to his knees, pointed to the dagger in Herncastle's hand, and said, in his native language--""The Moonstone will have its vengeance yet on you and yours!""",0.5411,0.107,0.0,0.893,positive,The Moonstone
"He spoke those words, and fell dead on the floor.",-0.6486,0.0,0.323,0.677,negative,The Moonstone
"Before I could stir in the matter, the men who had followed me across the courtyard crowded in.",0.0258,0.064,0.0,0.936,neutral,The Moonstone
"My cousin rushed to meet them, like a madman.",0.3612,0.263,0.0,0.737,positive,The Moonstone
"""Clear the room!""",0.4389,0.591,0.0,0.409,positive,The Moonstone
"he shouted to me, ""and set a guard on the door!""",0.0,0.0,0.0,1.0,neutral,The Moonstone
The men fell back as he threw himself on them with his torch and his dagger.,0.0,0.0,0.0,1.0,neutral,The Moonstone
"I put two sentinels of my own company, on whom I could rely, to keep the door.",0.0,0.0,0.0,1.0,neutral,The Moonstone
"Through the remainder of the night, I saw no more of my cousin.",-0.296,0.0,0.167,0.833,negative,The Moonstone
"Early in the morning, the plunder still going on, General Baird announced publicly by beat of drum, that any thief detected in the fact, be he whom he might, should be hung.",-0.5267,0.0,0.099,0.901,negative,The Moonstone
"The provost-marshal was in attendance, to prove that the General was in earnest; and in the throng that followed the proclamation, Herncastle and I met again.",0.5106,0.121,0.0,0.879,positive,The Moonstone
"He held out his hand, as usual, and said, ""Good morning.""",0.7269,0.404,0.0,0.596,positive,The Moonstone
I waited before I gave him my hand in return.,0.4939,0.314,0.0,0.686,positive,The Moonstone
"""Tell me first,"" I said, ""how the Indian in the armoury met his death, and what those last words meant, when he pointed to the dagger in your hand.""",-0.5994,0.0,0.126,0.874,negative,The Moonstone
"""The Indian met his death, as I suppose, by a mortal wound,"" said Herncastle.",-0.5994,0.0,0.262,0.738,negative,The Moonstone
"""What his last words meant I know no more than you do.""",-0.296,0.0,0.18,0.82,negative,The Moonstone
I looked at him narrowly.,0.0,0.0,0.0,1.0,neutral,The Moonstone
His frenzy of the previous day had all calmed down.,0.0772,0.202,0.178,0.62,positive,The Moonstone
I determined to give him another chance.,0.5267,0.524,0.0,0.476,positive,The Moonstone
"""Is that all you have to tell me?""",0.0,0.0,0.0,1.0,neutral,The Moonstone
I asked.,0.0,0.0,0.0,1.0,neutral,The Moonstone
"He answered, ""That is all.""",0.0,0.0,0.0,1.0,neutral,The Moonstone
I turned my back on him; and we have not spoken since.,0.0,0.0,0.0,1.0,neutral,The Moonstone
IV I beg it to be understood that what I write here about my cousin (unless some necessity should arise for making it public) is for the information of the family only.,0.0,0.0,0.0,1.0,neutral,The Moonstone
Herncastle has said nothing that can justify me in speaking to our commanding officer.,0.0,0.0,0.0,1.0,neutral,The Moonstone
"He has been taunted more than once about the Diamond, by those who recollect his angry outbreak before the assault; but, as may easily be imagined, his own remembrance of the circumstances under which I surprised him in the armoury has been enough to keep him silent.",0.3818,0.136,0.086,0.778,positive,The Moonstone
"It is reported that he means to exchange into another regiment, avowedly for the purpose of separating himself from me .",0.0,0.0,0.0,1.0,neutral,The Moonstone
"Whether this be true or not, I cannot prevail upon myself to become his accuser--and I think with good reason.",0.6908,0.263,0.0,0.737,positive,The Moonstone
"If I made the matter public, I have no evidence but moral evidence to bring forward.",-0.1406,0.072,0.109,0.819,negative,The Moonstone
I have not only no proof that he killed the two men at the door; I cannot even declare that he killed the third man inside--for I cannot say that my own eyes saw the deed committed.,-0.7913,0.093,0.209,0.698,negative,The Moonstone
"It is true that I heard the dying Indian's words; but if those words were pronounced to be the ravings of delirium, how could I contradict the assertion from my own knowledge?",-0.2617,0.058,0.09,0.852,negative,The Moonstone
"Let our relatives, on either side, form their own opinion on what I have written, and decide for themselves whether the aversion I now feel towards this man is well or ill founded.",-0.5574,0.059,0.159,0.782,negative,The Moonstone
"Although I attach no sort of credit to the fantastic Indian legend of the gem, I must acknowledge, before I conclude, that I am influenced by a certain superstition of my own in this matter.",0.7371,0.257,0.06,0.683,positive,The Moonstone
"It is my conviction, or my delusion, no matter which, that crime brings its own fatality with it.",-0.8779,0.043,0.403,0.553,negative,The Moonstone
"I am not only persuaded of Herncastle's guilt; I am even fanciful enough to believe that he will live to regret it, if he keeps the Diamond; and that others will live to regret taking it from him, if he gives the Diamond away.",-0.4404,0.097,0.156,0.747,negative,The Moonstone
"THE STORY FIRST PERIOD THE LOSS OF THE DIAMOND (1848) The Events related by Gabriel Betteredge, house-steward in the service of Julia, Lady Verinder.",0.0258,0.111,0.108,0.781,neutral,The Moonstone
"CHAPTER I In the first part of Robinson Crusoe , at page one hundred and twenty-nine, you will find it thus written: ""Now I saw, though too late, the Folly of beginning a Work before we count the Cost, and before we judge rightly of our own Strength to go through with it.""",0.4939,0.062,0.0,0.938,positive,The Moonstone
"Only yesterday, I opened my Robinson Crusoe at that place.",0.0,0.0,0.0,1.0,neutral,The Moonstone
"Only this morning (May twenty-first, eighteen hundred and fifty), came my lady's nephew, Mr. Franklin Blake, and held a short conversation with me, as follows:-- ""Betteredge,"" says Mr. Franklin, ""I have been to the lawyer's about some family matters; and, among other things, we have been talking of the loss of the Indian Diamond, in my aunt's house in Yorkshire, two years since.",0.0516,0.054,0.035,0.91,positive,The Moonstone
"Mr. Bruff thinks as I think, that the whole story ought, in the interests of truth, to be placed on record in writing--and the sooner the better.""",0.5106,0.152,0.0,0.848,positive,The Moonstone
"Not perceiving his drift yet, and thinking it always desirable for the sake of peace and quietness to be on the lawyer's side, I said I thought so too.",0.7003,0.188,0.0,0.812,positive,The Moonstone
Mr. Franklin went on.,0.0,0.0,0.0,1.0,neutral,The Moonstone
"""In this matter of the Diamond,"" he said, ""the characters of innocent people have suffered under suspicion already--as you know.",-0.5106,0.138,0.229,0.632,negative,The Moonstone
"The memories of innocent people may suffer, hereafter, for want of a record of the facts to which those who come after us can appeal.",-0.2023,0.131,0.124,0.745,negative,The Moonstone
There can be no doubt that this strange family story of ours ought to be told.,-0.6705,0.0,0.333,0.667,negative,The Moonstone
"And I think, Betteredge, Mr. Bruff and I together have hit on the right way of telling it.""",0.0,0.0,0.0,1.0,neutral,The Moonstone
"Very satisfactory to both of them, no doubt.",-0.228,0.224,0.376,0.4,negative,The Moonstone
"But I failed to see what I myself had to do with it, so far.",-0.6652,0.0,0.271,0.729,negative,The Moonstone
"""We have certain events to relate,"" Mr. Franklin proceeded; ""and we have certain persons concerned in those events who are capable of relating them.",0.7003,0.245,0.0,0.755,positive,The Moonstone
"Starting from these plain facts, the idea is that we should all write the story of the Moonstone in turn--as far as our own personal experience extends, and no farther.",-0.1779,0.047,0.069,0.883,negative,The Moonstone
"We must begin by showing how the Diamond first fell into the hands of my uncle Herncastle, when he was serving in India fifty years since.",0.34,0.088,0.0,0.912,positive,The Moonstone
"This prefatory narrative I have already got by me in the form of an old family paper, which relates the necessary particulars on the authority of an eye-witness.",0.0772,0.048,0.0,0.952,positive,The Moonstone
"The next thing to do is to tell how the Diamond found its way into my aunt's house in Yorkshire, two years ago, and how it came to be lost in little more than twelve hours afterwards.",0.0258,0.06,0.058,0.882,neutral,The Moonstone
"Nobody knows as much as you do, Betteredge, about what went on in the house at that time.",0.0,0.0,0.0,1.0,neutral,The Moonstone
"So you must take the pen in hand, and start the story.""",0.4939,0.225,0.0,0.775,positive,The Moonstone
In those terms I was informed of what my personal concern was with the matter of the Diamond.,0.3612,0.189,0.0,0.811,positive,The Moonstone
"If you are curious to know what course I took under the circumstances, I beg to inform you that I did what you would probably have done in my place.",0.3182,0.081,0.0,0.919,positive,The Moonstone
"I modestly declared myself to be quite unequal to the task imposed upon me--and I privately felt, all the time, that I was quite clever enough to perform it, if I only gave my own abilities a fair chance.",0.6808,0.231,0.096,0.673,positive,The Moonstone
"Mr. Franklin, I imagine, must have seen my private sentiments in my face.",0.0,0.0,0.0,1.0,neutral,The Moonstone
He declined to believe in my modesty; and he insisted on giving my abilities a fair chance.,0.7717,0.42,0.0,0.58,positive,The Moonstone
Two hours have passed since Mr. Franklin left me.,0.0,0.0,0.0,1.0,neutral,The Moonstone
"As soon as his back was turned, I went to my writing-desk to start the story.",0.0,0.0,0.0,1.0,neutral,The Moonstone
"There I have sat helpless (in spite of my abilities) ever since; seeing what Robinson Crusoe saw, as quoted above--namely, the folly of beginning a work before we count the cost, and before we judge rightly of our own strength to go through with it.",-0.4939,0.065,0.129,0.806,negative,The Moonstone
"Please to remember, I opened the book by accident, at that bit, only the day before I rashly undertook the business now in hand; and, allow me to ask--if that isn't prophecy, what is?",0.5106,0.192,0.081,0.727,positive,The Moonstone
I am not superstitious; I have read a heap of books in my time; I am a scholar in my own way.,0.0,0.0,0.0,1.0,neutral,The Moonstone
"Though turned seventy, I possess an active memory, and legs to correspond.",0.4019,0.213,0.0,0.787,positive,The Moonstone
"You are not to take it, if you please, as the saying of an ignorant man, when I express my opinion that such a book as Robinson Crusoe never was written, and never will be written again.",0.0516,0.061,0.056,0.882,positive,The Moonstone
I have tried that book for years--generally in combination with a pipe of tobacco--and I have found it my friend in need in all the necessities of this mortal life.,0.4939,0.11,0.0,0.89,positive,The Moonstone
When my spirits are bad-- Robinson Crusoe .,0.0,0.0,0.0,1.0,neutral,The Moonstone
When I want advice-- Robinson Crusoe .,0.0772,0.245,0.0,0.755,positive,The Moonstone
In past times when my wife plagued me; in present times when I have had a drop too much-- Robinson Crusoe .,-0.2732,0.0,0.104,0.896,negative,The Moonstone
I have worn out six stout Robinson Crusoes with hard work in my service.,-0.2263,0.111,0.235,0.654,negative,The Moonstone
On my lady's last birthday she gave me a seventh.,0.0,0.0,0.0,1.0,neutral,The Moonstone
I took a drop too much on the strength of it; and Robinson Crusoe put me right again.,0.2732,0.166,0.109,0.725,positive,The Moonstone
"Price four shillings and sixpence, bound in blue, with a picture into the bargain.",0.2023,0.13,0.0,0.87,positive,The Moonstone
"Still, this don't look much like starting the story of the Diamond--does it?",-0.2755,0.0,0.15,0.85,negative,The Moonstone
"I seem to be wandering off in search of Lord knows what, Lord knows where.",0.0,0.0,0.0,1.0,neutral,The Moonstone
"We will take a new sheet of paper, if you please, and begin over again, with my best respects to you.",0.8316,0.341,0.0,0.659,positive,The Moonstone
CHAPTER II I spoke of my lady a line or two back.,0.0,0.0,0.0,1.0,neutral,The Moonstone
"Now the Diamond could never have been in our house, where it was lost, if it had not been made a present of to my lady's daughter; and my lady's daughter would never have been in existence to have the present, if it had not been for my lady who (with pain and travail) produced her into the world.",-0.4939,0.038,0.089,0.873,negative,The Moonstone
"Consequently, if we begin with my lady, we are pretty sure of beginning far enough back.",0.6705,0.282,0.0,0.718,positive,The Moonstone
