sentence,compound,positive,negative,neutral,label,title
"The other two men were with Montgomery, erecting a pile of smaller packages on a low-wheeled truck.",0.0,0.0,0.0,1.0,neutral,The island of Doctor Moreau
The llama was still on the launch with the rabbit hutches; the staghounds were still lashed to the thwarts.,-0.1027,0.0,0.072,0.928,negative,The island of Doctor Moreau
"The pile of things completed, all three men laid hold of the truck and began shoving the ton-weight or so upon it after the puma.",0.0,0.0,0.0,1.0,neutral,The island of Doctor Moreau
"Presently Montgomery left them, and coming back to me held out his hand.",0.4939,0.211,0.0,0.789,positive,The island of Doctor Moreau
"""I'm glad,"" said he, ""for my own part.",0.0,0.0,0.0,1.0,neutral,The island of Doctor Moreau
That captain was a silly ass.,-0.5267,0.145,0.461,0.395,negative,The island of Doctor Moreau
"He'd have made things lively for you.""",0.4404,0.326,0.0,0.674,positive,The island of Doctor Moreau
"""It was you,"" said I, ""that saved me again.""",0.4215,0.259,0.0,0.741,positive,The island of Doctor Moreau
"""That depends.",0.0,0.0,0.0,1.0,neutral,The island of Doctor Moreau
"You'll find this island an infernally rum place, I promise you.",0.3182,0.204,0.0,0.796,positive,The island of Doctor Moreau
"I'd watch my goings carefully, if I were you.",0.128,0.176,0.0,0.824,positive,The island of Doctor Moreau
"He --"" He hesitated, and seemed to alter his mind about what was on his lips.",-0.3182,0.0,0.133,0.867,negative,The island of Doctor Moreau
"""I wish you'd help me with these rabbits,"" he said.",0.6597,0.403,0.0,0.597,positive,The island of Doctor Moreau
His procedure with the rabbits was singular.,0.0,0.0,0.0,1.0,neutral,The island of Doctor Moreau
"I waded in with him, and helped him lug one of the hutches ashore.",0.0,0.0,0.0,1.0,neutral,The island of Doctor Moreau
"No sooner was that done than he opened the door of it, and tilting the thing on one end turned its living contents out on the ground.",-0.296,0.0,0.078,0.922,negative,The island of Doctor Moreau
They fell in a struggling heap one on the top of the other.,-0.25,0.123,0.192,0.685,negative,The island of Doctor Moreau
"He clapped his hands, and forthwith they went off with that hopping run of theirs, fifteen or twenty of them I should think, up the beach.",0.0,0.0,0.0,1.0,neutral,The island of Doctor Moreau
"""Increase and multiply, my friends,"" said Montgomery.",0.3182,0.277,0.0,0.723,positive,The island of Doctor Moreau
"""Replenish the island.",0.0,0.0,0.0,1.0,neutral,The island of Doctor Moreau
"Hitherto we've had a certain lack of meat here.""",-0.0516,0.202,0.221,0.577,negative,The island of Doctor Moreau
"As I watched them disappearing, the white-haired man returned with a brandy-flask and some biscuits.",0.0,0.0,0.0,1.0,neutral,The island of Doctor Moreau
"""Something to go on with, Prendick,"" said he, in a far more familiar tone than before.",0.0,0.0,0.0,1.0,neutral,The island of Doctor Moreau
"I made no ado, but set to work on the biscuits at once, while the white-haired man helped Montgomery to release about a score more of the rabbits.",-0.1531,0.0,0.06,0.94,negative,The island of Doctor Moreau
"Three big hutches, however, went up to the house with the puma.",0.0,0.0,0.0,1.0,neutral,The island of Doctor Moreau
"The brandy I did not touch, for I have been an abstainer from my birth.",0.0,0.0,0.0,1.0,neutral,The island of Doctor Moreau
VII.,0.0,0.0,0.0,1.0,neutral,The island of Doctor Moreau
THE LOCKED DOOR.,0.0,0.0,0.0,1.0,neutral,The island of Doctor Moreau
"The reader will perhaps understand that at first everything was so strange about me, and my position was the outcome of such unexpected adventures, that I had no discernment of the relative strangeness of this or that thing.",-0.2883,0.059,0.111,0.83,negative,The island of Doctor Moreau
"I followed the llama up the beach, and was overtaken by Montgomery, who asked me not to enter the stone enclosure.",0.0,0.0,0.0,1.0,neutral,The island of Doctor Moreau
I noticed then that the puma in its cage and the pile of packages had been placed outside the entrance to this quadrangle.,0.0,0.0,0.0,1.0,neutral,The island of Doctor Moreau
"I turned and saw that the launch had now been unloaded, run out again, and was being beached, and the white-haired man was walking towards us.",0.0,0.0,0.0,1.0,neutral,The island of Doctor Moreau
He addressed Montgomery.,0.0,0.0,0.0,1.0,neutral,The island of Doctor Moreau
"""And now comes the problem of this uninvited guest.",-0.4019,0.0,0.252,0.748,negative,The island of Doctor Moreau
"What are we to do with him?""",0.0,0.0,0.0,1.0,neutral,The island of Doctor Moreau
"""He knows something of science,"" said Montgomery.",0.0,0.0,0.0,1.0,neutral,The island of Doctor Moreau
"""I'm itching to get to work again--with this new stuff,"" said the white-haired man, nodding towards the enclosure.",0.0,0.0,0.0,1.0,neutral,The island of Doctor Moreau
His eyes grew brighter.,0.3818,0.464,0.0,0.536,positive,The island of Doctor Moreau
"""I daresay you are,"" said Montgomery, in anything but a cordial tone.",0.0,0.0,0.0,1.0,neutral,The island of Doctor Moreau
"""We can't send him over there, and we can't spare the time to build him a new shanty; and we certainly can't take him into our confidence just yet.""",0.6908,0.18,0.0,0.82,positive,The island of Doctor Moreau
"""I'm in your hands,"" said I. I had no idea of what he meant by ""over there.""",-0.296,0.0,0.128,0.872,negative,The island of Doctor Moreau
"""I've been thinking of the same things,"" Montgomery answered.",0.0,0.0,0.0,1.0,neutral,The island of Doctor Moreau
"""There's my room with the outer door--"" ""That's it,"" said the elder man, promptly, looking at Montgomery; and all three of us went towards the enclosure.",0.0,0.0,0.0,1.0,neutral,The island of Doctor Moreau
"""I'm sorry to make a mystery, Mr. Prendick; but you'll remember you're uninvited.",-0.0387,0.0,0.095,0.905,neutral,The island of Doctor Moreau
"Our little establishment here contains a secret or so, is a kind of Blue-Beard's chamber, in fact.",0.0,0.0,0.0,1.0,neutral,The island of Doctor Moreau
"Nothing very dreadful, really, to a sane man; but just now, as we don't know you--"" ""Decidedly,"" said I, ""I should be a fool to take offence at any want of confidence.""",-0.6585,0.091,0.185,0.724,negative,The island of Doctor Moreau
"He twisted his heavy mouth into a faint smile--he was one of those saturnine people who smile with the corners of the mouth down,--and bowed his acknowledgment of my complaisance.",0.3612,0.082,0.0,0.918,positive,The island of Doctor Moreau
"The main entrance to the enclosure was passed; it was a heavy wooden gate, framed in iron and locked, with the cargo of the launch piled outside it, and at the corner we came to a small doorway I had not previously observed.",0.0,0.0,0.0,1.0,neutral,The island of Doctor Moreau
"The white-haired man produced a bundle of keys from the pocket of his greasy blue jacket, opened this door, and entered.",0.0,0.0,0.0,1.0,neutral,The island of Doctor Moreau
"His keys, and the elaborate locking-up of the place even while it was still under his eye, struck me as peculiar.",-0.1027,0.071,0.088,0.841,negative,The island of Doctor Moreau
"I followed him, and found myself in a small apartment, plainly but not uncomfortably furnished and with its inner door, which was slightly ajar, opening into a paved courtyard.",0.438,0.104,0.0,0.896,positive,The island of Doctor Moreau
This inner door Montgomery at once closed.,0.0,0.0,0.0,1.0,neutral,The island of Doctor Moreau
"A hammock was slung across the darker corner of the room, and a small unglazed window defended by an iron bar looked out towards the sea.",0.0,0.0,0.0,1.0,neutral,The island of Doctor Moreau
"This the white-haired man told me was to be my apartment; and the inner door, which ""for fear of accidents,"" he said, he would lock on the other side, was my limit inward.",-0.4939,0.0,0.091,0.909,negative,The island of Doctor Moreau
"He called my attention to a convenient deck-chair before the window, and to an array of old books, chiefly, I found, surgical works and editions of the Latin and Greek classics (languages I cannot read with any comfort), on a shelf near the hammock.",0.0,0.0,0.0,1.0,neutral,The island of Doctor Moreau
He left the roo,0.0,0.0,0.0,1.0,neutral,The island of Doctor Moreau
