sentence,compound,positive,negative,neutral,label,title
"Missowā edookan owāsi sek negi--' Why, it's Ojibway, not Cree,"" he exclaimed.",0.0,0.0,0.0,1.0,neutral,The silent places
"""They're just leaving a record.",0.0,0.0,0.0,1.0,neutral,The silent places
'Good journey from Moose Factory.,0.4404,0.42,0.0,0.58,positive,The silent places
Big game has been seen.',0.0,0.0,0.0,1.0,neutral,The silent places
Funny how plumb curious an Injun is.,0.6369,0.51,0.0,0.49,positive,The silent places
"They ain't one could come along here and see th' signs of this camp and rest easy 'till he'd figgered out how many they were, and where they were going, and what they were doing, and all about it.",0.4404,0.071,0.0,0.929,positive,The silent places
These records are a kind-hearted try to save other Injuns that come along a whole lot of trouble.,0.128,0.161,0.136,0.704,positive,The silent places
"That's why old Haukemah wrote it in Ojibway 'stead of Cree: this is by rights Ojibway country.""",0.0,0.0,0.0,1.0,neutral,The silent places
"""We'd better pike out, if we don't want to get back with th' squaws,"" suggested Dick.",-0.1586,0.142,0.221,0.637,negative,The silent places
"About two hours before noon, while the men's squadron was paddling slowly along a flat bank overgrown with grass and bushes, Dick and",-0.5106,0.0,0.136,0.864,negative,The silent places
