sentence,compound,positive,negative,neutral,label,title
"It appeared that Penelope had just come from our lodge, where she had been having a gossip with the lodge-keeper's daughter.",-0.1779,0.0,0.082,0.918,negative,The Moonstone
"The two girls had seen the Indians pass out, after I had warned them off, followed by their little boy.",-0.2732,0.0,0.104,0.896,negative,The Moonstone
"Taking it into their heads that the boy was ill-used by the foreigners--for no reason that I could discover, except that he was pretty and delicate-looking--the two girls had stolen along the inner side of the hedge between us and the road, and had watched the proceedings of the foreigners on the outer side.",-0.296,0.055,0.092,0.853,negative,The Moonstone
Those proceedings resulted in the performance of the following extraordinary tricks.,-0.128,0.0,0.13,0.87,negative,The Moonstone
"They first looked up the road, and down the road, and made sure that they were alone.",0.0772,0.119,0.104,0.777,positive,The Moonstone
"Then they all three faced about, and stared hard in the direction of our house.",-0.1027,0.0,0.091,0.909,negative,The Moonstone
"Then they jabbered and disputed in their own language, and looked at each other like men in doubt.",-0.34,0.112,0.219,0.67,negative,The Moonstone
"Then they all turned to their little English boy, as if they expected him to help them.",0.4019,0.144,0.0,0.856,positive,The Moonstone
"And then the chief Indian, who spoke English, said to the boy, ""Hold out your hand.""",0.0,0.0,0.0,1.0,neutral,The Moonstone
"On hearing those dreadful words, my daughter Penelope said she didn't know what prevented her heart from flying straight out of her.",-0.2672,0.076,0.16,0.764,negative,The Moonstone
I thought privately that it might have been her stays.,0.0,0.0,0.0,1.0,neutral,The Moonstone
"All I said, however, was, ""You make my flesh creep.""",0.0,0.0,0.0,1.0,neutral,The Moonstone
( Nota bene: Women like these little compliments.),0.3612,0.294,0.0,0.706,positive,The Moonstone
"Well, when the Indian said, ""Hold out your hand,"" the boy shrunk back, and shook his head, and said he didn't like it.",-0.1053,0.082,0.137,0.781,negative,The Moonstone
"The Indian, thereupon, asked him (not at all unkindly), whether he would like to be sent back to London, and left where they had found him, sleeping in an empty basket in a market--a hungry, ragged, and forsaken little boy.",0.1779,0.061,0.044,0.896,positive,The Moonstone
"This, it seems, ended the difficulty.",-0.34,0.0,0.324,0.676,negative,The Moonstone
The little chap unwillingly held out his hand.,0.4939,0.314,0.0,0.686,positive,The Moonstone
"Upon that, the Indian took a bottle from his bosom, and poured out of it some black stuff, like ink, into the palm of the boy's hand.",0.6908,0.192,0.0,0.808,positive,The Moonstone
"The Indian--first touching the boy's head, and making signs over it in the air--then said, ""Look.""",0.0,0.0,0.0,1.0,neutral,The Moonstone
"The boy became quite stiff, and stood like a statue, looking into the ink in the hollow of his hand.",0.6908,0.251,0.0,0.749,positive,The Moonstone
"(So far, it seemed to me to be juggling, accompanied by a foolish waste of ink.",-0.5994,0.0,0.274,0.726,negative,The Moonstone
"I was beginning to feel sleepy again, when Penelope's next words stirred me up.)",0.0,0.0,0.0,1.0,neutral,The Moonstone
"The Indians looked up the road and down the road once more--and then the chief Indian said these words to the boy; ""See the English gentleman from foreign parts.""",0.0,0.0,0.0,1.0,neutral,The Moonstone
"The boy said, ""I see him.""",0.0,0.0,0.0,1.0,neutral,The Moonstone
"The Indian said, ""Is it on the road to this house, and on no other, that the English gentleman will travel today?""",-0.296,0.0,0.095,0.905,negative,The Moonstone
"The boy said, ""It is on the road to this house, and on no other, that the English gentleman will travel today.""",-0.296,0.0,0.095,0.905,negative,The Moonstone
The Indian put a second question--after waiting a little first.,0.0,0.0,0.0,1.0,neutral,The Moonstone
"He said: ""Has the English gentleman got It about him?""",0.0,0.0,0.0,1.0,neutral,The Moonstone
"The boy answered--also, after waiting a little first--""Yes.""",0.0,0.0,0.0,1.0,neutral,The Moonstone
"The Indian put a third and last question: ""Will the English gentleman come here, as he has promised to come, at the close of day?""",0.3612,0.098,0.0,0.902,positive,The Moonstone
"The boy said, ""I can't tell.""",0.0,0.0,0.0,1.0,neutral,The Moonstone
The Indian asked why.,0.0,0.0,0.0,1.0,neutral,The Moonstone
"The boy said, ""I am tired.",-0.4404,0.0,0.367,0.633,negative,The Moonstone
"The mist rises in my head, and puzzles me.",0.0,0.0,0.0,1.0,neutral,The Moonstone
"I can see no more today.""",-0.296,0.0,0.355,0.645,negative,The Moonstone
With that the catechism ended.,0.0,0.0,0.0,1.0,neutral,The Moonstone
"The chief Indian said something in his own language to the other two, pointing to the boy, and pointing towards the town, in which (as we afterwards discovered) they were lodged.",0.0,0.0,0.0,1.0,neutral,The Moonstone
"He then, after making more signs on the boy's head, blew on his forehead, and so woke him up with a start.",0.0,0.0,0.0,1.0,neutral,The Moonstone
"After that, they all went on their way towards the town, and the girls saw them no more.",-0.296,0.0,0.115,0.885,negative,The Moonstone
"Most things they say have a moral, if you only look for it.",0.0,0.0,0.0,1.0,neutral,The Moonstone
What was the moral of this?,0.0,0.0,0.0,1.0,neutral,The Moonstone
"The moral was, as I thought: First, that the chief juggler had heard Mr. Franklin's arrival talked of among the servants out-of-doors, and saw his way to making a little money by it.",0.0,0.0,0.0,1.0,neutral,The Moonstone
"Second, that he and his men and boy (with a view to making the said money) meant to hang about till they saw my lady drive home, and then to come back, and foretell Mr. Franklin's arrival by magic.",0.0,0.0,0.0,1.0,neutral,The Moonstone
"Third, that Penelope had heard them rehearsing their hocus-pocus, like actors rehearsing a play.",0.5994,0.308,0.0,0.692,positive,The Moonstone
"Fourth, that I should do well to have an eye, that evening, on the plate-basket.",0.2732,0.139,0.0,0.861,positive,The Moonstone
"Fifth, that Penelope would do well to cool down, and leave me, her father, to doze off again in the sun.",0.4939,0.186,0.051,0.763,positive,The Moonstone
That appeared to me to be the sensible view.,0.0,0.0,0.0,1.0,neutral,The Moonstone
"If you know anything of the ways of young women, you won't be surprised to hear that Penelope wouldn't take it.",-0.1695,0.0,0.077,0.923,negative,The Moonstone
"The moral of the thing was serious, according to my daughter.",-0.0772,0.0,0.115,0.885,negative,The Moonstone
"She particularly reminded me of the Indian's third question, Has the English gentleman got It about him?",0.0,0.0,0.0,1.0,neutral,The Moonstone
"""Oh, father!""",0.0,0.0,0.0,1.0,neutral,The Moonstone
"says Penelope, clasping her hands, ""don't joke about this.",-0.2235,0.0,0.191,0.809,negative,The Moonstone
"What does 'It' mean?""",0.0,0.0,0.0,1.0,neutral,The Moonstone
"""We'll ask Mr. Franklin, my dear,"" I said, ""if you can wait till Mr. Franklin comes.""",0.0,0.0,0.0,1.0,neutral,The Moonstone
I winked to show I meant that in joke.,0.296,0.268,0.0,0.732,positive,The Moonstone
Penelope took it quite seriously.,-0.2484,0.0,0.333,0.667,negative,The Moonstone
My girl's earnestness tickled me.,0.0,0.0,0.0,1.0,neutral,The Moonstone
"""What on earth should Mr. Franklin know about it?""",0.0,0.0,0.0,1.0,neutral,The Moonstone
I inquired.,0.0,0.0,0.0,1.0,neutral,The Moonstone
"""Ask him,"" says Penelope.",0.0,0.0,0.0,1.0,neutral,The Moonstone
"""And see whether he thinks it a laughing matter, too.""",0.5106,0.381,0.0,0.619,positive,The Moonstone
"With that parting shot, my daughter left me.",0.0,0.0,0.0,1.0,neutral,The Moonstone
"I settled it with myself, when she was gone, that I really would ask Mr. Franklin--mainly to set Penelope's mind at rest.",0.0,0.0,0.0,1.0,neutral,The Moonstone
"What was said between us, when I did ask him, later on that same day, you will find set out fully in its proper place.",0.0,0.0,0.0,1.0,neutral,The Moonstone
"But as I don't wish to raise your expectations and then disappoint them, I will take leave to warn you here--before we go any further--that you won't find the ghost of a joke in our conversation on the subject of the jugglers.",-0.4756,0.11,0.196,0.694,negative,The Moonstone
"To my great surprise, Mr. Franklin, like Penelope, took the thing seriously.",0.7906,0.473,0.092,0.435,positive,The Moonstone
"How seriously, you will understand, when I tell you that, in his opinion, ""It"" meant the Moonstone.",-0.1779,0.0,0.102,0.898,negative,The Moonstone
CHAPTER IV I am truly sorry to detain you over me and my beehive chair.,-0.0516,0.161,0.228,0.611,negative,The Moonstone
"A sleepy old man, in a sunny back yard, is not an interesting object, I am well aware.",0.3903,0.256,0.118,0.626,positive,The Moonstone
"But things must be put down in their places, as things actually happened--and you must please to jog on a little while longer with me, in expectation of Mr. Franklin Blake's arrival later in the day.",0.4497,0.08,0.0,0.92,positive,The Moonstone
"Before I had time to doze off again, after my daughter Penelope had left me, I was disturbed by a rattling of plates and dishes in the servants' hall, which meant that dinner was ready.",-0.0258,0.071,0.074,0.855,neutral,The Moonstone
"Taking my own meals in my own sitting-room, I had nothing to do with the servants' dinner, except to wish them a good stomach to it all round, previous to composing myself once more in my chair.",0.6808,0.145,0.0,0.855,positive,The Moonstone
"I was just stretching my legs, when out bounced another woman on me.",0.0,0.0,0.0,1.0,neutral,The Moonstone
"Not my daughter again; only Nancy, the kitchen-maid, this time.",0.0,0.0,0.0,1.0,neutral,The Moonstone
"I was straight in her way out; and I observed, as she asked me to let her by, that she had a sulky face--a thing which, as head of the servants, I never allow, on principle, to pass me without inquiry.",-0.1446,0.048,0.088,0.864,negative,The Moonstone
"""What are you turning your back on your dinner for?""",0.0,0.0,0.0,1.0,neutral,The Moonstone
I asked.,0.0,0.0,0.0,1.0,neutral,The Moonstone
"""What's wrong now, Nancy?""",-0.4767,0.0,0.508,0.492,negative,The Moonstone
"Nancy tried to push by, without answering; upon which I rose up, and took her by the ear.",0.0,0.0,0.0,1.0,neutral,The Moonstone
"She is a nice plump young lass, and it is customary with me to adopt that manner of showing that I personally approve of a girl.",0.5423,0.176,0.0,0.824,positive,The Moonstone
"""What's wrong now?""",-0.4767,0.0,0.608,0.392,negative,The Moonstone
I said once more.,0.0,0.0,0.0,1.0,neutral,The Moonstone
"""Rosanna's late again for dinner,"" says Nancy.",0.0,0.0,0.0,1.0,neutral,The Moonstone
"""And I'm sent to fetch her in.",0.0,0.0,0.0,1.0,neutral,The Moonstone
All the hard work falls on my shoulders in this house.,-0.1027,0.0,0.123,0.877,negative,The Moonstone
"Let me alone, Mr.",-0.25,0.0,0.4,0.6,negative,The Moonstone
"Betteredge!""",0.0,0.0,0.0,1.0,neutral,The Moonstone
The person here mentioned as Rosanna was our second housemaid.,0.0,0.0,0.0,1.0,neutral,The Moonstone
"Having a kind of pity for our second housemaid (why, you shall presently know), and seeing in Nancy's face, that she would fetch her fellow-servant in with more hard words than might be needful under the circumstances, it struck me that I had nothing particular to do, and that I might as well fetch Rosanna myself; giving her a hint to be punctual in future, which I knew she would take kindly from me .",0.3641,0.1,0.08,0.819,positive,The Moonstone
"""Where is Rosanna?""",0.0,0.0,0.0,1.0,neutral,The Moonstone
I inquired.,0.0,0.0,0.0,1.0,neutral,The Moonstone
"""At the sands, of course!""",0.0,0.0,0.0,1.0,neutral,The Moonstone
"says Nancy, with a toss of her head.",0.0,0.0,0.0,1.0,neutral,The Moonstone
"""She had another of her fainting fits this morning, and she asked to go out and get a breath of fresh air.",0.3182,0.103,0.0,0.897,positive,The Moonstone
"I have no patience with her!""",-0.3595,0.0,0.384,0.616,negative,The Moonstone
"""Go back to your dinner, my girl,"" I said.",0.0,0.0,0.0,1.0,neutral,The Moonstone
"""I have patience with her, and I'll fetch her in.""",0.0,0.0,0.0,1.0,neutral,The Moonstone
Nancy (who has a fine appetite) looked pleased.,0.5719,0.485,0.0,0.515,positive,The Moonstone
"When she looks pleased, she looks nice.",0.6908,0.533,0.0,0.467,positive,The Moonstone
"When she looks nice, I chuck her under the chin.",0.4215,0.259,0.0,0.741,positive,The Moonstone
It isn't immorality--it's only habit.,0.0,0.0,0.0,1.0,neutral,The Moonstone
"Well, I took my stick, and set off for the sands.",0.2732,0.189,0.0,0.811,positive,The Moonstone
No!,-0.3595,0.0,1.0,0.0,negative,The Moonstone
it won't do to set off yet.,0.0,0.0,0.0,1.0,neutral,The Moonstone
"I am sorry again to detain you; but you really must hear the story of the sands, and the story of Rosanna--for this reason, that the matter of the Diamond touches them both nearly.",0.296,0.117,0.084,0.799,positive,The Moonstone
"How hard I try to get on with my statement without stopping by the way, and how badly I succeed!",0.1119,0.211,0.192,0.597,positive,The Moonstone
"But, there!--Persons and Things do turn up so vexatiously in this life, and will in a manner insist on being noticed.",0.0,0.0,0.0,1.0,neutral,The Moonstone
"Let us take it easy, and let us take it short; we shall be in the thick of the mystery soon, I promise you!",0.6696,0.207,0.0,0.793,positive,The Moonstone
"Rosanna (to put the Person before the Thing, which is but common politeness) was the only new servant in our house.",0.0,0.0,0.0,1.0,neutral,The Moonstone
"About four months before the time I am writing of, my lady had been in London, and had gone over a Reformatory, intended to save forlorn women from drifting back into bad ways, after they had got released from prison.",-0.5574,0.071,0.151,0.778,negative,The Moonstone
"The matron, seeing my lady took an interest in the place, pointed out a girl to her, named Rosanna Spearman, and told her a most miserable story, which I haven't the heart to repeat here; for I don't like to be made wretched without any use, and no more do you.",-0.5863,0.056,0.145,0.799,negative,The Moonstone
"The upshot of it was, that Rosanna Spearman had been a thief, and not being of the sort that get up Companies in the City, and rob from thousands, instead of only robbing from one, the law laid hold of her, and the prison and the reformatory followed the lead of the law.",-0.8834,0.0,0.174,0.826,negative,The Moonstone
"The matron's opinion of Rosanna was (in spite of what she had done) that the girl was one in a thousand, and that she only wanted a chance to prove herself worthy of any Christian woman's interest in her.",0.5423,0.178,0.077,0.745,positive,The Moonstone
"My lady (being a Christian woman, if ever there was one yet) said to the matron, upon that, ""Rosanna Spearman shall have her chance, in my service.""",0.25,0.074,0.0,0.926,positive,The Moonstone
"In a week afterwards, Rosanna Spearman entered this establishment as our second housemaid.",0.0,0.0,0.0,1.0,neutral,The Moonstone
"Not a soul was told the girl's story, excepting Miss Rachel and me.",-0.1531,0.0,0.127,0.873,negative,The Moonstone
"My lady, doing me the honour to consult me about most things, consulted me about Rosanna.",0.5719,0.198,0.0,0.802,positive,The Moonstone
"Having fallen a good deal latterly into the late Sir John's way of always agreeing with my lady, I agreed with her heartily about Rosanna Spearman.",0.5994,0.247,0.084,0.669,positive,The Moonstone
A fairer chance no girl could have had than was given to this poor girl of ours.,-0.5893,0.096,0.28,0.624,negative,The Moonstone
"None of the servants could cast her past life in her teeth, for none of the servants knew what it had been.",0.0,0.0,0.0,1.0,neutral,The Moonstone
"She had her wages and her privileges, like the rest of them; and every now and then a friendly word from my lady, in private, to encourage her.",0.891,0.335,0.0,0.665,positive,The Moonstone
"In return, she showed herself, I am bound to say, well worthy of the kind treatment bestowed upon her.",0.8126,0.359,0.0,0.641,positive,The Moonstone
"Though far from strong, and troubled occasionally with those fainting-fits already mentioned, she went about her work modestly and uncomplainingly, doing it carefully, and doing it well.",0.4404,0.21,0.091,0.699,positive,The Moonstone
"But, somehow, she failed to make friends among the other women servants, excepting my daughter Penelope, who was always kind to Rosanna, though never intimate with her.",0.6486,0.235,0.12,0.645,positive,The Moonstone
I hardly know what the girl did to offend them.,-0.296,0.0,0.216,0.784,negative,The Moonstone
"There was certainly no beauty about her to make the others envious; she was the plainest woman in the house, with the additional misfortune of having one shoulder bigger than the other.",0.4404,0.161,0.112,0.727,positive,The Moonstone
"What the servants chiefly resented, I think, was her silent tongue and her solitary ways.",-0.3818,0.0,0.167,0.833,negative,The Moonstone
She read or worked in leisure hours when the rest gossiped.,-0.2732,0.0,0.174,0.826,negative,The Moonstone
"And when it came to her turn to go out, nine times out of ten she quietly put on her bonnet, and had her turn by herself.",0.0,0.0,0.0,1.0,neutral,The Moonstone
"She never quarrelled, she never took offence; she only kept a certain distance, obstinately and civilly, between the rest of them and herself.",0.4567,0.166,0.0,0.834,positive,The Moonstone
"Add to this that, plain as she was, there was just a dash of something that wasn't like a housemaid, and that was like a lady, about her.",-0.4973,0.0,0.155,0.845,negative,The Moonstone
"It might have been in her voice, or it might have been in her face.",0.0,0.0,0.0,1.0,neutral,The Moonstone
"All I can say is, that the other women pounced on it like lightning the first day she came into the house, and said (which was most unjust) that Rosanna Spearman gave herself airs.",0.3612,0.072,0.0,0.928,positive,The Moonstone
"Having now told the story of Rosanna, I have only to notice one of the many queer ways of this strange girl to get on next to the story of the sands.",-0.25,0.0,0.062,0.938,negative,The Moonstone
Our house is high up on th,0.0,0.0,0.0,1.0,neutral,The Moonstone
