sentence,compound,positive,negative,neutral,label,title
"Whatever the explanation of the mystery may have been, the fact remained that Barrington, who knew nothing of the work except what he had learned since he had been taken on, was employed as a painter's labourer at the usual wages--fivepence per hour.",0.0,0.0,0.0,1.0,neutral,The Ragged Trousered Philanthropists
"He was about twenty-five years of age and a good deal taller than the majority of the others, being about five feet ten inches in height and slenderly though well and strongly built.",0.7269,0.197,0.0,0.803,positive,The Ragged Trousered Philanthropists
"He seemed very anxious to learn all that he could about the trade, and although rather reserved in his manner, he had contrived to make himself fairly popular with his workmates.",0.1298,0.082,0.067,0.851,positive,The Ragged Trousered Philanthropists
"He seldom spoke unless to answer when addressed, and it was difficult to draw him into conversation.",-0.3612,0.0,0.135,0.865,negative,The Ragged Trousered Philanthropists
"At meal-times, as on the present occasion, he generally smoked, apparently lost in thought and unconscious of his surroundings.",-0.3182,0.0,0.113,0.887,negative,The Ragged Trousered Philanthropists
Most of the others also lit their pipes and a desultory conversation ensued.,0.0,0.0,0.0,1.0,neutral,The Ragged Trousered Philanthropists
"""Is the gent what's bought this 'ouse any relation to Sweater the draper?""",0.0,0.0,0.0,1.0,neutral,The Ragged Trousered Philanthropists
"asked Payne, the carpenter's foreman.",0.0,0.0,0.0,1.0,neutral,The Ragged Trousered Philanthropists
"""It's the same bloke,"" replied Crass.",0.0,0.0,0.0,1.0,neutral,The Ragged Trousered Philanthropists
"""Didn't he used to be on the Town Council or something?""",0.0,0.0,0.0,1.0,neutral,The Ragged Trousered Philanthropists
"""'E's bin on the Council for years,"" returned Crass.",0.0,0.0,0.0,1.0,neutral,The Ragged Trousered Philanthropists
"""'E's on it now.",0.0,0.0,0.0,1.0,neutral,The Ragged Trousered Philanthropists
'E's mayor this year.,0.0,0.0,0.0,1.0,neutral,The Ragged Trousered Philanthropists
"'E's bin mayor several times before.""",0.0,0.0,0.0,1.0,neutral,The Ragged Trousered Philanthropists
"""Let's see,"" said Payne, reflectively, ""'e married old Grinder's sister, didn't 'e?",0.0,0.0,0.0,1.0,neutral,The Ragged Trousered Philanthropists
"You know who I mean, Grinder the greengrocer.""",0.0,0.0,0.0,1.0,neutral,The Ragged Trousered Philanthropists
"""Yes, I believe he did,"" said Crass.",0.0,0.0,0.0,1.0,neutral,The Ragged Trousered Philanthropists
"""It wasn't Grinder's sister,"" chimed in old Jack Linden.",0.0,0.0,0.0,1.0,neutral,The Ragged Trousered Philanthropists
"""It was 'is niece.",0.0,0.0,0.0,1.0,neutral,The Ragged Trousered Philanthropists
"I know, because I remember working in their 'ouse just after they was married, about ten year ago.""",0.0,0.0,0.0,1.0,neutral,The Ragged Trousered Philanthropists
"""Oh yes, I remember now,"" said Payne.",0.4019,0.351,0.0,0.649,positive,The Ragged Trousered Philanthropists
"""She used to manage one of Grinder's branch shops didn't she?""",0.0,0.0,0.0,1.0,neutral,The Ragged Trousered Philanthropists
"""Yes,"" replied Linden.",0.0,0.0,0.0,1.0,neutral,The Ragged Trousered Philanthropists
"""I remember it very well because there was a lot of talk about it at the time.",0.3384,0.138,0.0,0.862,positive,The Ragged Trousered Philanthropists
"By all accounts, ole Sweater used to be a regler 'ot un: no one never thought as he'd ever git married at all: there was some funny yarns about several young women what used to work for him.""",0.1779,0.072,0.055,0.873,positive,The Ragged Trousered Philanthropists
"This important matter being disposed of, there followed a brief silence, which was presently broken by Harlow.",-0.296,0.153,0.163,0.684,negative,The Ragged Trousered Philanthropists
"""Funny name to call a 'ouse, ain't it?""",0.4404,0.326,0.0,0.674,positive,The Ragged Trousered Philanthropists
he said.,0.0,0.0,0.0,1.0,neutral,The Ragged Trousered Philanthropists
"""'The Cave.'",0.0,0.0,0.0,1.0,neutral,The Ragged Trousered Philanthropists
"I wonder what made 'em give it a name like that.""",0.3612,0.238,0.0,0.762,positive,The Ragged Trousered Philanthropists
"""They calls 'em all sorts of outlandish names nowadays,"" said old Jack Linden.",0.0,0.0,0.0,1.0,neutral,The Ragged Trousered Philanthropists
"""There's generally some sort of meaning to it, though,"" observed Payne.",0.0,0.0,0.0,1.0,neutral,The Ragged Trousered Philanthropists
"""For instance, if a bloke backed a winner and made a pile, 'e might call 'is 'ouse, 'Epsom Lodge' or 'Newmarket Villa'.""",0.5994,0.224,0.0,0.776,positive,The Ragged Trousered Philanthropists
"""Or sometimes there's a hoak tree or a cherry tree in the garding,"" said another man; ""then they calls it 'Hoak Lodge' or 'Cherry Cottage'.""",0.0,0.0,0.0,1.0,neutral,The Ragged Trousered Philanthropists
"""Well, there's a cave up at the end of this garden,"" said Harlow with a grin, ""you know, the cesspool, what the drains of the 'ouse runs into; praps they called it after that.""",0.4767,0.091,0.0,0.909,positive,The Ragged Trousered Philanthropists
"""Talking about the drains,"" said old Jack Linden when the laughter produced by this elegant joke had ceased.",0.8412,0.376,0.0,0.624,positive,The Ragged Trousered Philanthropists
"""Talking about the drains, I wonder what they're going to do about them; the 'ouse ain't fit to live in as they are now, and as for that bloody cesspool it ought to be done away with.""",-0.6136,0.0,0.128,0.872,negative,The Ragged Trousered Philanthropists
"""So it is going to be,"" replied Crass.",0.0,0.0,0.0,1.0,neutral,The Ragged Trousered Philanthropists
"""There's going to be a new set of drains altogether, carried right out to the road and connected with the main.""",0.0,0.0,0.0,1.0,neutral,The Ragged Trousered Philanthropists
"Crass really knew no more about what was going to be done in this matter than did Linden, but he felt certain that this course would be adopted.",0.2437,0.122,0.057,0.821,positive,The Ragged Trousered Philanthropists
He never missed an opportunity of enhancing his own prestige with the men by insinuating that he was in the confidence of the firm.,0.4322,0.182,0.082,0.736,positive,The Ragged Trousered Philanthropists
"""That's goin' to cost a good bit,"" said Linden.",0.4404,0.293,0.0,0.707,positive,The Ragged Trousered Philanthropists
"""Yes, I suppose it will,"" replied Crass, ""but money ain't no object to old Sweater.",0.3252,0.152,0.0,0.848,positive,The Ragged Trousered Philanthropists
"'E's got tons of it; you know 'e's got a large wholesale business in London and shops all over the bloody country, besides the one 'e's got 'ere.""",-0.4404,0.0,0.1,0.9,negative,The Ragged Trousered Philanthropists
"Easton was still reading the Obscurer; he was not about to understand exactly what the compiler of the figures was driving at--probably the latter never intended that anyone should understand--but he was conscious of a growing feeling of indignation and hatred against foreigners of every description, who were ruining this country, and he began to think that it was about time we did something to protect ourselves.",-0.7003,0.077,0.127,0.796,negative,The Ragged Trousered Philanthropists
"Still, it was a very difficult question: to tell the truth, he himself could not make head or tail of it.",-0.1263,0.1,0.121,0.779,negative,The Ragged Trousered Philanthropists
"At length he said aloud, addressing himself to Crass: ""Wot do you think of this 'ere fissical policy, Bob?""",0.0,0.0,0.0,1.0,neutral,The Ragged Trousered Philanthropists
"""Ain't thought much about it,"" replied Crass.",0.0,0.0,0.0,1.0,neutral,The Ragged Trousered Philanthropists
"""I don't never worry my 'ed about politics.""",-0.2594,0.0,0.226,0.774,negative,The Ragged Trousered Philanthropists
"""Much better left alone,"" chimed in old Jack Linden sagely, ""argyfying about politics generally ends up with a bloody row an' does no good to nobody.""",0.1779,0.182,0.16,0.658,positive,The Ragged Trousered Philanthropists
At this there was a murmur of approval from several of the others.,0.4767,0.22,0.0,0.78,positive,The Ragged Trousered Philanthropists
Most of them were averse from arguing or disputing about politics.,-0.6908,0.0,0.388,0.612,negative,The Ragged Trousered Philanthropists
"If two or three men of similar opinions happened to be together they might discuss such things in a friendly and superficial way, but in a mixed company it was better left alone.",0.5346,0.163,0.069,0.768,positive,The Ragged Trousered Philanthropists
"The ""Fissical Policy"" emanated from the Tory party.",0.4019,0.278,0.0,0.722,positive,The Ragged Trousered Philanthropists
"That was the reason why some of them were strongly in favour of it, and for the same reason others were opposed to it.",0.6124,0.185,0.0,0.815,positive,The Ragged Trousered Philanthropists
"Some of them were under the delusion that they were Conservatives: similarly, others imagined themselves to be Liberals.",0.0,0.0,0.0,1.0,neutral,The Ragged Trousered Philanthropists
"As a matter of fact, most of them were nothing.",0.0258,0.121,0.0,0.879,neutral,The Ragged Trousered Philanthropists
They knew as much about the public affairs of their own country as they did of the condition of affairs in the planet of Jupiter.,0.0,0.0,0.0,1.0,neutral,The Ragged Trousered Philanthropists
"Easton began to regret that he had broached so objectionable a subject, when, looking up from his paper, Owen said: ""Does the fact that you never 'trouble your heads about politics' prevent you from voting at election times?""",-0.1134,0.084,0.07,0.847,negative,The Ragged Trousered Philanthropists
"No one answered, and there ensued a brief silence.",-0.296,0.0,0.239,0.761,negative,The Ragged Trousered Philanthropists
"Easton however, in spite of the snub he had received, could not refrain from talking.",-0.7351,0.0,0.323,0.677,negative,The Ragged Trousered Philanthropists
"""Well, I don't go in for politics much, either, but if what's in this 'ere paper is true, it seems to me as we oughter take some interest in it, when the country is being ruined by foreigners.""",0.5499,0.168,0.091,0.742,positive,The Ragged Trousered Philanthropists
"""If you're going to believe all that's in that bloody rag you'll want some salt,"" said Harlow.",-0.3818,0.068,0.151,0.781,negative,The Ragged Trousered Philanthropists
The Obscurer was a Tory paper and Harlow was a member of the local Liberal club.,0.0,0.0,0.0,1.0,neutral,The Ragged Trousered Philanthropists
Harlow's remark roused Crass.,0.0,0.0,0.0,1.0,neutral,The Ragged Trousered Philanthropists
"""Wot's the use of talkin' like that?""",0.3612,0.294,0.0,0.706,positive,The Ragged Trousered Philanthropists
"he said; ""you know very well that the country IS being ruined by foreigners.",-0.1796,0.137,0.177,0.686,negative,The Ragged Trousered Philanthropists
Just go to a shop to buy something; look round the place an' you'll see that more than 'arf the damn stuff comes from abroad.,-0.4019,0.0,0.105,0.895,negative,The Ragged Trousered Philanthropists
"They're able to sell their goods 'ere because they don't 'ave to pay no dooty, but they takes care to put 'eavy dooties on our goods to keep 'em out of their countries; and I say it's about time it was stopped.""",0.5924,0.121,0.036,0.844,positive,The Ragged Trousered Philanthropists
"""'Ear, 'ear,"" said Linden, who always agreed with Crass, because the latter, being in charge of the job, had it in his power to put in a good--or a bad--word for a man to the boss.",0.2732,0.062,0.0,0.938,positive,The Ragged Trousered Philanthropists
"""'Ear, 'ear!",0.0,0.0,0.0,1.0,neutral,The Ragged Trousered Philanthropists
"Now that's wot I call common sense.""",0.0,0.0,0.0,1.0,neutral,The Ragged Trousered Philanthropists
"Several other men, for the same reason as Linden, echoed Crass's sentiments, but Owen laughed contemptuously.",-0.1531,0.177,0.204,0.619,negative,The Ragged Trousered Philanthropists
"""Yes, it's quite true that we gets a lot of stuff from foreign countries,"" said Harlow, ""but they buys more from us than we do from them.""",0.2609,0.076,0.0,0.924,positive,The Ragged Trousered Philanthropists
"""Now you think you know a 'ell of a lot,"" said Crass.",0.0,0.0,0.0,1.0,neutral,The Ragged Trousered Philanthropists
"""'Ow much more did they buy from us last year, than we did from them?""",0.0,0.0,0.0,1.0,neutral,The Ragged Trousered Philanthropists
Harlow looked foolish: as a matter of fact his knowledge of the subject was not much wider than Crass's.,-0.25,0.057,0.109,0.833,negative,The Ragged Trousered Philanthropists
"He mumbled something about not having no 'ed for figures, and offered to bring full particulars next day.",0.2235,0.1,0.0,0.9,positive,The Ragged Trousered Philanthropists
"""You're wot I call a bloody windbag,"" continued Crass; ""you've got a 'ell of a lot to say, but wen it comes to the point you don't know nothin'.""",-0.2382,0.0,0.075,0.925,negative,The Ragged Trousered Philanthropists
"""Why, even 'ere in Mugsborough,"" chimed in Sawkins--who though still lying on the dresser had been awakened by the shouting--""We're overrun with 'em!",-0.5707,0.0,0.144,0.856,negative,The Ragged Trousered Philanthropists
"Nearly all the waiters and the cook at the Grand Hotel where we was working last month is foreigners.""",0.4588,0.143,0.0,0.857,positive,The Ragged Trousered Philanthropists
"""Yes,"" said old Joe Philpot, tragically, ""and then thers all them Hitalian horgin grinders, an' the blokes wot sells 'ot chestnuts; an' wen I was goin' 'ome last night I see a lot of them Frenchies sellin' hunions, an' a little wile afterwards I met two more of 'em comin' up the street with a bear.""",-0.5719,0.0,0.07,0.93,negative,The Ragged Trousered Philanthropists
"Notwithstanding the disquieting nature of this intelligence, Owen again laughed, much to the indignation of the others, who thought it was a very serious state of affairs.",0.3883,0.197,0.149,0.654,positive,The Ragged Trousered Philanthropists
It was a dam' shame that these people were allowed to take the bread out of English people's mouths: they ought to be driven into the bloody sea.,-0.7184,0.0,0.194,0.806,negative,The Ragged Trousered Philanthropists
"And so the talk continued, principally carried on by Crass and those who agreed with him.",0.2732,0.123,0.0,0.877,positive,The Ragged Trousered Philanthropists
None of them really understood the subject: not one of them had ever devoted fifteen consecutive minutes to the earnest investigation of it.,0.7184,0.222,0.0,0.778,positive,The Ragged Trousered Philanthropists
"The papers they read were filled with vague and alarming accounts of the quantities of foreign merchandise imported into this country, the enormous number of aliens constantly arriving, and their destitute conditions, how they lived, the crimes they committed, and the injury they did to British trade.",-0.3182,0.067,0.112,0.822,negative,The Ragged Trousered Philanthropists
"These were the seeds which, cunningly sown in their minds, caused to grow up within them a bitter undiscriminating hatred of foreigners.",-0.7906,0.0,0.269,0.731,negative,The Ragged Trousered Philanthropists
"To them the mysterious thing they variously called the ""Friscal Policy"", the ""Fistical Policy"", or the ""Fissical Question"" was a great Anti-Foreign Crusade.",0.6249,0.163,0.0,0.837,positive,The Ragged Trousered Philanthropists
"The country was in a hell of a state, poverty, hunger and misery in a hundred forms had already invaded thousands of homes and stood upon the thresholds of thousands more.",-0.9274,0.0,0.362,0.638,negative,The Ragged Trousered Philanthropists
How came these things to be?,0.0,0.0,0.0,1.0,neutral,The Ragged Trousered Philanthropists
It was the bloody foreigner!,-0.4926,0.0,0.444,0.556,negative,The Ragged Trousered Philanthropists
"Therefore, down with the foreigners and all their works.",0.0,0.0,0.0,1.0,neutral,The Ragged Trousered Philanthropists
Out with them.,0.0,0.0,0.0,1.0,neutral,The Ragged Trousered Philanthropists
Drive them b--s into the bloody sea!,-0.4926,0.0,0.347,0.653,negative,The Ragged Trousered Philanthropists
The country would be ruined if not protected in some way.,-0.6711,0.0,0.38,0.62,negative,The Ragged Trousered Philanthropists
"This Friscal, Fistical, Fissical or whatever the hell policy it was called, WAS Protection, therefore no one but a bloody fool could hesitate to support it.",-0.8807,0.095,0.395,0.509,negative,The Ragged Trousered Philanthropists
It was all quite plain--quite simple.,0.0,0.0,0.0,1.0,neutral,The Ragged Trousered Philanthropists
One did not need to think twice about it.,0.0,0.0,0.0,1.0,neutral,The Ragged Trousered Philanthropists
It was scarcely necessary to think about it at all.,0.0,0.0,0.0,1.0,neutral,The Ragged Trousered Philanthropists
This was the conclusion reached by Crass and such of his mates who thought they were Conservatives--the majority of them could not have read a dozen sentences aloud without stumbling--it was not necessary to think or study or investigate anything.,0.1531,0.066,0.0,0.934,positive,The Ragged Trousered Philanthropists
It was all as clear as daylight.,0.3818,0.302,0.0,0.698,positive,The Ragged Trousered Philanthropists
"The foreigner was the enemy, and the cause of poverty and bad trade.",-0.8834,0.0,0.507,0.493,negative,The Ragged Trousered Philanthropists
"When the storm had in some degree subsided, ""Some of you seem to think,"" said Owen, sneeringly, ""that it was a great mistake on God's part to make so many foreigners.",0.4019,0.119,0.07,0.812,positive,The Ragged Trousered Philanthropists
"You ought to hold a mass meeting about it: pass a resolution something like this: 'This meeting of British Christians hereby indignantly protests against the action of the Supreme Being in having created so many foreigners, and calls upon him to forthwith rain down fire, brimstone and mighty rocks upon the heads of all those Philistines, so that they may be utterly exterminated from the face of the earth, which rightly belongs to the British people'.""",0.5859,0.1,0.053,0.848,positive,The Ragged Trousered Philanthropists
"Crass looked very indignant, but could think of nothing to say in answer to Owen, who continued: ""A little while ago you made the remark that you never trouble yourself about what you call politics, and some of the rest agreed with you that to do so is not worth while.",0.2723,0.097,0.078,0.825,positive,The Ragged Trousered Philanthropists
"Well, since you never 'worry' yourself about these things, it follows that you know nothing about them; yet you do not hesitate to express the most decided opinions concerning matters of which you admittedly know nothing.",0.4614,0.132,0.0,0.868,positive,The Ragged Trousered Philanthropists
"Presently, when there is an election, you will go and vote in favour of a policy of which you know nothing.",0.4404,0.132,0.0,0.868,positive,The Ragged Trousered Philanthropists
I say that since you never take the trouble to find out which side is right or wrong you have no right to express any opinion.,-0.4664,0.076,0.179,0.744,negative,The Ragged Trousered Philanthropists
You are not fit to vote.,-0.2755,0.0,0.297,0.703,negative,The Ragged Trousered Philanthropists
"You should not be allowed to vote.""",0.0,0.0,0.0,1.0,neutral,The Ragged Trousered Philanthropists
Crass was by this time very angry.,-0.5563,0.0,0.375,0.625,negative,The Ragged Trousered Philanthropists
"""I pays my rates and taxes,"" he shouted, ""an' I've got as much right to express an opinion as you 'ave.",0.0,0.0,0.0,1.0,neutral,The Ragged Trousered Philanthropists
I votes for who the bloody 'ell I likes.,-0.0258,0.262,0.271,0.467,neutral,The Ragged Trousered Philanthropists
I shan't arst your leave nor nobody else's!,0.1129,0.194,0.0,0.806,positive,The Ragged Trousered Philanthropists
"Wot the 'ell's it got do with you who I votes for?""",0.0,0.0,0.0,1.0,neutral,The Ragged Trousered Philanthropists
"""It has a great deal to do with me.",0.6249,0.369,0.0,0.631,positive,The Ragged Trousered Philanthropists
"If you vote for Protection you will be helping to bring it about, and if you succeed, and if Protection is the evil that some people say it is, I shall be one of those who will suffer.",-0.5423,0.117,0.171,0.713,negative,The Ragged Trousered Philanthropists
"I say you have no right to vote for a policy which may bring suffering upon other people, without taking the trouble to find out whether you are helping to make things better or worse.""",0.2635,0.181,0.13,0.689,positive,The Ragged Trousered Philanthropists
Owen had risen from his seat and was walking up and down the room emphasizing his words with excited gestures.,0.34,0.112,0.0,0.888,positive,The Ragged Trousered Philanthropists
"""As for not trying to find out wot side is right,"" said Crass, somewhat overawed by Owen's manner and by what he thought was the glare of madness in the latter's eyes, ""I reads the Ananias every week, and I generally takes the Daily Chloroform, or the Hobscurer, so I ought to know summat about it.""",-0.4404,0.0,0.052,0.948,negative,The Ragged Trousered Philanthropists
"""Just listen to this,"" interrupted Easton, wishing to create a diversion and beginning to read from the copy of the Obscurer which he still held in his hand: ""GREAT DISTRESS IN MUGSBOROUGH.",0.6908,0.277,0.146,0.576,positive,The Ragged Trousered Philanthropists
HUNDREDS OUT OF EMPLOYMENT.,0.0,0.0,0.0,1.0,neutral,The Ragged Trousered Philanthropists
WORK OF THE CHARITY SOCIETY.,0.4215,0.412,0.0,0.588,positive,The Ragged Trousered Philanthropists
789 CASES ON THE BOOKS.,0.0,0.0,0.0,1.0,neutral,The Ragged Trousered Philanthropists
"""Great as was the distress among the working classes last year, unfortunately there seems every prospect that before the winter which has just commenced is over the distress will be even more acute.",-0.4404,0.145,0.211,0.644,negative,The Ragged Trousered Philanthropists
Already the Charity Society and kindred associations are relieving more cases than they did at the corresponding time last year.,0.6486,0.227,0.0,0.773,positive,The Ragged Trousered Philanthropists
"Applications to the Board of Guardians have also been much more numerous, and the Soup Kitchen has had to open its doors on Nov. 7th a fortnight earlier than usual.",0.0,0.0,0.0,1.0,neutral,The Ragged Trousered Philanthropists
"The number of men, women and children provided with meals is three or four times greater than last year.""",0.4215,0.183,0.0,0.817,positive,The Ragged Trousered Philanthropists
Easton stopped: reading was hard work to him.,-0.3182,0.0,0.355,0.645,negative,The Ragged Trousered Philanthropists
"""There's a lot more,"" he said, ""about starting relief works: two shillings a day for married men and one shilling for single and something about there's been 1,572 quarts of soup given to poor families wot was not even able to pay a penny, and a lot more.",-0.1027,0.064,0.093,0.844,negative,The Ragged Trousered Philanthropists
"And 'ere's another thing, an advertisement: ""THE SUFFERING POOR Sir: Distress among the poor is so acute that I earnestly ask you for aid for The Salvation Army's great Social work on their behalf.",-0.8769,0.089,0.306,0.605,negative,The Ragged Trousered Philanthropists
Some 600 are being sheltered nightly.,0.0,0.0,0.0,1.0,neutral,The Ragged Trousered Philanthropists
Hundreds are found work daily.,0.0,0.0,0.0,1.0,neutral,The Ragged Trousered Philanthropists
Soup and bread are distributed in the midnight hours to homeless wanderers in London.,0.0,0.0,0.0,1.0,neutral,The Ragged Trousered Philanthropists
Additional workshops for the unemployed have been established.,0.0,0.0,0.0,1.0,neutral,The Ragged Trousered Philanthropists
"Our Social Work for men, women and children, for the characterless and the outcast, is the largest and oldest organized effort of its kind in the country, and greatly needs help.",0.749,0.18,0.0,0.82,positive,The Ragged Trousered Philanthropists
"£10,000 is required before Christmas Day.",0.0,0.0,0.0,1.0,neutral,The Ragged Trousered Philanthropists
"Gifts may be made to any specific section or home, if desired.",0.2732,0.16,0.0,0.84,positive,The Ragged Trousered Philanthropists
Can you please send us something to keep the work going?,0.3182,0.187,0.0,0.813,positive,The Ragged Trousered Philanthropists
"Please address cheques, crossed Bank of England (Law Courts Branch), to me at 101, Queen Victoria Street, EC.",0.3182,0.119,0.0,0.881,positive,The Ragged Trousered Philanthropists
Balance Sheets and Reports upon application.,0.0,0.0,0.0,1.0,neutral,The Ragged Trousered Philanthropists
"""BRAMWELL BOOTH.""",0.0,0.0,0.0,1.0,neutral,The Ragged Trousered Philanthropists
"""Oh, that's part of the great 'appiness an' prosperity wot Owen makes out Free Trade brings,"" said Crass with a jeering laugh.",0.9001,0.379,0.0,0.621,positive,The Ragged Trousered Philanthropists
"""I never said Free Trade brought happiness or prosperity,"" said Owen.",0.2259,0.235,0.177,0.588,positive,The Ragged Trousered Philanthropists
"""Well, praps you didn't say exactly them words, but that's wot it amounts to.""",0.0,0.0,0.0,1.0,neutral,The Ragged Trousered Philanthropists
"""I never said anything of the kind.",0.5267,0.362,0.0,0.638,positive,The Ragged Trousered Philanthropists
"We've had Free Trade for the last fifty years and today most people are living in a condition of more or less abject poverty, and thousands are literally starving.",-0.3657,0.097,0.171,0.733,negative,The Ragged Trousered Philanthropists
When we had Protection things were worse still.,-0.4767,0.0,0.307,0.693,negative,The Ragged Trousered Philanthropists
