sentence,compound,positive,negative,neutral,label,title
The scars of that long combat throbbed through his consciousness.,-0.34,0.0,0.211,0.789,negative,The silent places
"The twisting of his strong hands, the loosening of the elasticity, the humbling of the spirit, the caution that had displaced the carelessness of youth, the keenness of eye, the patience,--all these were at once the marks of blows and the spoils of victory received from the Enemy.",0.128,0.131,0.105,0.764,positive,The silent places
"The wilderness, calm, ruthless, just, terrible, waited in the shadow of the forest, seeking no combat, avoiding none, conquering with a lofty air of predestination, yielding superbly as though the moment's victory for which a man had strained the fibres of his soul were, after all, a little, unimportant thing; never weary, never exultant, dispassionate, inevitable, mighty, whose emotions were silence, whose speech was silence, whose most terrible weapon was the great white silence that smothered men's spirits.",-0.8566,0.114,0.234,0.652,negative,The silent places
Sam Bolton clearly saw the North.,0.4019,0.351,0.0,0.649,positive,The silent places
He felt against him the steady pressure of her resistance.,-0.296,0.0,0.196,0.804,negative,The silent places
"She might yield, but relentlessly regained her elasticity.",0.0,0.0,0.0,1.0,neutral,The silent places
Men's efforts against her would tire; the mechanics of her power remained constant.,0.0,0.0,0.0,1.0,neutral,The silent places
"What she lost in the moments of her opponent's might, she recovered in the hours of his weakness, so that at the last she won, poised in her original equilibrium above the bodies of her antagonists.",0.0516,0.175,0.17,0.655,positive,The silent places
"Dimly he felt these things, personifying the wilderness in his imagination of the old man, arranging half-consciously his weapons of craft in their due order.",-0.4404,0.0,0.108,0.892,negative,The silent places
"Somewhere out beyond in those woods, at any one of the thirty-two points of the compass, a man was lurking.",-0.128,0.0,0.077,0.923,negative,The silent places
He might be five or five hundred miles away.,0.0,0.0,0.0,1.0,neutral,The silent places
He was an expert at taking care of himself in the woods.,0.4939,0.225,0.0,0.775,positive,The silent places
Abruptly Sam Bolton began to formulate his thoughts aloud.,0.0,0.0,0.0,1.0,neutral,The silent places
"""We got to keep him or anybody else from knowin' we's after him, Dick,"" said he.",0.0,0.0,0.0,1.0,neutral,The silent places
"""Jest as soon as he knows that, it's just too easy for him to keep out of our way.",0.4404,0.139,0.0,0.861,positive,The silent places
"Lucky Jingoss is an Ojibway, and his people are way off south.",0.4215,0.203,0.0,0.797,positive,The silent places
We can fool this crowd here easy enough; we'll tell 'em we're looking for new locations for winter posts.,0.0,0.127,0.127,0.746,neutral,The silent places
"But she's an awful big country.""",-0.6124,0.0,0.444,0.556,negative,The silent places
"""Which way'll we go first?""",0.0,0.0,0.0,1.0,neutral,The silent places
"asked Dick, without, however, much interest in the reply.",-0.6985,0.0,0.452,0.548,negative,The silent places
Whatever Sam decided was sure to be all right.,0.3182,0.223,0.0,0.777,positive,The silent places
"""It's this way,"" replied the latter.",0.0,0.0,0.0,1.0,neutral,The silent places
"""He's got to trade somewheres.",0.0,0.0,0.0,1.0,neutral,The silent places
He can't come into any of the Posts here at the Bay.,0.0,0.0,0.0,1.0,neutral,The silent places
What's the nearest?,0.0,0.0,0.0,1.0,neutral,The silent places
"Why, Missináibie, down in Lake Superior country.",0.5423,0.368,0.0,0.632,positive,The silent places
Probably he's down in that country somewheres.,0.0,0.0,0.0,1.0,neutral,The silent places
"We'll start south.""",0.0,0.0,0.0,1.0,neutral,The silent places
"""That's Ojibway country,"" hazarded Dick at random.",-0.5106,0.0,0.355,0.645,negative,The silent places
"""It's Ojibway country, but Jingoss is a Georgian Bay Ojibway.",0.0,0.0,0.0,1.0,neutral,The silent places
"Down near Missináibie every Injun has his own hunting district, and they're different from our Crees,--they stick pretty close to their district.",0.4939,0.132,0.0,0.868,positive,The silent places
"Any strangers trying to hunt and trap there are going to get shot, sure pop.",0.0,0.131,0.131,0.739,neutral,The silent places
"That makes me think that if Jingoss has gone south, and if he's trading now at Missináibie, and if he ain't chummed up with some of them Ojibways to get permission to trap in their allotments, and if he ain't pushed right on home to his own people or out west to Winnipeg country, then most likely we'll find him somewheres about the region of th' Kabinakágam.""",-0.3182,0.0,0.034,0.966,negative,The silent places
"""So we'll go up th' Missináibie River first,"" surmised Dick.",-0.5106,0.0,0.268,0.732,negative,The silent places
"""That's how we'll make a start,"" assented Bolton.",0.0,0.0,0.0,1.0,neutral,The silent places
"As though this decision had terminated an interview, they turned with one accord toward the dim group of their companions.",0.0,0.0,0.0,1.0,neutral,The silent places
"As they approached, they were acclaimed.",0.0,0.0,0.0,1.0,neutral,The silent places
"""Here he is,"" ""Dick, come here,"" ""Dick, sing us the song.",0.0,0.0,0.0,1.0,neutral,The silent places
"Chante donc 'Oncle Naid,' Deeck.""",0.0,0.0,0.0,1.0,neutral,The silent places
"And Dick, leaning carelessly against the breech of the field-guns, in a rich, husky baritone crooned to the far north the soft syllables of the far south. """,-0.1779,0.113,0.166,0.721,negative,The silent places
"Oh, there was an old darkey, and his name was Uncle Ned, And he lived long ago, long ago! """,0.0,0.0,0.0,1.0,neutral,The silent places
"CHAPTER THREE In the selection of paddles early next morning Sam insisted that the Indian rule be observed, measuring carefully that the length of each implement should just equal the height of its wielder.",0.128,0.043,0.0,0.957,positive,The silent places
"He chose the narrow maple blade, that it might not split when thrust against the bottom to check speed in a rapid.",0.0,0.0,0.0,1.0,neutral,The silent places
Further the blades were stained a brilliant orange.,0.5859,0.388,0.0,0.612,positive,The silent places
Dick Herron had already picked one of a dozen birch-bark canoes laid away under the bridge over the dry coulee.,-0.5106,0.0,0.155,0.845,negative,The silent places
He knew a good canoe as you would know a good horse.,0.7003,0.42,0.0,0.58,positive,The silent places
"Fourteen feet it measured, of the heavy winter-cut of bark, and with a bottom all of one piece, without cracks or large knots.",0.0,0.0,0.0,1.0,neutral,The silent places
The canoe and the paddles they laid at the water's edge.,0.0,0.0,0.0,1.0,neutral,The silent places
"Then they went together to the great warehouse, behind the grill of whose upper room MacDonald was writing.",0.6249,0.194,0.0,0.806,positive,The silent places
"Ordinarily the trappers were not allowed inside the grill, but Dick and Sam were told to help themselves freely.",0.4497,0.266,0.16,0.575,positive,The silent places
"The stocking Dick left to his older companion, assuring himself merely of an hundred rounds of ammunition for his new model Winchester rifle, the 44-40 repeater, then just entering the outskirts of its popularity.",0.34,0.143,0.082,0.775,positive,The silent places
"In the obscurity of the wide, low room the old woodsman moved to and fro, ducking his head to avoid things hanging, peering into corners, asking an occasional question of MacDonald, who followed him silently about.",-0.5106,0.0,0.112,0.888,negative,The silent places
"Two small steel traps, a narrow, small-meshed fish-net, a fish-line and hooks, powder, ball, and caps for the old man's muzzle-loader, a sack of salt were first laid aside.",0.0,0.0,0.0,1.0,neutral,The silent places
This represented subsistence.,0.0,0.0,0.0,1.0,neutral,The silent places
"Then matches, a flint-and-steel machine, two four-point blankets.",0.0,0.0,0.0,1.0,neutral,The silent places
These meant warmth.,0.4588,0.6,0.0,0.4,positive,The silent places
Then ten pounds of plug tobacco and as many of tea.,0.0,0.0,0.0,1.0,neutral,The silent places
These were necessary luxuries.,0.0,0.0,0.0,1.0,neutral,The silent places
And finally a small sack of flour and a side of bacon.,0.0,0.0,0.0,1.0,neutral,The silent places
"These were merely a temporary provision; when they should be exhausted, the men would rely wholly on the forest.",-0.3612,0.0,0.128,0.872,negative,The silent places
"Sam Bolton hovered over the pile, after it was completed, his eyes half shut, naming over its items again and again, assuring himself that nothing lacked.",0.3818,0.094,0.0,0.906,positive,The silent places
At his side MacDonald made suggestions.,0.0,0.0,0.0,1.0,neutral,The silent places
"""Got a copper pail, Sam?",0.0,0.0,0.0,1.0,neutral,The silent places
a frying-pan?,0.0,0.0,0.0,1.0,neutral,The silent places
cups?,0.0,0.0,0.0,1.0,neutral,The silent places
How about the axe?,-0.1027,0.0,0.318,0.682,negative,The silent places
Better have an extra knife between you.,0.4404,0.326,0.0,0.674,positive,The silent places
Need any clothes?,0.0,0.0,0.0,1.0,neutral,The silent places
"Compass all right?""",0.0,0.0,0.0,1.0,neutral,The silent places
To each of these questions Sam nodded an assent.,0.0,0.0,0.0,1.0,neutral,The silent places
"So MacDonald, having named everything--with the exception of the canvas square to be used as a tarpaulin or a tent, and soap and towel--fell silent, convinced that he could do nothing more.",0.4019,0.085,0.0,0.915,positive,The silent places
"But Dick, who had been drumming his fingers idly against the window, turned with a suggestion of his own.",-0.6652,0.0,0.207,0.793,negative,The silent places
"""How're we fixed for shoe pacs?",0.0,0.0,0.0,1.0,neutral,The silent places
"I haven't got any.""",0.0,0.0,0.0,1.0,neutral,The silent places
At once MacDonald looked blank.,0.0,0.0,0.0,1.0,neutral,The silent places
"""By George, boys, I ain't got but four or five pairs of moccasins in the place!",0.0,0.0,0.0,1.0,neutral,The silent places
There's plenty of oil tan; I can fix you all right there.,0.0,0.0,0.0,1.0,neutral,The silent places
But smoke tans!,0.0,0.0,0.0,1.0,neutral,The silent places
That Abítibi gang mighty near cleaned me out.,0.0,0.0,0.0,1.0,neutral,The silent places
"You'll have to try the Indians.""",0.0,0.0,0.0,1.0,neutral,The silent places
"Accordingly Bolton and Herron took their way in the dusty little foot-trodden path--there were no horses in that frontier--between the Factor's residence and the Clerk's house, down the meandering trail through the high grasses of the meadow to where the Indian lodges lifted their pointed tops against the sky.",0.2732,0.063,0.042,0.895,positive,The silent places
The wigwams were scattered apparently at random.,0.0,0.0,0.0,1.0,neutral,The silent places
Before each a fire burned.,-0.34,0.0,0.444,0.556,negative,The silent places
Women and girls busied themselves with a variety of camp-work.,0.0,0.0,0.0,1.0,neutral,The silent places
"A tame crow hopped and fluttered here and there just out of reach of the pointed-nosed, shaggy wolf-dogs.",0.0258,0.064,0.0,0.936,neutral,The silent places
"The latter rushed madly forward at the approaching strangers, yelping in a curious, long-drawn bay, more suggestive of their wolf ancestors than of the domestic animal.",-0.1027,0.082,0.096,0.821,negative,The silent places
Dick and Sam laid about them vigorously with short staffs they had brought for the purpose.,-0.4215,0.08,0.176,0.745,negative,The silent places
"Immediately the dogs, recognising their dominance, slunk back.",0.2023,0.205,0.0,0.795,positive,The silent places
"Three men sauntered forward, grinning broadly in amiable greeting.",0.6249,0.421,0.0,0.579,positive,The silent places
"Two or three women, more bashful than the rest, scuttled into the depths of wigwams out of sight.",-0.101,0.0,0.076,0.924,negative,The silent places
"A multitude of children concealed themselves craftily, like a covey of quail, and focussed their bright, bead-like eyes on the new-comers.",0.6597,0.241,0.0,0.759,positive,The silent places
The rest of the camp went its way unmoved.,0.0,0.0,0.0,1.0,neutral,The silent places
"""Bo' jou', bo' jou',"" greeted Sam Bolton.",0.2732,0.259,0.0,0.741,positive,The silent places
"""Bo' jou', bo' jou',"" replied the three.",0.0,0.0,0.0,1.0,neutral,The silent places
These Indians were of the far upper country.,0.0,0.0,0.0,1.0,neutral,The silent places
"They spoke no English nor French, and adhered still to their own tribal customs and religious observances.",-0.296,0.0,0.121,0.879,negative,The silent places
They had lingered several days beyond their time for the purpose of conjuring.,0.0,0.0,0.0,1.0,neutral,The silent places
In fact at this very moment the big medicine lodge raised itself in the centre of the encampment like a miniature circus tent.,0.3612,0.106,0.0,0.894,positive,The silent places
Sam Bolton addressed the two in their own language.,0.0,0.0,0.0,1.0,neutral,The silent places
"""We wish to buy many moccasins of your old women,"" said Sam.",0.4019,0.197,0.0,0.803,positive,The silent places
Immediately one of the Indians glided away.,0.0,0.0,0.0,1.0,neutral,The silent places
"From time to time during the next few minutes he was intermittently visible as he passed from the dark interior of one wigwam, across the sunlight, and into the dark interior of another.",0.0,0.0,0.0,1.0,neutral,The silent places
The older of the two still in company of the white men began to ask questions.,0.0,0.0,0.0,1.0,neutral,The silent places
"""The Little Father is about to make a long journey?""",0.0,0.0,0.0,1.0,neutral,The silent places
"""Does one buy so many moccasins for a short?""",0.0,0.0,0.0,1.0,neutral,The silent places
"""He goes to hunt the fur?""",0.0,0.0,0.0,1.0,neutral,The silent places
"""Perhaps.""",0.0,0.0,0.0,1.0,neutral,The silent places
"""In what direction does he set the bow of his canoe?""",0.0,0.0,0.0,1.0,neutral,The silent places
"Suddenly Dick Herron, who had, as usual, been paying attention to almost anything rather than the matter in hand, darted suddenly toward a clump of grass.",0.0,0.145,0.111,0.743,neutral,The silent places
In a moment he straightened his back to hold at arm's length a struggling little boy.,-0.4215,0.0,0.177,0.823,negative,The silent places
"At the instant of his seizure the child uttered a sharp cry of fright, then closed his lips in the stoicism of his race.",-0.6908,0.0,0.213,0.787,negative,The silent places
"That one cry was enough, however.",-0.4767,0.0,0.383,0.617,negative,The silent places
Rescue darted from the nearest wigwam.,0.5106,0.398,0.0,0.602,positive,The silent places
"A flying figure covered the little distance in a dozen graceful leaps, snatched the child from the young man's hands and stood, one foot advanced, breast heaving, a palpitating, wild thing, like a symbol of defiance.",0.7579,0.205,0.0,0.795,positive,The silent places
The girl belonged distinctly to the more attractive type; it required but little imagination to endow her with real beauty.,0.8072,0.288,0.0,0.712,positive,The silent places
"Her figure was straight and slim and well-proportioned, her eyes large, her face oval and quite devoid of the broad, high-cheeked stupidity so common in the northern races.",-0.25,0.062,0.094,0.844,negative,The silent places
At the moment she flashed like a brand with quick-breathed anger and fear.,-0.6597,0.136,0.375,0.489,negative,The silent places
"The child uttered a sharp cry of fright Dick looked at her at first with amazement, then with mingled admiration and mischief.",-0.5423,0.209,0.343,0.448,negative,The silent places
He uttered a ferocious growl and lowered his shoulders as though about to charge.,-0.2263,0.0,0.209,0.791,negative,The silent places
Immediately the defiance broke.,-0.4215,0.0,0.483,0.517,negative,The silent places
"The girl turned and fled, plunging like a rabbit into the first shelter that offered, pursued by shrieks of delight from the old squaws, a pleased roar from Dick, and the laughter of the Indian men themselves.",0.8481,0.273,0.072,0.655,positive,The silent places
"""May-may-gwán [2] ,"" said the oldest Indian, naming her, ""foster sister to the boy you had caught.""",0.0,0.0,0.0,1.0,neutral,The silent places
[2] The Butterfly.,0.0,0.0,0.0,1.0,neutral,The silent places
"""She is Ojibway, then,"" exclaimed Dick, catching at the Ojibway word.",-0.5106,0.0,0.248,0.752,negative,The silent places
"""Ae,"" admitted the Cree, indifferently.",0.1027,0.259,0.0,0.741,positive,The silent places
"Such inclusions of another tribe, either by adoption or marriage, are not uncommon.",0.0,0.0,0.0,1.0,neutral,The silent places
At this moment the third Indian approached.,0.0,0.0,0.0,1.0,neutral,The silent places
"""No moccasins,"" he reported.",-0.296,0.0,0.423,0.577,negative,The silent places
"""Plenty buckskin.""",0.0,0.0,0.0,1.0,neutral,The silent places
Sam Bolton looked troubled.,-0.4588,0.0,0.5,0.5,negative,The silent places
This meant a delay.,-0.3182,0.0,0.535,0.465,negative,The silent places
"However, it could not be avoided.",0.2584,0.289,0.0,0.711,positive,The silent places
"""Let the old women make some,"" he decided.",0.0,0.0,0.0,1.0,neutral,The silent places
The Cree old-man shook his head.,-0.1027,0.0,0.219,0.781,negative,The silent places
"""That cannot be.",0.0,0.0,0.0,1.0,neutral,The silent places
There is not time.,0.0,0.0,0.0,1.0,neutral,The silent places
"We turn our canoes to the Missináibie by next sun.""",0.0,0.0,0.0,1.0,neutral,The silent places
"Sam pondered again, turning over in his mind this fresh complication.",0.3869,0.208,0.0,0.792,positive,The silent places
"But Dick, kicking the earth clods in impatience, broke in.",-0.9161,0.0,0.629,0.371,negative,The silent places
"""Well, we're going by the Missináibie, too.",0.0,0.0,0.0,1.0,neutral,The silent places
Let the women make the moccasins.,0.0,0.0,0.0,1.0,neutral,The silent places
"We will accompany you.""",0.0,0.0,0.0,1.0,neutral,The silent places
"""That might be,"" replied the Indian.",0.0,0.0,0.0,1.0,neutral,The silent places
"""It is well,"" said Bolton.",0.0,0.0,0.0,1.0,neutral,The silent places
An old woman was summoned.,0.0,0.0,0.0,1.0,neutral,The silent places
She measured her customers' feet with a buckskin thong.,0.0,0.0,0.0,1.0,neutral,The silent places
Then they departed without further ceremony.,0.0,0.0,0.0,1.0,neutral,The silent places
An Indian rarely says farewell.,0.0,0.0,0.0,1.0,neutral,The silent places
When his business is finished he goes.,0.0,0.0,0.0,1.0,neutral,The silent places
"""Dick,"" said Sam, ""you ought not to have broke in there.""",0.3252,0.189,0.0,0.811,positive,The silent places
"""What do you mean?""",0.0,0.0,0.0,1.0,neutral,The silent places
"asked the other, puzzled.",-0.1779,0.0,0.362,0.638,negative,The silent places
"""Suggesting our travelling with them.""",0.0,0.0,0.0,1.0,neutral,The silent places
"""Why?""",0.0,0.0,0.0,1.0,neutral,The silent places
cried Dick in astonishment.,-0.7096,0.0,0.747,0.253,negative,The silent places
"""Ain't you never travelled with Injuns before?""",0.0,0.0,0.0,1.0,neutral,The silent places
"""That ain't th' question.",0.0,0.0,0.0,1.0,neutral,The silent places
Did you notice that third Injun?,0.0,0.0,0.0,1.0,neutral,The silent places
"the one who didn't do any talking?""",0.0,0.0,0.0,1.0,neutral,The silent places
"""Sure!",0.0,0.0,0.0,1.0,neutral,The silent places
"What of him?""",0.0,0.0,0.0,1.0,neutral,The silent places
"""Well, he's an Ojibway.",0.0,0.0,0.0,1.0,neutral,The silent places
Th' rest are Wood Crees.,0.0,0.0,0.0,1.0,neutral,The silent places
And I miss my guess if he ain't a bad customer.,0.3071,0.249,0.14,0.611,positive,The silent places
"He watched us mighty close, and his eyes are bad.",-0.5423,0.0,0.28,0.72,negative,The silent places
He's sharp.,0.0,0.0,0.0,1.0,neutral,The silent places
He's one of that wondering kind.,0.5267,0.405,0.0,0.595,positive,The silent places
"He's wondering now who we are, and where we're going, and why we're hitting so long a trail.",0.0,0.0,0.0,1.0,neutral,The silent places
"And what's more, he belongs to this Jingoss's people in a roundabout sort of way.",0.0,0.0,0.0,1.0,neutral,The silent places
He's worse than fifty Crees.,-0.4767,0.0,0.437,0.563,negative,The silent places
"Maybe he knows all about Jingoss, and if he does, he'll get suspicious the minute we angle down into that country.""",-0.3612,0.0,0.111,0.889,negative,The silent places
"""Let's let 'em slide, then,"" suggested Dick, impatiently.",-0.7184,0.0,0.5,0.5,negative,The silent places
"""Let's buy some buckskin and make our own moccasins.""",0.0,0.0,0.0,1.0,neutral,The silent places
"""Too late now,"" negatived Sam.",0.0,0.0,0.0,1.0,neutral,The silent places
"""To back out would be bad.""",0.0,0.0,0.0,1.0,neutral,The silent places
"""Oh, well, you're just borrowing trouble anyway,"" laughed Dick.",-0.2263,0.317,0.373,0.311,negative,The silent places
"""Maybe, maybe,"" acknowledged the other; ""but borrowing trouble, and then figuring out how you're going to meet it if it comes to you in good earnest, is mighty good woodcraft.""",0.8625,0.291,0.085,0.624,positive,The silent places
"""Sam,"" burst out Dick, whose attention had been caught by a word in his companion's first speech, and whose mind had been running on it throughout the ensuing discussion, ""did you notice that girl?",-0.5106,0.0,0.093,0.907,negative,The silent places
"She's a tearing little beauty!""",0.0,0.0,0.0,1.0,neutral,The silent places
CHAPTER FOUR By now it was nearly noon.,0.0,0.0,0.0,1.0,neutral,The silent places
The travellers carried the packs they had made up down to the water-side where the canoe lay.,0.0,0.0,0.0,1.0,neutral,The silent places
"Although the Indians would not get under way until the following morning, it had been decided to push on at once, thus avoiding the confusion of a crowded start.",-0.5574,0.0,0.15,0.85,negative,The silent places
In the course of the morning's business the news of their expedition had noised abroad.,0.0,0.0,0.0,1.0,neutral,The silent places
Especially were they commiserated by the other runners and post-keepers.,0.0,0.0,0.0,1.0,neutral,The silent places
"During all the winter these men had lived under the frown of the North, conducting their affairs confidently yet with caution, sure of themselves, yet never sure of the great power in whose tolerance they existed, in spite of whom they accomplished.",0.91,0.306,0.061,0.633,positive,The silent places
Now was the appointed time of rest.,0.0,0.0,0.0,1.0,neutral,The silent places
In the relaxation of the thought they found pity for those ordered out of season into the Silent Places.,0.296,0.15,0.097,0.752,positive,The silent places
"So at the river's bank Sam Bolton and Dick Herron, ready for departure, found a group gathered.",-0.2023,0.126,0.167,0.707,negative,The silent places
"It was supposed that these men were to act as scouts, to reconnoitre shrewdly in the Enemy's country, to spy out the land, so that in the autumn the Company might throw into the wilderness new posts, to be inhabited during the colder months.",0.0,0.0,0.0,1.0,neutral,The silent places
"""Look heem Bla'k Bevair Lak,"" advised Louis Placide; ""I t'ink dose Ojibway mak' heem lots marten, mink la bas.""",0.0,0.0,0.0,1.0,neutral,The silent places
"""Lads,"" said Kern, the trader at Old Brunswick House, ""if you're going up th' Missináibie just cast an eye on my cache at Gull Lake, and see that the carcajaus have let her be.""",0.0,0.0,0.0,1.0,neutral,The silent places
Young Herbert was curious.,0.3182,0.434,0.0,0.566,positive,The silent places
"""Where are you headed, boys?""",0.0,0.0,0.0,1.0,neutral,The silent places
he inquired.,0.0,0.0,0.0,1.0,neutral,The silent places
"But Ki-wa-nee, the trusty, the trader at Flying Post, the only Indian in the Company's service holding rank as a commissioned officer, grunted in contempt at the question, while Achard, of New Brunswick House, motioned warningly toward the groups of Indian trappers in the background.",-0.2263,0.083,0.101,0.816,negative,The silent places
"""Hush, boy,"" said he to Herbert, ""news travels, and in the south are the Free Traders to snatch at a new country.""",0.5106,0.142,0.0,0.858,positive,The silent places
"By now the voyageurs had turned their canoe over, slid it into the water, and piled the duffle amidships.",0.0,0.0,0.0,1.0,neutral,The silent places
"But before they had time to step aboard, came Virginia Albret, then seventeen years old and as slender and graceful as a fawn.",0.631,0.205,0.0,0.795,positive,The silent places
"The daughter of the Factor, she had acquired a habit of command that became her well.",0.2732,0.13,0.0,0.87,positive,The silent places
"While she enunciated her few and simple words of well-wishing, she looked straight out at them from deep black eyes.",0.2263,0.091,0.0,0.909,positive,The silent places
"The two woodsmen, awed into a vast respect, fumbled their caps in their hands and noted, in the unconscious manner of the forest frequenter, the fresh dusk rose of her skin, the sharply defined red of her lips, the soft wheat colour of her hair.",0.6597,0.114,0.0,0.886,positive,The silent places
"It was a gracious memory to carry into the Silent Places, and was in itself well worth the bestowal.",0.765,0.336,0.0,0.664,positive,The silent places
"However, Virginia, as was her habit, gave presents.",0.0,0.0,0.0,1.0,neutral,The silent places
On each she bestowed a long silk handkerchief.,0.0,0.0,0.0,1.0,neutral,The silent places
