sentence,compound,positive,negative,neutral,label,title
"Also he saw one dog, that would neither conciliate nor obey, finally killed in the struggle for mastery.",0.1406,0.159,0.179,0.663,positive,The call of the wild
"Now and again men came, strangers, who talked excitedly, wheedlingly, and in all kinds of fashions to the man in the red sweater.",0.5106,0.13,0.0,0.87,positive,The call of the wild
And at such times that money passed between them the strangers took one or more of the dogs away with them.,0.0,0.0,0.0,1.0,neutral,The call of the wild
"Buck wondered where they went, for they never came back; but the fear of the future was strong upon him, and he was glad each time when he was not selected.",0.631,0.207,0.106,0.687,positive,The call of the wild
"Yet his time came, in the end, in the form of a little weazened man who spat broken English and many strange and uncouth exclamations which Buck could not understand.",-0.5994,0.0,0.154,0.846,negative,The call of the wild
"""Sacredam!""",0.0,0.0,0.0,1.0,neutral,The call of the wild
"he cried, when his eyes lit upon Buck.",-0.3818,0.0,0.271,0.729,negative,The call of the wild
"""Dat one dam bully dog!",-0.5411,0.0,0.466,0.534,negative,The call of the wild
Eh?,0.0,0.0,0.0,1.0,neutral,The call of the wild
"How moch?""",0.0,0.0,0.0,1.0,neutral,The call of the wild
"""Three hundred, and a present at that,"" was the prompt reply of the man in the red sweater.",0.0,0.0,0.0,1.0,neutral,The call of the wild
"""And seem' it's government money, you ain't got no kick coming, eh, Perrault?""",0.2235,0.136,0.0,0.864,positive,The call of the wild
Perrault grinned.,0.2732,0.677,0.0,0.323,positive,The call of the wild
"Considering that the price of dogs had been boomed skyward by the unwonted demand, it was not an unfair sum for so fine an animal.",0.5299,0.173,0.053,0.774,positive,The call of the wild
"The Canadian Government would be no loser, nor would its despatches travel the slower.",-0.6808,0.0,0.318,0.682,negative,The call of the wild
"Perrault knew dogs, and when he looked at Buck he knew that he was one in a thousand--""One in ten t'ousand,"" he commented mentally.",0.0,0.0,0.0,1.0,neutral,The call of the wild
"Buck saw money pass between them, and was not surprised when Curly, a good-natured Newfoundland, and he were led away by the little weazened man.",-0.1695,0.0,0.068,0.932,negative,The call of the wild
"That was the last he saw of the man in the red sweater, and as Curly and he looked at receding Seattle from the deck of the Narwhal , it was the last he saw of the warm Southland.",0.2263,0.049,0.0,0.951,positive,The call of the wild
Curly and he were taken below by Perrault and turned over to a black-faced giant called François.,0.0,0.0,0.0,1.0,neutral,The call of the wild
"Perrault was a French-Canadian, and swarthy; but François was a French-Canadian half-breed, and twice as swarthy.",0.0,0.0,0.0,1.0,neutral,The call of the wild
"They were a new kind of men to Buck (of which he was destined to see many more), and while he developed no affection for them, he none the less grew honestly to respect them.",0.7918,0.223,0.053,0.724,positive,The call of the wild
"He speedily learned that Perrault and François were fair men, calm and impartial in administering justice, and too wise in the way of dogs to be fooled by dogs.",0.8176,0.294,0.069,0.637,positive,The call of the wild
"In the 'tween-decks of the Narwhal , Buck and Curly joined two other dogs.",0.0,0.0,0.0,1.0,neutral,The call of the wild
"One of them was a big, snow-white fellow from Spitzbergen who had been brought away by a whaling captain, and who had later accompanied a Geological Survey into the Barrens.",0.0,0.0,0.0,1.0,neutral,The call of the wild
"He was friendly, in a treacherous sort of way, smiling into one's face the while he meditated some underhand trick, as, for instance, when he stole from Buck's food at the first meal.",0.6915,0.164,0.033,0.803,positive,The call of the wild
"As Buck sprang to punish him, the lash of François's whip sang through the air, reaching the culprit first; and nothing remained to Buck but to recover the bone.",-0.2023,0.046,0.072,0.882,negative,The call of the wild
"That was fair of François, he decided, and the half-breed began his rise in Buck's estimation.",0.3182,0.133,0.0,0.867,positive,The call of the wild
"The other dog made no advances, nor received any; also, he did not attempt to steal from the newcomers.",0.1098,0.12,0.101,0.779,positive,The call of the wild
"He was a gloomy, morose fellow, and he showed Curly plainly that all he desired was to be left alone, and further, that there would be trouble if he were not left alone.",-0.6369,0.056,0.222,0.722,negative,The call of the wild
"""Dave"" he was called, and he ate and slept, or yawned between times, and took interest in nothing, not even when the Narwhal crossed Queen Charlotte Sound and rolled and pitched and bucked like a thing possessed.",0.6705,0.139,0.0,0.861,positive,The call of the wild
"When Buck and Curly grew excited, half wild with fear, he raised his head as though annoyed, favored them with an incurious glance, yawned, and went to sleep again.",-0.1531,0.144,0.161,0.694,negative,The call of the wild
"Day and night the ship throbbed to the tireless pulse of the propeller, and though one day was very like another, it was apparent to Buck that the weather was steadily growing colder.",0.5413,0.127,0.0,0.873,positive,The call of the wild
"At last, one morning, the propeller was quiet, and the Narwhal was pervaded with an atmosphere of excitement.",0.4939,0.158,0.0,0.842,positive,The call of the wild
"He felt it, as did the other dogs, and knew that a change was at hand.",0.4939,0.186,0.0,0.814,positive,The call of the wild
François leashed them and brought them on deck.,0.0,0.0,0.0,1.0,neutral,The call of the wild
"At the first step upon the cold surface, Buck's feet sank into a white mushy something very like mud.",0.4201,0.141,0.0,0.859,positive,The call of the wild
He sprang back with a snort.,0.0,0.0,0.0,1.0,neutral,The call of the wild
More of this white stuff was falling through the air.,-0.1531,0.0,0.151,0.849,negative,The call of the wild
"He shook himself, but more of it fell upon him.",-0.0516,0.0,0.118,0.882,negative,The call of the wild
"He sniffed it curiously, then licked some up on his tongue.",0.0,0.0,0.0,1.0,neutral,The call of the wild
"It bit like fire, and the next instant was gone.",0.0258,0.194,0.186,0.62,neutral,The call of the wild
This puzzled him.,-0.1779,0.0,0.459,0.541,negative,The call of the wild
"He tried it again, with the same result.",0.0,0.0,0.0,1.0,neutral,The call of the wild
"The onlookers laughed uproariously, and he felt ashamed, he knew not why, for it was his first snow.",-0.0258,0.136,0.14,0.724,neutral,The call of the wild
Chapter II.,0.0,0.0,0.0,1.0,neutral,The call of the wild
The Law of Club and Fang Buck's first day on the Dyea beach was like a nightmare.,0.3612,0.143,0.0,0.857,positive,The call of the wild
Every hour was filled with shock and surprise.,-0.128,0.196,0.243,0.561,negative,The call of the wild
He had been suddenly jerked from the heart of civilization and flung into the heart of things primordial.,-0.2023,0.0,0.096,0.904,negative,The call of the wild
"No lazy, sun-kissed life was this, with nothing to do but loaf and be bored.",-0.6124,0.0,0.333,0.667,negative,The call of the wild
"Here was neither peace, nor rest, nor a moment's safety.",-0.6348,0.0,0.425,0.575,negative,The call of the wild
"All was confusion and action, and every moment life and limb were in peril.",-0.5994,0.0,0.29,0.71,negative,The call of the wild
There was imperative need to be constantly alert; for these dogs and men were not town dogs and men.,0.296,0.109,0.0,0.891,positive,The call of the wild
"They were savages, all of them, who knew no law but the law of club and fang.",-0.4215,0.0,0.202,0.798,negative,The call of the wild
"He had never seen dogs fight as these wolfish creatures fought, and his first experience taught him an unforgetable lesson.",-0.0299,0.097,0.102,0.801,neutral,The call of the wild
"It is true, it was a vicarious experience, else he would not have lived to profit by it.",0.6908,0.275,0.0,0.725,positive,The call of the wild
Curly was the victim.,-0.2732,0.0,0.412,0.588,negative,The call of the wild
"They were camped near the log store, where she, in her friendly way, made advances to a husky dog the size of a full-grown wolf, though not half so large as she.",0.4939,0.099,0.0,0.901,positive,The call of the wild
"There was no warning, only a leap in like a flash, a metallic clip of teeth, a leap out equally swift, and Curly's face was ripped open from eye to jaw.",-0.0772,0.135,0.144,0.721,negative,The call of the wild
"It was the wolf manner of fighting, to strike and leap away; but there was more to it than this.",-0.25,0.0,0.143,0.857,negative,The call of the wild
Thirty or forty huskies ran to the spot and surrounded the combatants in an intent and silent circle.,0.0,0.0,0.0,1.0,neutral,The call of the wild
"Buck did not comprehend that silent intentness, nor the eager way with which they were licking their chops.",-0.2755,0.0,0.11,0.89,negative,The call of the wild
"Curly rushed her antagonist, who struck again and leaped aside.",-0.5994,0.0,0.38,0.62,negative,The call of the wild
"He met her next rush with his chest, in a peculiar fashion that tumbled her off her feet.",0.1531,0.091,0.0,0.909,positive,The call of the wild
She never regained them.,0.0,0.0,0.0,1.0,neutral,The call of the wild
This was what the onlooking huskies had waited for.,0.0,0.0,0.0,1.0,neutral,The call of the wild
"They closed in upon her, snarling and yelping, and she was buried, screaming with agony, beneath the bristling mass of bodies.",-0.6597,0.0,0.221,0.779,negative,The call of the wild
"So sudden was it, and so unexpected, that Buck was taken aback.",0.0,0.0,0.0,1.0,neutral,The call of the wild
"He saw Spitz run out his scarlet tongue in a way he had of laughing; and he saw François, swinging an axe, spring into the mess of dogs.",0.0772,0.103,0.125,0.772,positive,The call of the wild
Three men with clubs were helping him to scatter them.,0.296,0.196,0.0,0.804,positive,The call of the wild
It did not take long.,0.0,0.0,0.0,1.0,neutral,The call of the wild
"Two minutes from the time Curly went down, the last of her assailants were clubbed off.",0.0,0.0,0.0,1.0,neutral,The call of the wild
"But she lay there limp and lifeless in the bloody, trampled snow, almost literally torn to pieces, the swart half-breed standing over her and cursing horribly.",-0.8893,0.0,0.314,0.686,negative,The call of the wild
The scene often came back to Buck to trouble him in his sleep.,-0.4019,0.0,0.184,0.816,negative,The call of the wild
So that was the way.,0.0,0.0,0.0,1.0,neutral,The call of the wild
No fair play.,0.3612,0.681,0.319,0.0,positive,The call of the wild
"Once down, that was the end of you.",0.0,0.0,0.0,1.0,neutral,The call of the wild
"Well, he would see to it that he never went down.",0.2732,0.174,0.0,0.826,positive,The call of the wild
"Spitz ran out his tongue and laughed again, and from that moment Buck hated him with a bitter and deathless hatred.",-0.8481,0.099,0.371,0.53,negative,The call of the wild
"Before he had recovered from the shock caused by the tragic passing of Curly, he received another shock.",-0.802,0.0,0.353,0.647,negative,The call of the wild
François fastened upon him an arrangement of straps and buckles.,0.0,0.0,0.0,1.0,neutral,The call of the wild
"It was a harness, such as he had seen the grooms put on the horses at home.",0.0,0.0,0.0,1.0,neutral,The call of the wild
"And as he had seen horses work, so he was set to work, hauling François on a sled to the forest that fringed the valley, and returning with a load of firewood.",0.0,0.0,0.0,1.0,neutral,The call of the wild
"Though his dignity was sorely hurt by thus being made a draught animal, he was too wise to rebel.",0.2023,0.234,0.202,0.565,positive,The call of the wild
"He buckled down with a will and did his best, though it was all new and strange.",0.5267,0.21,0.09,0.7,positive,The call of the wild
"François was stern, demanding instant obedience, and by virtue of his whip receiving instant obedience; while Dave, who was an experienced wheeler, nipped Buck's hind quarters whenever he was in error.",-0.2023,0.079,0.13,0.791,negative,The call of the wild
"Spitz was the leader, likewise experienced, and while he could not always get at Buck, he growled sharp reproof now and again, or cunningly threw his weight in the traces to jerk Buck into the way he should go.",-0.34,0.0,0.059,0.941,negative,The call of the wild
"Buck learned easily, and under the combined tuition of his two mates and François made remarkable progress.",0.8316,0.386,0.0,0.614,positive,The call of the wild
"Ere they returned to camp he knew enough to stop at ""ho,"" to go ahead at ""mush,"" to swing wide on the bends, and to keep clear of the wheeler when the loaded sled shot downhill at their heels.",0.1027,0.062,0.053,0.885,positive,The call of the wild
"""T'ree vair' good dogs,"" François told Perrault.",0.4404,0.326,0.0,0.674,positive,The call of the wild
"""Dat Buck, heem pool lak hell.",-0.6808,0.0,0.479,0.521,negative,The call of the wild
"I tich heem queek as anyt'ing.""",0.0,0.0,0.0,1.0,neutral,The call of the wild
"By afternoon, Perrault, who was in a hurry to be on the trail with his despatches, returned with two more dogs.",0.0,0.0,0.0,1.0,neutral,The call of the wild
"""Billee"" and ""Joe"" he called them, two brothers, and true huskies both.",0.4215,0.203,0.0,0.797,positive,The call of the wild
"Sons of the one mother though they were, they were as different as day and night.",0.0,0.0,0.0,1.0,neutral,The call of the wild
"Billee's one fault was his excessive good nature, while Joe was the very opposite, sour and introspective, with a perpetual snarl and a malignant eye.",0.0516,0.109,0.102,0.789,positive,The call of the wild
"Buck received them in comradely fashion, Dave ignored them, while Spitz proceeded to thrash first one and then the other.",-0.3182,0.0,0.108,0.892,negative,The call of the wild
"Billee wagged his tail appeasingly, turned to run when he saw that appeasement was of no avail, and cried (still appeasingly) when Spitz's sharp teeth scored his flank.",-0.5859,0.0,0.156,0.844,negative,The call of the wild
"But no matter how Spitz circled, Joe whirled around on his heels to face him, mane bristling, ears laid back, lips writhing and snarling, jaws clipping together as fast as he could snap, and eyes diabolically gleaming--the incarnation of belligerent fear.",-0.7876,0.025,0.154,0.822,negative,The call of the wild
So terrible was his appearance that Spitz was forced to forego disciplining him; but to cover his own discomfiture he turned upon the inoffensive and wailing Billee and drove him to the confines of the camp.,-0.4933,0.0,0.11,0.89,negative,The call of the wild
"By evening Perrault secured another dog, an old husky, long and lean and gaunt, with a battle-scarred face and a single eye which flashed a warning of prowess that commanded respect.",0.5267,0.175,0.072,0.753,positive,The call of the wild
"He was called Sol-leks, which means the Angry One.",-0.5106,0.0,0.292,0.708,negative,The call of the wild
"Like Dave, he asked nothing, gave nothing, expected nothing; and when he marched slowly and deliberately into their midst, even Spitz left him alone.",0.128,0.094,0.075,0.83,positive,The call of the wild
He had one peculiarity which Buck was unlucky enough to discover.,0.1531,0.138,0.0,0.862,positive,The call of the wild
He did not like to be approached on his blind side.,-0.5873,0.0,0.348,0.652,negative,The call of the wild
"Of this offence Buck was unwittingly guilty, and the first knowledge he had of his indiscretion was when Sol-leks whirled upon him and slashed his shoulder to the bone for three inches up and down.",-0.7096,0.0,0.177,0.823,negative,The call of the wild
"Forever after Buck avoided his blind side, and to the last of their comradeship had no more trouble.",-0.8516,0.0,0.424,0.576,negative,The call of the wild
"His only apparent ambition, like Dave's, was to be left alone; though, as Buck was afterward to learn, each of them possessed one other and even more vital ambition.",0.4576,0.151,0.061,0.788,positive,The call of the wild
That night Buck faced the great problem of sleeping.,0.34,0.297,0.196,0.507,positive,The call of the wild
"The tent, illumined by a candle, glowed warmly in the midst of the white plain; and when he, as a matter of course, entered it, both Perrault and François bombarded him with curses and cooking utensils, till he recovered from his consternation and fled ignominiously into the outer cold.",0.4215,0.078,0.0,0.922,positive,The call of the wild
A chill wind was blowing that nipped him sharply and bit with especial venom into his wounded shoulder.,0.0,0.0,0.0,1.0,neutral,The call of the wild
"He lay down on the snow and attempted to sleep, but the frost soon drove him shivering to his feet.",0.0,0.0,0.0,1.0,neutral,The call of the wild
"Miserable and disconsolate, he wandered about among the many tents, only to find that one place was as cold as another.",-0.7579,0.0,0.255,0.745,negative,The call of the wild
"Here and there savage dogs rushed upon him, but he bristled his neck-hair and snarled (for he was learning fast), and they let him go his way unmolested.",-0.25,0.0,0.069,0.931,negative,The call of the wild
Finally an idea came to him.,0.0,0.0,0.0,1.0,neutral,The call of the wild
He would return and see how his own team-mates were making out.,0.0,0.0,0.0,1.0,neutral,The call of the wild
"To his astonishment, they had disappeared.",-0.2263,0.0,0.275,0.725,negative,The call of the wild
"Again he wandered about through the great camp, looking for them, and again he returned.",0.6249,0.227,0.0,0.773,positive,The call of the wild
Were they in the tent?,0.0,0.0,0.0,1.0,neutral,The call of the wild
"No, that could not be, else he would not have been driven out.",-0.296,0.0,0.155,0.845,negative,The call of the wild
Then where could they possibly be?,0.0,0.0,0.0,1.0,neutral,The call of the wild
"With drooping tail and shivering body, very forlorn indeed, he aimlessly circled the tent.",0.0,0.0,0.0,1.0,neutral,The call of the wild
Suddenly the snow gave way beneath his fore legs and he sank down.,0.0,0.0,0.0,1.0,neutral,The call of the wild
Something wriggled under his feet.,0.0,0.0,0.0,1.0,neutral,The call of the wild
"He sprang back, bristling and snarling, fearful of the unseen and unknown.",-0.4939,0.0,0.225,0.775,negative,The call of the wild
"But a friendly little yelp reassured him, and he went back to investigate.",0.8143,0.426,0.0,0.574,positive,The call of the wild
"A whiff of warm air ascended to his nostrils, and there, curled up under the snow in a snug ball, lay Billee.",0.2263,0.091,0.0,0.909,positive,The call of the wild
"He whined placatingly, squirmed and wriggled to show his good will and intentions, and even ventured, as a bribe for peace, to lick Buck's face with his warm wet tongue.",0.6808,0.231,0.103,0.667,positive,The call of the wild
Another lesson.,0.0,0.0,0.0,1.0,neutral,The call of the wild
"So that was the way they did it, eh?",0.0,0.0,0.0,1.0,neutral,The call of the wild
"Buck confidently selected a spot, and with much fuss and waste effort proceeded to dig a hole for himself.",0.0772,0.148,0.134,0.718,positive,The call of the wild
In a trice the heat from his body filled the confined space and he was asleep.,0.0,0.0,0.0,1.0,neutral,The call of the wild
"The day had been long and arduous, and he slept soundly and comfortably, though he growled and barked and wrestled with bad dreams.",0.25,0.19,0.121,0.69,positive,The call of the wild
Nor did he open his eyes till roused by the noises of the waking camp.,0.0,0.0,0.0,1.0,neutral,The call of the wild
At first he did not know where he was.,0.0,0.0,0.0,1.0,neutral,The call of the wild
It had snowed during the night and he was completely buried.,0.0,0.0,0.0,1.0,neutral,The call of the wild
"The snow walls pressed him on every side, and a great surge of fear swept through him--the fear of the wild thing for the trap.",-0.5574,0.125,0.265,0.61,negative,The call of the wild
"It was a token that he was harking back through his own life to the lives of his forebears; for he was a civilized dog, an unduly civilized dog, and of his own experience knew no trap and so could not of himself fear it.",-0.2197,0.056,0.095,0.849,negative,The call of the wild
"The muscles of his whole body contracted spasmodically and instinctively, the hair on his neck and shoulders stood on end, and with a ferocious snarl he bounded straight up into the blinding day, the snow flying about him in a flashing cloud.",0.128,0.046,0.034,0.92,positive,The call of the wild
"Ere he landed on his feet, he saw the white camp spread out before him and knew where he was and remembered all that had passed from the time he went for a stroll with Manuel to the hole he had dug for himself the night before.",0.0,0.0,0.0,1.0,neutral,The call of the wild
A shout from François hailed his appearance.,0.2263,0.275,0.0,0.725,positive,The call of the wild
"""Wot I say?""",0.0,0.0,0.0,1.0,neutral,The call of the wild
the dog-driver cried to Perrault.,-0.3818,0.0,0.394,0.606,negative,The call of the wild
"""Dat Buck for sure learn queek as anyt'ing.""",0.3182,0.247,0.0,0.753,positive,The call of the wild
Perrault nodded gravely.,-0.3612,0.0,0.556,0.444,negative,The call of the wild
"As courier for the Canadian Government, bearing important despatches, he was anxious to secure the best dogs, and he was particularly gladdened by the possession of Buck.",0.7506,0.251,0.06,0.689,positive,The call of the wild
"Three more huskies were added to the team inside an hour, making a total of nine, and before another quarter of an hour had passed they were in harness and swinging up the trail toward the Dyea Cañon.",0.0,0.0,0.0,1.0,neutral,The call of the wild
"Buck was glad to be gone, and though the work was hard he found he did not particularly despise it.",0.5931,0.222,0.059,0.719,positive,The call of the wild
He was surprised at the eagerness which animated the whole team and which was communicated to him; but still more surprising was the change wrought in Dave and Sol-leks.,0.6586,0.197,0.0,0.803,positive,The call of the wild
"They were new dogs, utterly transformed by the harness.",0.0,0.0,0.0,1.0,neutral,The call of the wild
All passiveness and unconcern had dropped from them.,0.0,0.0,0.0,1.0,neutral,The call of the wild
"They were alert and active, anxious that the work should go well, and fiercely irritable with whatever, by delay or confusion, retarded that work.",-0.743,0.193,0.366,0.441,negative,The call of the wild
"The toil of the traces seemed the supreme expression of their being, and all that they lived for and the only thing in which they took delight.",0.8176,0.231,0.0,0.769,positive,The call of the wild
"Dave was wheeler or sled dog, pulling in front of him was Buck, then came Sol-leks; the rest of the team was strung out ahead, single file, to the leader, which position was filled by Spitz.",0.0,0.0,0.0,1.0,neutral,The call of the wild
Buck had been purposely placed between Dave and Sol-leks so that he might receive instruction.,0.0,0.0,0.0,1.0,neutral,The call of the wild
"Apt scholar that he was, they were equally apt teachers, never allowing him to linger long in error, and enforcing their teaching with their sharp teeth.",-0.4019,0.0,0.097,0.903,negative,The call of the wild
Dave was fair and very wise.,0.6901,0.587,0.0,0.413,positive,The call of the wild
"He never nipped Buck without cause, and he never failed to nip him when he stood in need of it.",0.4023,0.125,0.0,0.875,positive,The call of the wild
"As François's whip backed him up, Buck found it to be cheaper to mend his ways than to retaliate.",0.0258,0.058,0.0,0.942,neutral,The call of the wild
"Once, during a brief halt, when he got tangled in the traces and delayed the start, both Dave and Sol-leks flew at him and administered a sound trouncing.",-0.2263,0.0,0.071,0.929,negative,The call of the wild
"The resulting tangle was even worse, but Buck took good care to keep the traces clear thereafter; and ere the day was done, so well had he mastered his work, his mates about ceased nagging him.",0.8901,0.299,0.11,0.591,positive,The call of the wild
"François's whip snapped less frequently, and Perrault even honored Buck by lifting up his feet and carefully examining them.",0.6486,0.238,0.0,0.762,positive,The call of the wild
"It was a hard day's run, up the Cañon, through Sheep Camp, past the Scales and the timber line, across glaciers and snowdrifts hundreds of feet deep, and over the great Chilcoot Divide, which stands between the salt water and the fresh and guards forbiddingly the sad and lonely North.",-0.3612,0.108,0.167,0.725,negative,The call of the wild
"They made good time down the chain of lakes which fills the craters of extinct volcanoes, and late that night pulled into the huge camp at the head of Lake Bennett, where thousands of goldseekers were building boats against the break-up of the ice in the spring.",0.6369,0.104,0.0,0.896,positive,The call of the wild
"Buck made his hole in the snow and slept the sleep of the exhausted just, but all too early was routed out in the cold darkness and harnessed with his mates to the sled.",-0.5023,0.0,0.117,0.883,negative,The call of the wild
"That day they made forty miles, the trail being packed; but the next day, and for many days to follow, they broke their own trail, worked harder, and made poorer time.",-0.7876,0.0,0.193,0.807,negative,The call of the wild
