sentence,compound,positive,negative,neutral,label,title
"Whereupon he turned and left the captain with the same indifferent ease that was habitual with him, and which was more surely calculated to raise the ire of a man of Billings' class than a torrent of invective.",0.5984,0.141,0.044,0.815,positive,Tarzan of the Apes
"So, whereas the captain might easily have been brought to regret his hasty speech had Clayton attempted to conciliate him, his temper was now irrevocably set in the mold in which Clayton had left it, and the last chance of their working together for their common good was gone.",0.4019,0.161,0.097,0.743,positive,Tarzan of the Apes
"""Well, Alice,"" said Clayton, as he rejoined his wife, ""I might have saved my breath.",0.4215,0.167,0.0,0.833,positive,Tarzan of the Apes
The fellow proved most ungrateful.,-0.5095,0.0,0.452,0.548,negative,Tarzan of the Apes
Fairly jumped at me like a mad dog.,-0.1779,0.234,0.299,0.467,negative,Tarzan of the Apes
"""He and his blasted old ship may hang, for aught I care; and until we are safely off the thing I shall spend my energies in looking after our own welfare.",0.8074,0.242,0.0,0.758,positive,Tarzan of the Apes
And I rather fancy the first step to that end should be to go to our cabin and look over my revolvers.,0.0,0.0,0.0,1.0,neutral,Tarzan of the Apes
"I am sorry now that we packed the larger guns and the ammunition with the stuff below.""",-0.0772,0.0,0.08,0.92,negative,Tarzan of the Apes
They found their quarters in a bad state of disorder.,-0.7351,0.0,0.47,0.53,negative,Tarzan of the Apes
"Clothing from their open boxes and bags strewed the little apartment, and even their beds had been torn to pieces.",-0.25,0.0,0.095,0.905,negative,Tarzan of the Apes
"""Evidently someone was more anxious about our belongings than we,"" said Clayton.",-0.3167,0.0,0.172,0.828,negative,Tarzan of the Apes
"""Let's have a look around, Alice, and see what's missing.""",0.0,0.0,0.0,1.0,neutral,Tarzan of the Apes
A thorough search revealed the fact that nothing had been taken but Clayton's two revolvers and the small supply of ammunition he had saved out for them.,0.5719,0.129,0.0,0.871,positive,Tarzan of the Apes
"""Those are the very things I most wish they had left us,"" said Clayton, ""and the fact that they wished for them and them alone is most sinister.""",0.3086,0.108,0.066,0.826,positive,Tarzan of the Apes
"""What are we to do, John?""",0.0,0.0,0.0,1.0,neutral,Tarzan of the Apes
asked his wife.,0.0,0.0,0.0,1.0,neutral,Tarzan of the Apes
"""Perhaps you were right in that our best chance lies in maintaining a neutral position.",0.5267,0.31,0.14,0.55,positive,Tarzan of the Apes
"""If the officers are able to prevent a mutiny, we have nothing to fear, while if the mutineers are victorious our one slim hope lies in not having attempted to thwart or antagonize them.""",-0.0444,0.164,0.143,0.693,neutral,Tarzan of the Apes
"""Right you are, Alice.",0.0,0.0,0.0,1.0,neutral,Tarzan of the Apes
"We'll keep in the middle of the road.""",0.0,0.0,0.0,1.0,neutral,Tarzan of the Apes
"As they started to straighten up their cabin, Clayton and his wife simultaneously noticed the corner of a piece of paper protruding from beneath the door of their quarters.",0.0,0.0,0.0,1.0,neutral,Tarzan of the Apes
"As Clayton stooped to reach for it he was amazed to see it move further into the room, and then he realized that it was being pushed inward by someone from without.",0.5106,0.125,0.0,0.875,positive,Tarzan of the Apes
"Quickly and silently he stepped toward the door, but, as he reached for the knob to throw it open, his wife's hand fell upon his wrist.",0.7096,0.197,0.0,0.803,positive,Tarzan of the Apes
"""No, John,"" she whispered.",0.0,0.0,0.0,1.0,neutral,Tarzan of the Apes
"""They do not wish to be seen, and so we cannot afford to see them.",-0.3089,0.0,0.139,0.861,negative,Tarzan of the Apes
"Do not forget that we are keeping to the middle of the road.""",0.1695,0.122,0.0,0.878,positive,Tarzan of the Apes
Clayton smiled and dropped his hand to his side.,0.7717,0.489,0.0,0.511,positive,Tarzan of the Apes
Thus they stood watching the little bit of white paper until it finally remained at rest upon the floor just inside the door.,0.0,0.0,0.0,1.0,neutral,Tarzan of the Apes
Then Clayton stooped and picked it up.,0.0,0.0,0.0,1.0,neutral,Tarzan of the Apes
"It was a bit of grimy, white paper roughly folded into a ragged square.",-0.4215,0.0,0.203,0.797,negative,Tarzan of the Apes
"Opening it they found a crude message printed almost illegibly, and with many evidences of an unaccustomed task.",-0.5719,0.0,0.188,0.812,negative,Tarzan of the Apes
"Translated, it was a warning to the Claytons to refrain from reporting the loss of the revolvers, or from repeating what the old sailor had told them--to refrain on pain of death.",-0.8979,0.0,0.306,0.694,negative,Tarzan of the Apes
"""I rather imagine we'll be good,"" said Clayton with a rueful smile.",0.3612,0.2,0.0,0.8,positive,Tarzan of the Apes
"""About all we can do is to sit tight and wait for whatever may come.""",0.0,0.0,0.0,1.0,neutral,Tarzan of the Apes
CHAPTER II.,0.0,0.0,0.0,1.0,neutral,Tarzan of the Apes
"The Savage Home Nor did they have long to wait, for the next morning as Clayton was emerging on deck for his accustomed walk before breakfast, a shot rang out, and then another, and another.",-0.4588,0.0,0.083,0.917,negative,Tarzan of the Apes
The sight which met his eyes confirmed his worst fears.,-0.7845,0.0,0.463,0.537,negative,Tarzan of the Apes
"Facing the little knot of officers was the entire motley crew of the Fuwalda , and at their head stood Black Michael.",0.0,0.0,0.0,1.0,neutral,Tarzan of the Apes
"At the first volley from the officers the men ran for shelter, and from points of vantage behind masts, wheel-house and cabin they returned the fire of the five men who represented the hated authority of the ship.",-0.743,0.03,0.154,0.816,negative,Tarzan of the Apes
Two of their number had gone down before the captain's revolver.,0.0772,0.115,0.0,0.885,positive,Tarzan of the Apes
They lay where they had fallen between the combatants.,-0.3612,0.0,0.238,0.762,negative,Tarzan of the Apes
"But then the first mate lunged forward upon his face, and at a cry of command from Black Michael the mutineers charged the remaining four.",-0.7469,0.0,0.224,0.776,negative,Tarzan of the Apes
"The crew had been able to muster but six firearms, so most of them were armed with boat hooks, axes, hatchets and crowbars.",0.0,0.0,0.0,1.0,neutral,Tarzan of the Apes
The captain had emptied his revolver and was reloading as the charge was made.,-0.1779,0.0,0.116,0.884,negative,Tarzan of the Apes
"The second mate's gun had jammed, and so there were but two weapons opposed to the mutineers as they bore down upon the officers, who now started to give back before the infuriated rush of their men.",-0.9267,0.0,0.291,0.709,negative,Tarzan of the Apes
"Both sides were cursing and swearing in a frightful manner, which, together with the reports of the firearms and the screams and groans of the wounded, turned the deck of the Fuwalda to the likeness of a madhouse.",-0.7579,0.0,0.185,0.815,negative,Tarzan of the Apes
Before the officers had taken a dozen backward steps the men were upon them.,0.0,0.0,0.0,1.0,neutral,Tarzan of the Apes
"An ax in the hands of a burly Negro cleft the captain from forehead to chin, and an instant later the others were down: dead or wounded from dozens of blows and bullet wounds.",-0.6486,0.0,0.118,0.882,negative,Tarzan of the Apes
"Short and grisly had been the work of the mutineers of the Fuwalda , and through it all John Clayton had stood leaning carelessly beside the companionway puffing meditatively upon his pipe as though he had been but watching an indifferent cricket match.",-0.4019,0.0,0.085,0.915,negative,Tarzan of the Apes
As the last officer went down he thought it was time that he returned to his wife lest some members of the crew find her alone below.,-0.25,0.0,0.071,0.929,negative,Tarzan of the Apes
"Though outwardly calm and indifferent, Clayton was inwardly apprehensive and wrought up, for he feared for his wife's safety at the hands of these ignorant, half-brutes into whose hands fate had so remorselessly thrown them.",-0.7065,0.113,0.243,0.643,negative,Tarzan of the Apes
As he turned to descend the ladder he was surprised to see his wife standing on the steps almost at his side.,0.2263,0.083,0.0,0.917,positive,Tarzan of the Apes
"""How long have you been here, Alice?""",0.0,0.0,0.0,1.0,neutral,Tarzan of the Apes
"""Since the beginning,"" she replied.",0.0,0.0,0.0,1.0,neutral,Tarzan of the Apes
"""How awful, John.",-0.4588,0.0,0.6,0.4,negative,Tarzan of the Apes
"Oh, how awful!",-0.5093,0.0,0.622,0.378,negative,Tarzan of the Apes
"What can we hope for at the hands of such as those?""",0.4404,0.209,0.0,0.791,positive,Tarzan of the Apes
"""Breakfast, I hope,"" he answered, smiling bravely in an attempt to allay her fears.",0.5423,0.33,0.147,0.524,positive,Tarzan of the Apes
"""At least,"" he added, ""I'm going to ask them.",0.0,0.0,0.0,1.0,neutral,Tarzan of the Apes
"Come with me, Alice.",0.0,0.0,0.0,1.0,neutral,Tarzan of the Apes
"We must not let them think we expect any but courteous treatment.""",0.6652,0.288,0.0,0.712,positive,Tarzan of the Apes
"The men had by this time surrounded the dead and wounded officers, and without either partiality or compassion proceeded to throw both living and dead over the sides of the vessel.",-0.765,0.076,0.217,0.707,negative,Tarzan of the Apes
With equal heartlessness they disposed of their own dead and dying.,-0.8442,0.0,0.474,0.526,negative,Tarzan of the Apes
"Presently one of the crew spied the approaching Claytons, and with a cry of: ""Here's two more for the fishes,"" rushed toward them with uplifted ax.",-0.4767,0.0,0.114,0.886,negative,Tarzan of the Apes
"But Black Michael was even quicker, so that the fellow went down with a bullet in his back before he had taken a half dozen steps.",0.0,0.0,0.0,1.0,neutral,Tarzan of the Apes
"With a loud roar, Black Michael attracted the attention of the others, and, pointing to Lord and Lady Greystoke, cried: ""These here are my friends, and they are to be left alone.",0.3182,0.157,0.123,0.72,positive,Tarzan of the Apes
D'ye understand?,0.0,0.0,0.0,1.0,neutral,Tarzan of the Apes
"""I'm captain of this ship now, an' what I says goes,"" he added, turning to Clayton.",0.0,0.0,0.0,1.0,neutral,Tarzan of the Apes
"""Just keep to yourselves, and nobody'll harm ye,"" and he looked threateningly on his fellows.",-0.7717,0.0,0.34,0.66,negative,Tarzan of the Apes
The Claytons heeded Black Michael's instructions so well that they saw but little of the crew and knew nothing of the plans the men were making.,0.2193,0.07,0.0,0.93,positive,Tarzan of the Apes
"Occasionally they heard faint echoes of brawls and quarreling among the mutineers, and on two occasions the vicious bark of firearms rang out on the still air.",-0.3612,0.0,0.088,0.912,negative,Tarzan of the Apes
"But Black Michael was a fit leader for this band of cutthroats, and, withal held them in fair subjection to his rule.",0.7351,0.246,0.0,0.754,positive,Tarzan of the Apes
"On the fifth day following the murder of the ship's officers, land was sighted by the lookout.",-0.6908,0.0,0.227,0.773,negative,Tarzan of the Apes
"Whether island or mainland, Black Michael did not know, but he announced to Clayton that if investigation showed that the place was habitable he and Lady Greystoke were to be put ashore with their belongings.",0.0,0.0,0.0,1.0,neutral,Tarzan of the Apes
"""You'll be all right there for a few months,"" he explained, ""and by that time we'll have been able to make an inhabited coast somewhere and scatter a bit.",0.0,0.0,0.0,1.0,neutral,Tarzan of the Apes
Then I'll see that yer gover'ment's notified where you be an' they'll soon send a man-o'war to fetch ye off.,0.0,0.0,0.0,1.0,neutral,Tarzan of the Apes
"""It would be a hard matter to land you in civilization without a lot o' questions being asked, an' none o' us here has any very convincin' answers up our sleeves.""",-0.0772,0.037,0.047,0.915,negative,Tarzan of the Apes
"Clayton remonstrated against the inhumanity of landing them upon an unknown shore to be left to the mercies of savage beasts, and, possibly, still more savage men.",-0.7184,0.0,0.194,0.806,negative,Tarzan of the Apes
"But his words were of no avail, and only tended to anger Black Michael, so he was forced to desist and make the best he could of a bad situation.",-0.9041,0.124,0.363,0.513,negative,Tarzan of the Apes
About three o'clock in the afternoon they came about off a beautiful wooded shore opposite the mouth of what appeared to be a land-locked harbor.,0.5994,0.151,0.0,0.849,positive,Tarzan of the Apes
Black Michael sent a small boat filled with men to sound the entrance in an effort to determine if the Fuwalda could be safely worked through the entrance.,0.4939,0.11,0.0,0.89,positive,Tarzan of the Apes
In about an hour they returned and reported deep water through the passage as well as far into the little basin.,0.2732,0.095,0.0,0.905,positive,Tarzan of the Apes
"Before dark the barkentine lay peacefully at anchor upon the bosom of the still, mirror-like surface of the harbor.",0.5267,0.159,0.0,0.841,positive,Tarzan of the Apes
"The surrounding shores were beautiful with semitropical verdure, while in the distance the country rose from the ocean in hill and tableland, almost uniformly clothed by primeval forest.",0.5994,0.126,0.0,0.874,positive,Tarzan of the Apes
"No signs of habitation were visible, but that the land might easily support human life was evidenced by the abundant bird and animal life of which the watchers on the Fuwalda's deck caught occasional glimpses, as well as by the shimmer of a little river which emptied into the harbor, insuring fresh water in plenitude.",0.8749,0.193,0.051,0.756,positive,Tarzan of the Apes
"As darkness settled upon the earth, Clayton and Lady Alice still stood by the ship's rail in silent contemplation of their future abode.",-0.25,0.0,0.083,0.917,negative,Tarzan of the Apes
"From the dark shadows of the mighty forest came the wild calls of savage beasts--the deep roar of the lion, and, occasionally, the shrill scream of a panther.",-0.6637,0.0,0.179,0.821,negative,Tarzan of the Apes
"The woman shrank closer to the man in terror-stricken anticipation of the horrors lying in wait for them in the awful blackness of the nights to come, when they should be alone upon that wild and lonely shore.",-0.9217,0.029,0.304,0.667,negative,Tarzan of the Apes
Later in the evening Black Michael joined them long enough to instruct them to make their preparations for landing on the morrow.,0.0,0.0,0.0,1.0,neutral,Tarzan of the Apes
They tried to persuade him to take them to some more hospitable coast near enough to civilization so that they might hope to fall into friendly hands.,0.7269,0.196,0.0,0.804,positive,Tarzan of the Apes
"But no pleas, or threats, or promises of reward could move him.",0.4497,0.368,0.283,0.349,positive,Tarzan of the Apes
"""I am the only man aboard who would not rather see ye both safely dead, and, while I know that's the sensible way to make sure of our own necks, yet Black Michael's not the man to forget a favor.",0.2732,0.196,0.131,0.674,positive,Tarzan of the Apes
"Ye saved my life once, and in return I'm goin' to spare yours, but that's all I can do.",0.2263,0.101,0.0,0.899,positive,Tarzan of the Apes
"""The men won't stand for any more, and if we don't get ye landed pretty quick they may even change their minds about giving ye that much show.",0.6808,0.177,0.0,0.823,positive,Tarzan of the Apes
"I'll put all yer stuff ashore with ye as well as cookin' utensils an' some old sails for tents, an' enough grub to last ye until ye can find fruit and game.",0.2732,0.063,0.0,0.937,positive,Tarzan of the Apes
"""With yer guns for protection, ye ought to be able to live here easy enough until help comes.",0.6808,0.259,0.0,0.741,positive,Tarzan of the Apes
"When I get safely hid away I'll see to it that the British gover'ment learns about where ye be; for the life of me I couldn't tell 'em exactly where, for I don't know myself.",0.4215,0.092,0.04,0.867,positive,Tarzan of the Apes
"But they'll find ye all right.""",0.0,0.0,0.0,1.0,neutral,Tarzan of the Apes
"After he had left them they went silently below, each wrapped in gloomy forebodings.",-0.1531,0.0,0.11,0.89,negative,Tarzan of the Apes
"Clayton did not believe that Black Michael had the slightest intention of notifying the British government of their whereabouts, nor was he any too sure but that some treachery was contemplated for the following day when they should be on shore with the sailors who would have to accompany them with their belongings.",0.1655,0.031,0.0,0.969,positive,Tarzan of the Apes
"Once out of Black Michael's sight any of the men might strike them down, and still leave Black Michael's conscience clear.",0.2263,0.112,0.116,0.773,positive,Tarzan of the Apes
And even should they escape that fate was it not but to be faced with far graver dangers?,-0.765,0.058,0.298,0.644,negative,Tarzan of the Apes
"Alone, he might hope to survive for years; for he was a strong, athletic man.",0.6369,0.323,0.104,0.573,positive,Tarzan of the Apes
"But what of Alice, and that other little life so soon to be launched amidst the hardships and grave dangers of a primeval world?",-0.7876,0.059,0.261,0.679,negative,Tarzan of the Apes
"The man shuddered as he meditated upon the awful gravity, the fearful helplessness, of their situation.",-0.8519,0.0,0.417,0.583,negative,Tarzan of the Apes
But it was a merciful Providence which prevented him from foreseeing the hideous reality which awaited them in the grim depths of that gloomy wood.,-0.7876,0.039,0.277,0.684,negative,Tarzan of the Apes
Early next morning their numerous chests and boxes were hoisted on deck and lowered to waiting small boats for transportation to shore.,-0.128,0.0,0.067,0.933,negative,Tarzan of the Apes
"There was a great quantity and variety of stuff, as the Claytons had expected a possible five to eight years' residence in their new home.",0.6249,0.157,0.0,0.843,positive,Tarzan of the Apes
"Thus, in addition to the many necessities they had brought, there were also many luxuries.",0.0,0.0,0.0,1.0,neutral,Tarzan of the Apes
Black Michael was determined that nothing belonging to the Claytons should be left on board.,0.34,0.146,0.0,0.854,positive,Tarzan of the Apes
"Whether out of compassion for them, or in furtherance of his own self-interests, it would be difficult to say.",0.128,0.133,0.111,0.756,positive,Tarzan of the Apes
There was no question but that the presence of property of a missing British official upon a suspicious vessel would have been a difficult thing to explain in any civilized port in the world.,-0.872,0.0,0.288,0.712,negative,Tarzan of the Apes
So zealous was he in his efforts to carry out his intentions that he insisted upon the return of Clayton's revolvers to him by the sailors in whose possession they were.,0.2006,0.056,0.0,0.944,positive,Tarzan of the Apes
"Into the small boats were also loaded salt meats and biscuit, with a small supply of potatoes and beans, matches, and cooking vessels, a chest of tools, and the old sails which Black Michael had promised them.",0.3612,0.068,0.0,0.932,positive,Tarzan of the Apes
"As though himself fearing the very thing which Clayton had suspected, Black Michael accompanied them to shore, and was the last to leave them when the small boats, having filled the ship's casks with fresh water, were pushed out toward the waiting Fuwalda .",-0.5423,0.048,0.141,0.811,negative,Tarzan of the Apes
"As the boats moved slowly over the smooth waters of the bay, Clayton and his wife stood silently watching their departure--in the breasts of both a feeling of impending disaster and utter hopelessness.",-0.8271,0.039,0.212,0.749,negative,Tarzan of the Apes
"And behind them, over the edge of a low ridge, other eyes watched--close set, wicked eyes, gleaming beneath shaggy brows.",-0.6705,0.0,0.244,0.756,negative,Tarzan of the Apes
"As the Fuwalda passed through the narrow entrance to the harbor and out of sight behind a projecting point, Lady Alice threw her arms about Clayton's neck and burst into uncontrolled sobs.",-0.6705,0.0,0.159,0.841,negative,Tarzan of the Apes
"Bravely had she faced the dangers of the mutiny; with heroic fortitude she had looked into the terrible future; but now that the horror of absolute solitude was upon them, her overwrought nerves gave way, and the reaction came.",-0.7469,0.092,0.224,0.684,negative,Tarzan of the Apes
He did not attempt to check her tears.,-0.2263,0.0,0.213,0.787,negative,Tarzan of the Apes
"It were better that nature have her way in relieving these long-pent emotions, and it was many minutes before the girl--little more than a child she was--could again gain mastery of herself.",0.8316,0.239,0.0,0.761,positive,Tarzan of the Apes
"""Oh, John,"" she cried at last, ""the horror of it.",-0.743,0.0,0.441,0.559,negative,Tarzan of the Apes
What are we to do?,0.0,0.0,0.0,1.0,neutral,Tarzan of the Apes
"What are we to do?""",0.0,0.0,0.0,1.0,neutral,Tarzan of the Apes
"""There is but one thing to do, Alice,"" and he spoke as quietly as though they were sitting in their snug living room at home, ""and that is work.",0.0,0.0,0.0,1.0,neutral,Tarzan of the Apes
Work must be our salvation.,0.0,0.0,0.0,1.0,neutral,Tarzan of the Apes
"We must not give ourselves time to think, for in that direction lies madness.",-0.6908,0.0,0.322,0.678,negative,Tarzan of the Apes
"""We must work and wait.",0.0,0.0,0.0,1.0,neutral,Tarzan of the Apes
"I am sure that relief will come, and come quickly, when once it is apparent that the Fuwalda has been lost, even though Black Michael does not keep his word to us.""",0.4767,0.151,0.064,0.784,positive,Tarzan of the Apes
"""But John, if it were only you and I,"" she sobbed, ""we could endure it I know; but--"" ""Yes, dear,"" he answered, gently, ""I have been thinking of that, also; but we must face it, as we must face whatever comes, bravely and with the utmost confidence in our ability to cope with circumstances whatever they may be.",0.9186,0.221,0.054,0.725,positive,Tarzan of the Apes
"""Hundreds of thousands of years ago our ancestors of the dim and distant past faced the same problems which we must face, possibly in these same primeval forests.",-0.4019,0.0,0.091,0.909,negative,Tarzan of the Apes
That we are here today evidences their victory.,0.0,0.0,0.0,1.0,neutral,Tarzan of the Apes
"""What they did may we not do?",0.0,0.0,0.0,1.0,neutral,Tarzan of the Apes
"And even better, for are we not armed with ages of superior knowledge, and have we not the means of protection, defense, and sustenance which science has given us, but of which they were totally ignorant?",0.0927,0.134,0.076,0.789,positive,Tarzan of the Apes
"What they accomplished, Alice, with instruments and weapons of stone and bone, surely that may we accomplish also.""",0.6908,0.337,0.114,0.549,positive,Tarzan of the Apes
"""Ah, John, I wish that I might be a man with a man's philosophy, but I am but a woman, seeing with my heart rather than my head, and all that I can see is too horrible, too unthinkable to put into words.",-0.5994,0.046,0.117,0.837,negative,Tarzan of the Apes
"""I only hope you are right, John.",0.4404,0.326,0.0,0.674,positive,Tarzan of the Apes
"I will do my best to be a brave primeval woman, a fit mate for the primeval man.""",0.8779,0.457,0.0,0.543,positive,Tarzan of the Apes
Clayton's first thought was to arrange a sleeping shelter for the night; something which might serve to protect them from prowling beasts of prey.,0.3818,0.106,0.0,0.894,positive,Tarzan of the Apes
"He opened the box containing his rifles and ammunition, that they might both be armed against possible attack while at work, and then together they sought a location for their first night's sleeping place.",-0.4767,0.0,0.088,0.912,negative,Tarzan of the Apes
"A hundred yards from the beach was a little level spot, fairly free of trees; here they decided eventually to build a permanent house, but for the time being they both thought it best to construct a little platform in the trees out of reach of the larger of the savage beasts in whose realm they were.",0.6249,0.147,0.064,0.789,positive,Tarzan of the Apes
"To this end Clayton selected four trees which formed a rectangle about eight feet square, and cutting long branches from other trees he constructed a framework around them, about ten feet from the ground, fastening the ends of the branches securely to the trees by means of rope, a quantity of which Black Michael had furnished him from the hold of the Fuwalda .",0.2263,0.039,0.024,0.937,positive,Tarzan of the Apes
Across this framework Clayton placed other smaller branches quite close together.,0.0,0.0,0.0,1.0,neutral,Tarzan of the Apes
"This platform he paved with the huge fronds of elephant's ear which grew in profusion about them, and over the fronds he laid a great sail folded into several thicknesses.",0.7506,0.192,0.0,0.808,positive,Tarzan of the Apes
"Seven feet higher he constructed a similar, though lighter platform to serve as roof, and from the sides of this he suspended the balance of his sailcloth for walls.",-0.4767,0.0,0.103,0.897,negative,Tarzan of the Apes
"When completed he had a rather snug little nest, to which he carried their blankets and some of the lighter luggage.",0.0,0.0,0.0,1.0,neutral,Tarzan of the Apes
"It was now late in the afternoon, and the balance of the daylight hours were devoted to the building of a rude ladder by means of which Lady Alice could mount to her new home.",-0.0772,0.072,0.08,0.849,negative,Tarzan of the Apes
