sentence,compound,positive,negative,neutral,label,title
"After having begun as a volunteer at Illinois, under Ulysses Grant, he fought at Paducah, Belmont, Pittsburg Landing, at the siege of Corinth, Port Gibson, Black River, Chattanooga, the Wilderness, on the Potomac, everywhere and valiantly, a soldier worthy of the general who said, ""I never count my dead!""",0.5255,0.109,0.044,0.846,positive,The Mysterious Island
"And hundreds of times Captain Harding had almost been among those who were not counted by the terrible Grant; but in these combats where he never spared himself, fortune favored him till the moment when he was wounded and taken prisoner on the field of battle near Richmond.",-0.7876,0.091,0.207,0.702,negative,The Mysterious Island
At the same time and on the same day another important personage fell into the hands of the Southerners.,0.2023,0.091,0.0,0.909,positive,The Mysterious Island
"This was no other than Gideon Spilett, a reporter for the New York Herald, who had been ordered to follow the changes of the war in the midst of the Northern armies.",-0.7269,0.0,0.174,0.826,negative,The Mysterious Island
"Gideon Spilett was one of that race of indomitable English or American chroniclers, like Stanley and others, who stop at nothing to obtain exact information, and transmit it to their journal in the shortest possible time.",0.0772,0.065,0.057,0.879,positive,The Mysterious Island
"The newspapers of the Union, such as the New York Herald, are genuine powers, and their reporters are men to be reckoned with.",0.0,0.0,0.0,1.0,neutral,The Mysterious Island
"Gideon Spilett ranked among the first of those reporters: a man of great merit, energetic, prompt and ready for anything, full of ideas, having traveled over the whole world, soldier and artist, enthusiastic in council, resolute in action, caring neither for trouble, fatigue, nor danger, when in pursuit of information, for himself first, and then for his journal, a perfect treasury of knowledge on all sorts of curious subjects, of the unpublished, of the unknown, and of the impossible.",0.9853,0.356,0.0,0.644,positive,The Mysterious Island
"He was one of those intrepid observers who write under fire, ""reporting"" among bullets, and to whom every danger is welcome.",-0.4215,0.112,0.216,0.672,negative,The Mysterious Island
"He also had been in all the battles, in the first rank, revolver in one hand, note-book in the other; grape-shot never made his pencil tremble.",-0.128,0.104,0.152,0.744,negative,The Mysterious Island
"He did not fatigue the wires with incessant telegrams, like those who speak when they have nothing to say, but each of his notes, short, decisive, and clear, threw light on some important point.",0.843,0.276,0.0,0.724,positive,The Mysterious Island
"Besides, he was not wanting in humor.",-0.2057,0.0,0.232,0.768,negative,The Mysterious Island
"It was he who, after the affair of the Black River, determined at any cost to keep his place at the wicket of the telegraph office, and after having announced to his journal the result of the battle, telegraphed for two hours the first chapters of the Bible.",-0.0516,0.047,0.051,0.902,negative,The Mysterious Island
"It cost the New York Herald two thousand dollars, but the New York Herald published the first intelligence.",0.631,0.196,0.0,0.804,positive,The Mysterious Island
Gideon Spilett was tall.,0.0,0.0,0.0,1.0,neutral,The Mysterious Island
He was rather more than forty years of age.,0.0,0.0,0.0,1.0,neutral,The Mysterious Island
Light whiskers bordering on red surrounded his face.,0.0,0.0,0.0,1.0,neutral,The Mysterious Island
"His eye was steady, lively, rapid in its changes.",0.4404,0.266,0.0,0.734,positive,The Mysterious Island
It was the eye of a man accustomed to take in at a glance all the details of a scene.,0.0,0.0,0.0,1.0,neutral,The Mysterious Island
"Well built, he was inured to all climates, like a bar of steel hardened in cold water.",0.5574,0.247,0.0,0.753,positive,The Mysterious Island
"For ten years Gideon Spilett had been the reporter of the New York Herald, which he enriched by his letters and drawings, for he was as skilful in the use of the pencil as of the pen.",0.0,0.0,0.0,1.0,neutral,The Mysterious Island
"When he was captured, he was in the act of making a description and sketch of the battle.",-0.3818,0.0,0.14,0.86,negative,The Mysterious Island
"The last words in his note-book were these: ""A Southern rifleman has just taken aim at me, but--"" The Southerner notwithstanding missed Gideon Spilett, who, with his usual fortune, came out of this affair without a scratch.",-0.296,0.0,0.059,0.941,negative,The Mysterious Island
"Cyrus Harding and Gideon Spilett, who did not know each other except by reputation, had both been carried to Richmond.",0.0,0.0,0.0,1.0,neutral,The Mysterious Island
"The engineer's wounds rapidly healed, and it was during his convalescence that he made acquaintance with the reporter.",0.0,0.0,0.0,1.0,neutral,The Mysterious Island
The two men then learned to appreciate each other.,0.4019,0.252,0.0,0.748,positive,The Mysterious Island
"Soon their common aim had but one object, that of escaping, rejoining Grant's army, and fighting together in the ranks of the Federals.",-0.4497,0.051,0.127,0.822,negative,The Mysterious Island
"The two Americans had from the first determined to seize every chance; but although they were allowed to wander at liberty in the town, Richmond was so strictly guarded, that escape appeared impossible.",0.8338,0.254,0.0,0.746,positive,The Mysterious Island
In the meanwhile Captain Harding was rejoined by a servant who was devoted to him in life and in death.,-0.296,0.114,0.165,0.72,negative,The Mysterious Island
"This intrepid fellow was a Negro born on the engineer's estate, of a slave father and mother, but to whom Cyrus, who was an Abolitionist from conviction and heart, had long since given his freedom.",0.7783,0.153,0.0,0.847,positive,The Mysterious Island
"The once slave, though free, would not leave his master.",0.5343,0.357,0.0,0.643,positive,The Mysterious Island
He would have died for him.,-0.5574,0.0,0.419,0.581,negative,The Mysterious Island
"He was a man of about thirty, vigorous, active, clever, intelligent, gentle, and calm, sometimes naive, always merry, obliging, and honest.",0.9559,0.595,0.06,0.345,positive,The Mysterious Island
"His name was Nebuchadnezzar, but he only answered to the familiar abbreviation of Neb.",0.0,0.0,0.0,1.0,neutral,The Mysterious Island
"When Neb heard that his master had been made prisoner, he left Massachusetts without hesitating an instant, arrived before Richmond, and by dint of stratagem and shrewdness, after having risked his life twenty times over, managed to penetrate into the besieged town.",-0.521,0.044,0.116,0.84,negative,The Mysterious Island
"The pleasure of Harding on seeing his servant, and the joy of Neb at finding his master, can scarcely be described.",0.8176,0.283,0.0,0.717,positive,The Mysterious Island
"But though Neb had been able to make his way into Richmond, it was quite another thing to get out again, for the Northern prisoners were very strictly watched.",-0.6652,0.0,0.137,0.863,negative,The Mysterious Island
"Some extraordinary opportunity was needed to make the attempt with any chance of success, and this opportunity not only did not present itself, but was very difficult to find.",0.2407,0.216,0.104,0.679,positive,The Mysterious Island
Meanwhile Grant continued his energetic operations.,0.6597,0.574,0.0,0.426,positive,The Mysterious Island
The victory of Petersburg had been very dearly bought.,0.4754,0.279,0.0,0.721,positive,The Mysterious Island
"His forces, united to those of Butler, had as yet been unsuccessful before Richmond, and nothing gave the prisoners any hope of a speedy deliverance.",0.7097,0.272,0.081,0.647,positive,The Mysterious Island
"The reporter, to whom his tedious captivity did not offer a single incident worthy of note, could stand it no longer.",0.1779,0.126,0.095,0.779,positive,The Mysterious Island
His usually active mind was occupied with one sole thought--how he might get out of Richmond at any cost.,0.4019,0.13,0.0,0.87,positive,The Mysterious Island
"Several times had he even made the attempt, but was stopped by some insurmountable obstacle.",-0.6808,0.0,0.301,0.699,negative,The Mysterious Island
"However, the siege continued; and if the prisoners were anxious to escape and join Grant's army, certain of the besieged were no less anxious to join the Southern forces.",-0.3182,0.212,0.245,0.543,negative,The Mysterious Island
"Among them was one Jonathan Forster, a determined Southerner.",0.34,0.255,0.0,0.745,positive,The Mysterious Island
"The truth was, that if the prisoners of the Secessionists could not leave the town, neither could the Secessionists themselves while the Northern army invested it.",-0.2148,0.116,0.111,0.773,negative,The Mysterious Island
"The Governor of Richmond for a long time had been unable to communicate with General Lee, and he very much wished to make known to him the situation of the town, so as to hasten the march of the army to their relief.",0.4767,0.07,0.0,0.93,positive,The Mysterious Island
"Thus Jonathan Forster accordingly conceived the idea of rising in a balloon, so as to pass over the besieging lines, and in that way reach the Secessionist camp.",0.0258,0.041,0.0,0.959,neutral,The Mysterious Island
The Governor authorized the attempt.,0.0,0.0,0.0,1.0,neutral,The Mysterious Island
"A balloon was manufactured and placed at the disposal of Forster, who was to be accompanied by five other persons.",0.0,0.0,0.0,1.0,neutral,The Mysterious Island
"They were furnished with arms in case they might have to defend themselves when they alighted, and provisions in the event of their aerial voyage being prolonged.",0.0,0.0,0.0,1.0,neutral,The Mysterious Island
The departure of the balloon was fixed for the 18th of March.,0.0,0.0,0.0,1.0,neutral,The Mysterious Island
"It should be effected during the night, with a northwest wind of moderate force, and the aeronauts calculated that they would reach General Lee's camp in a few hours.",0.0258,0.041,0.0,0.959,neutral,The Mysterious Island
But this northwest wind was not a simple breeze.,0.0,0.0,0.0,1.0,neutral,The Mysterious Island
From the 18th it was evident that it was changing to a hurricane.,0.0,0.0,0.0,1.0,neutral,The Mysterious Island
"The tempest soon became such that Forster's departure was deferred, for it was impossible to risk the balloon and those whom it carried in the midst of the furious elements.",-0.7003,0.0,0.172,0.828,negative,The Mysterious Island
"The balloon, inflated on the great square of Richmond, was ready to depart on the first abatement of the wind, and, as may be supposed, the impatience among the besieged to see the storm moderate was very great.",0.836,0.225,0.059,0.716,positive,The Mysterious Island
"The 18th, the 19th of March passed without any alteration in the weather.",0.0,0.0,0.0,1.0,neutral,The Mysterious Island
"There was even great difficulty in keeping the balloon fastened to the ground, as the squalls dashed it furiously about.",-0.0516,0.155,0.201,0.644,negative,The Mysterious Island
"The night of the 19th passed, but the next morning the storm blew with redoubled force.",0.0,0.0,0.0,1.0,neutral,The Mysterious Island
The departure of the balloon was impossible.,0.0,0.0,0.0,1.0,neutral,The Mysterious Island
"On that day the engineer, Cyrus Harding, was accosted in one of the streets of Richmond by a person whom he did not in the least know.",0.0,0.0,0.0,1.0,neutral,The Mysterious Island
"This was a sailor named Pencroft, a man of about thirty-five or forty years of age, strongly built, very sunburnt, and possessed of a pair of bright sparkling eyes and a remarkably good physiognomy.",0.8553,0.286,0.0,0.714,positive,The Mysterious Island
"Pencroft was an American from the North, who had sailed all the ocean over, and who had gone through every possible and almost impossible adventure that a being with two feet and no wings would encounter.",-0.046,0.054,0.059,0.887,neutral,The Mysterious Island
"It is needless to say that he was a bold, dashing fellow, ready to dare anything and was astonished at nothing.",0.7717,0.312,0.0,0.688,positive,The Mysterious Island
"Pencroft at the beginning of the year had gone to Richmond on business, with a young boy of fifteen from New Jersey, son of a former captain, an orphan, whom he loved as if he had been his own child.",0.5994,0.095,0.0,0.905,positive,The Mysterious Island
"Not having been able to leave the town before the first operations of the siege, he found himself shut up, to his great disgust; but, not accustomed to succumb to difficulties, he resolved to escape by some means or other.",0.0772,0.141,0.135,0.723,positive,The Mysterious Island
He knew the engineer-officer by reputation; he knew with what impatience that determined man chafed under his restraint.,-0.1027,0.113,0.132,0.755,negative,The Mysterious Island
"On this day he did not, therefore, hesitate to accost him, saying, without circumlocution, ""Have you had enough of Richmond, captain?""",0.2057,0.083,0.0,0.917,positive,The Mysterious Island
"The engineer looked fixedly at the man who spoke, and who added, in a low voice,-- ""Captain Harding, will you try to escape?""",-0.2732,0.0,0.091,0.909,negative,The Mysterious Island
"""When?""",0.0,0.0,0.0,1.0,neutral,The Mysterious Island
"asked the engineer quickly, and it was evident that this question was uttered without consideration, for he had not yet examined the stranger who addressed him.",0.0,0.0,0.0,1.0,neutral,The Mysterious Island
"But after having with a penetrating eye observed the open face of the sailor, he was convinced that he had before him an honest man.",0.8402,0.267,0.0,0.733,positive,The Mysterious Island
"""Who are you?""",0.0,0.0,0.0,1.0,neutral,The Mysterious Island
he asked briefly.,0.0,0.0,0.0,1.0,neutral,The Mysterious Island
Pencroft made himself known.,0.0,0.0,0.0,1.0,neutral,The Mysterious Island
"""Well,"" replied Harding, ""and in what way do you propose to escape?""",0.0,0.0,0.0,1.0,neutral,The Mysterious Island
"""By that lazy balloon which is left there doing nothing, and which looks to me as if it was waiting on purpose for us--"" There was no necessity for the sailor to finish his sentence.",-0.5267,0.034,0.124,0.842,negative,The Mysterious Island
The engineer understood him at once.,0.0,0.0,0.0,1.0,neutral,The Mysterious Island
"He seized Pencroft by the arm, and dragged him to his house.",-0.0516,0.0,0.098,0.902,negative,The Mysterious Island
"There the sailor developed his project, which was indeed extremely simple.",0.0,0.0,0.0,1.0,neutral,The Mysterious Island
They risked nothing but their lives in its execution.,-0.1154,0.0,0.153,0.847,negative,The Mysterious Island
"The hurricane was in all its violence, it is true, but so clever and daring an engineer as Cyrus Harding knew perfectly well how to manage a balloon.",0.9508,0.439,0.061,0.5,positive,The Mysterious Island
"Had he himself been as well acquainted with the art of sailing in the air as he was with the navigation of a ship, Pencroft would not have hesitated to set out, of course taking his young friend Herbert with him; for, accustomed to brave the fiercest tempests of the ocean, he was not to be hindered on account of the hurricane.",0.8645,0.158,0.0,0.842,positive,The Mysterious Island
"Captain Harding had listened to the sailor without saying a word, but his eyes shone with satisfaction.",0.5927,0.204,0.0,0.796,positive,The Mysterious Island
Here was the long-sought-for opportunity--he was not a man to let it pass.,0.0,0.0,0.0,1.0,neutral,The Mysterious Island
"The plan was feasible, though, it must be confessed, dangerous in the extreme.",-0.4767,0.0,0.205,0.795,negative,The Mysterious Island
"In the night, in spite of their guards, they might approach the balloon, slip into the car, and then cut the cords which held it.",-0.6705,0.0,0.193,0.807,negative,The Mysterious Island
"There was no doubt that they might be killed, but on the other hand they might succeed, and without this storm!--Without this storm the balloon would have started already and the looked-for opportunity would not have then presented itself.",0.8588,0.244,0.118,0.638,positive,The Mysterious Island
"""I am not alone!""",0.0,0.0,0.0,1.0,neutral,The Mysterious Island
said Harding at last.,0.0,0.0,0.0,1.0,neutral,The Mysterious Island
"""How many people do you wish to bring with you?""",0.4019,0.231,0.0,0.769,positive,The Mysterious Island
asked the sailor.,0.0,0.0,0.0,1.0,neutral,The Mysterious Island
"""Two; my friend Spilett, and my servant Neb.""",0.4939,0.314,0.0,0.686,positive,The Mysterious Island
"""That will be three,"" replied Pencroft; ""and with Herbert and me five.",0.0,0.0,0.0,1.0,neutral,The Mysterious Island
"But the balloon will hold six--"" ""That will be enough, we will go,"" answered Harding in a firm voice.",0.0,0.0,0.0,1.0,neutral,The Mysterious Island
"This ""we"" included Spilett, for the reporter, as his friend well knew, was not a man to draw back, and when the project was communicated to him he approved of it unreservedly.",0.7964,0.224,0.0,0.776,positive,The Mysterious Island
"What astonished him was, that so simple an idea had not occurred to him before.",0.3818,0.157,0.0,0.843,positive,The Mysterious Island
"As to Neb, he followed his master wherever his master wished to go.",0.0,0.0,0.0,1.0,neutral,The Mysterious Island
"""This evening, then,"" said Pencroft, ""we will all meet out there.""",0.0,0.0,0.0,1.0,neutral,The Mysterious Island
"""This evening, at ten o'clock,"" replied Captain Harding; ""and Heaven grant that the storm does not abate before our departure.""",0.7003,0.244,0.0,0.756,positive,The Mysterious Island
"Pencroft took leave of the two friends, and returned to his lodging, where young Herbert Brown had remained.",0.4404,0.153,0.059,0.788,positive,The Mysterious Island
"The courageous boy knew of the sailor's plan, and it was not without anxiety that he awaited the result of the proposal being made to the engineer.",0.4435,0.114,0.083,0.803,positive,The Mysterious Island
Thus five determined persons were about to abandon themselves to the mercy of the tempestuous elements!,0.3164,0.246,0.137,0.616,positive,The Mysterious Island
No!,-0.3595,0.0,1.0,0.0,negative,The Mysterious Island
"the storm did not abate, and neither Jonathan Forster nor his companions dreamed of confronting it in that frail car.",-0.1531,0.0,0.078,0.922,negative,The Mysterious Island
It would be a terrible journey.,-0.4767,0.0,0.437,0.563,negative,The Mysterious Island
"The engineer only feared one thing; it was that the balloon, held to the ground and dashed about by the wind, would be torn into shreds.",-0.6369,0.0,0.178,0.822,negative,The Mysterious Island
"For several hours he roamed round the nearly-deserted square, surveying the apparatus.",0.0,0.0,0.0,1.0,neutral,The Mysterious Island
"Pencroft did the same on his side, his hands in his pockets, yawning now and then like a man who did not know how to kill the time, but really dreading, like his friend, either the escape or destruction of the balloon.",-0.5558,0.195,0.222,0.583,negative,The Mysterious Island
Evening arrived.,0.0,0.0,0.0,1.0,neutral,The Mysterious Island
The night was dark in the extreme.,0.0,0.0,0.0,1.0,neutral,The Mysterious Island
Thick mists passed like clouds close to the ground.,0.3612,0.238,0.0,0.762,positive,The Mysterious Island
"Rain fell mingled with snow, it was very cold.",0.0,0.0,0.0,1.0,neutral,The Mysterious Island
A mist hung over Richmond.,0.0,0.0,0.0,1.0,neutral,The Mysterious Island
"It seemed as if the violent storm had produced a truce between the besiegers and the besieged, and that the cannon were silenced by the louder detonations of the storm.",-0.5994,0.0,0.122,0.878,negative,The Mysterious Island
The streets of the town were deserted.,0.0,0.0,0.0,1.0,neutral,The Mysterious Island
"It had not even appeared necessary in that horrible weather to place a guard in the square, in the midst of which plunged the balloon.",-0.5423,0.0,0.132,0.868,negative,The Mysterious Island
"Everything favored the departure of the prisoners, but what might possibly be the termination of the hazardous voyage they contemplated in the midst of the furious elements?-- ""Dirty weather!""",-0.8871,0.05,0.297,0.654,negative,The Mysterious Island
"exclaimed Pencroft, fixing his hat firmly on his head with a blow of his fist; ""but pshaw, we shall succeed all the same!""",0.68,0.179,0.0,0.821,positive,The Mysterious Island
"At half-past nine, Harding and his companions glided from different directions into the square, which the gas-lamps, extinguished by the wind, had left in total obscurity.",0.0,0.0,0.0,1.0,neutral,The Mysterious Island
"Even the enormous balloon, almost beaten to the ground, could not be seen.",-0.3626,0.0,0.173,0.827,negative,The Mysterious Island
"Independently of the sacks of ballast, to which the cords of the net were fastened, the car was held by a strong cable passed through a ring in the pavement.",0.5106,0.109,0.0,0.891,positive,The Mysterious Island
The five prisoners met by the car.,-0.5106,0.0,0.355,0.645,negative,The Mysterious Island
"They had not been perceived, and such was the darkness that they could not even see each other.",-0.25,0.0,0.105,0.895,negative,The Mysterious Island
"Without speaking a word, Harding, Spilett, Neb, and Herbert took their places in the car, while Pencroft by the engineer's order detached successively the bags of ballast.",0.1027,0.069,0.055,0.876,positive,The Mysterious Island
"It was the work of a few minutes only, and the sailor rejoined his companions.",0.0,0.0,0.0,1.0,neutral,The Mysterious Island
"The balloon was then only held by the cable, and the engineer had nothing to do but to give the word.",0.0,0.0,0.0,1.0,neutral,The Mysterious Island
At that moment a dog sprang with a bound into the car.,0.0,0.0,0.0,1.0,neutral,The Mysterious Island
"It was Top, a favorite of the engineer.",0.5859,0.49,0.0,0.51,positive,The Mysterious Island
"The faithful creature, having broken his chain, had followed his master.",-0.0516,0.193,0.207,0.6,negative,The Mysterious Island
"He, however, fearing that its additional weight might impede their ascent, wished to send away the animal.",-0.5719,0.0,0.188,0.812,negative,The Mysterious Island
"""One more will make but little difference, poor beast!""",-0.6155,0.0,0.335,0.665,negative,The Mysterious Island
"exclaimed Pencroft, heaving out two bags of sand, and as he spoke letting go the cable; the balloon ascending in an oblique direction, disappeared, after having dashed the car against two chimneys, which it threw down as it swept by them.",-0.2263,0.0,0.045,0.955,negative,The Mysterious Island
"Then, indeed, the full rage of the hurricane was exhibited to the voyagers.",-0.5574,0.0,0.231,0.769,negative,The Mysterious Island
"During the night the engineer could not dream of descending, and when day broke, even a glimpse of the earth below was intercepted by fog.",-0.5484,0.0,0.171,0.829,negative,The Mysterious Island
"Five days had passed when a partial clearing allowed them to see the wide extending ocean beneath their feet, now lashed into the maddest fury by the gale.",-0.8176,0.0,0.231,0.769,negative,The Mysterious Island
Our readers will recollect what befell these five daring individuals who set out on their hazardous expedition in the balloon on the 20th of March.,0.3612,0.094,0.0,0.906,positive,The Mysterious Island
"Five days afterwards four of them were thrown on a desert coast, seven thousand miles from their country!",0.0,0.0,0.0,1.0,neutral,The Mysterious Island
"But one of their number was missing, the man who was to be their guide, their leading spirit, the engineer, Captain Harding!",-0.1511,0.148,0.109,0.742,negative,The Mysterious Island
"The instant they had recovered their feet, they all hurried to the beach in the hopes of rendering him assistance.",0.4215,0.128,0.0,0.872,positive,The Mysterious Island
"Chapter 3 The engineer, the meshes of the net having given way, had been carried off by a wave.",0.0,0.0,0.0,1.0,neutral,The Mysterious Island
His dog also had disappeared.,-0.2263,0.0,0.322,0.678,negative,The Mysterious Island
The faithful animal had voluntarily leaped out to help his master.,0.6808,0.384,0.0,0.616,positive,The Mysterious Island
"""Forward,"" cried the reporter; and all four, Spilett, Herbert, Pencroft, and Neb, forgetting their fatigue, began their search.",-0.5574,0.0,0.223,0.777,negative,The Mysterious Island
"Poor Neb shed bitter tears, giving way to despair at the thought of having lost the only being he loved on earth.",-0.6249,0.187,0.368,0.445,negative,The Mysterious Island
Only two minutes had passed from the time when Cyrus Harding disappeared to the moment when his companions set foot on the ground.,-0.2263,0.0,0.079,0.921,negative,The Mysterious Island
They had hopes therefore of arriving in time to save him.,0.7184,0.4,0.0,0.6,positive,The Mysterious Island
"""Let us look for him!",0.0,0.0,0.0,1.0,neutral,The Mysterious Island
"let us look for him!""",0.0,0.0,0.0,1.0,neutral,The Mysterious Island
cried Neb.,-0.3818,0.0,0.722,0.278,negative,The Mysterious Island
"""Yes, Neb,"" replied Gideon Spilett, ""and we will find him too!""",0.0,0.0,0.0,1.0,neutral,The Mysterious Island
"""Living, I trust!""",0.0,0.0,0.0,1.0,neutral,The Mysterious Island
"""Still living!""",0.0,0.0,0.0,1.0,neutral,The Mysterious Island
"""Can he swim?""",0.0,0.0,0.0,1.0,neutral,The Mysterious Island
asked Pencroft.,0.0,0.0,0.0,1.0,neutral,The Mysterious Island
"""Yes,"" replied Neb, ""and besides, Top is there.""",0.2023,0.205,0.0,0.795,positive,The Mysterious Island
