sentence,compound,positive,negative,neutral,label,title
"That black figure with its eyes of fire struck down through all my adult thoughts and feelings, and for a moment the forgotten horrors of childhood came back to my mind.",-0.8402,0.0,0.278,0.722,negative,The island of Doctor Moreau
Then the effect passed as it had come.,0.0,0.0,0.0,1.0,neutral,The island of Doctor Moreau
"An uncouth black figure of a man, a figure of no particular import, hung over the taffrail against the starlight, and I found Montgomery was speaking to me.",-0.296,0.0,0.084,0.916,negative,The island of Doctor Moreau
"""I'm thinking of turning in, then,"" said he, ""if you've had enough of this.""",0.0,0.0,0.0,1.0,neutral,The island of Doctor Moreau
I answered him incongruously.,0.0,0.0,0.0,1.0,neutral,The island of Doctor Moreau
"We went below, and he wished me good-night at the door of my cabin.",0.0,0.0,0.0,1.0,neutral,The island of Doctor Moreau
That night I had some very unpleasant dreams.,-0.1065,0.262,0.298,0.44,negative,The island of Doctor Moreau
The waning moon rose late.,0.0,0.0,0.0,1.0,neutral,The island of Doctor Moreau
"Its light struck a ghostly white beam across my cabin, and made an ominous shape on the planking by my bunk.",-0.5267,0.0,0.196,0.804,negative,The island of Doctor Moreau
"Then the staghounds woke, and began howling and baying; so that I dreamt fitfully, and scarcely slept until the approach of dawn.",0.0,0.0,0.0,1.0,neutral,The island of Doctor Moreau
V. THE MAN WHO HAD NOWHERE TO GO.,0.0,0.0,0.0,1.0,neutral,The island of Doctor Moreau
"In the early morning (it was the second morning after my recovery, and I believe the fourth after I was picked up), I awoke through an avenue of tumultuous dreams,--dreams of guns and howling mobs,--and became sensible of a hoarse shouting above me.",0.0,0.0,0.0,1.0,neutral,The island of Doctor Moreau
"I rubbed my eyes and lay listening to the noise, doubtful for a little while of my whereabouts.",-0.34,0.0,0.138,0.862,negative,The island of Doctor Moreau
"Then came a sudden pattering of bare feet, the sound of heavy objects being thrown about, a violent creaking and the rattling of chains.",-0.5994,0.0,0.157,0.843,negative,The island of Doctor Moreau
"I heard the swish of the water as the ship was suddenly brought round, and a foamy yellow-green wave flew across the little round window and left it streaming.",0.0,0.0,0.0,1.0,neutral,The island of Doctor Moreau
I jumped into my clothes and went on deck.,0.0,0.0,0.0,1.0,neutral,The island of Doctor Moreau
"As I came up the ladder I saw against the flushed sky--for the sun was just rising--the broad back and red hair of the captain, and over his shoulder the puma spinning from a tackle rigged on to the mizzen spanker-boom.",-0.3612,0.0,0.063,0.937,negative,The island of Doctor Moreau
"The poor brute seemed horribly scared, and crouched in the bottom of its little cage.",-0.8555,0.0,0.439,0.561,negative,The island of Doctor Moreau
"""Overboard with 'em!""",0.0,0.0,0.0,1.0,neutral,The island of Doctor Moreau
bawled the captain.,0.0,0.0,0.0,1.0,neutral,The island of Doctor Moreau
"""Overboard with 'em!",0.0,0.0,0.0,1.0,neutral,The island of Doctor Moreau
"We'll have a clean ship soon of the whole bilin' of 'em.""",0.4019,0.213,0.0,0.787,positive,The island of Doctor Moreau
"He stood in my way, so that I had perforce to tap his shoulder to come on deck.",0.0,0.0,0.0,1.0,neutral,The island of Doctor Moreau
"He came round with a start, and staggered back a few paces to stare at me.",0.0,0.0,0.0,1.0,neutral,The island of Doctor Moreau
It needed no expert eye to tell that the man was still drunk.,-0.5574,0.0,0.295,0.705,negative,The island of Doctor Moreau
"""Hullo!""",0.0,0.0,0.0,1.0,neutral,The island of Doctor Moreau
"said he, stupidly; and then with a light coming into his eyes, ""Why, it's Mister--Mister?""",-0.4588,0.0,0.188,0.812,negative,The island of Doctor Moreau
"""Prendick,"" said I.",0.0,0.0,0.0,1.0,neutral,The island of Doctor Moreau
"""Prendick be damned!""",0.0,0.0,0.0,1.0,neutral,The island of Doctor Moreau
said he.,0.0,0.0,0.0,1.0,neutral,The island of Doctor Moreau
"""Shut-up,--that's your name.",0.0,0.0,0.0,1.0,neutral,The island of Doctor Moreau
"Mister Shut-up.""",0.0,0.0,0.0,1.0,neutral,The island of Doctor Moreau
It was no good answering the brute; but I certainly did not expect his next move.,0.5346,0.271,0.086,0.643,positive,The island of Doctor Moreau
"He held out his hand to the gangway by which Montgomery stood talking to a massive grey-haired man in dirty-blue flannels, who had apparently just come aboard.",0.5106,0.152,0.0,0.848,positive,The island of Doctor Moreau
"""That way, Mister Blasted Shut-up!",0.0,0.0,0.0,1.0,neutral,The island of Doctor Moreau
"that way!""",0.0,0.0,0.0,1.0,neutral,The island of Doctor Moreau
roared the captain.,0.0,0.0,0.0,1.0,neutral,The island of Doctor Moreau
Montgomery and his companion turned as he spoke.,0.0,0.0,0.0,1.0,neutral,The island of Doctor Moreau
"""What do you mean?""",0.0,0.0,0.0,1.0,neutral,The island of Doctor Moreau
I said.,0.0,0.0,0.0,1.0,neutral,The island of Doctor Moreau
"""That way, Mister Blasted Shut-up,--that's what I mean!",0.0,0.0,0.0,1.0,neutral,The island of Doctor Moreau
"Overboard, Mister Shut-up,--and sharp!",0.0,0.0,0.0,1.0,neutral,The island of Doctor Moreau
"We're cleaning the ship out,--cleaning the whole blessed ship out; and overboard you go!""",0.636,0.244,0.0,0.756,positive,The island of Doctor Moreau
I stared at him dumfounded.,0.0,0.0,0.0,1.0,neutral,The island of Doctor Moreau
Then it occurred to me that it was exactly the thing I wanted.,0.0,0.0,0.0,1.0,neutral,The island of Doctor Moreau
The lost prospect of a journey as sole passenger with this quarrelsome sot was not one to mourn over.,0.3031,0.208,0.105,0.687,positive,The island of Doctor Moreau
I turned towards Montgomery.,0.0,0.0,0.0,1.0,neutral,The island of Doctor Moreau
"""Can't have you,"" said Montgomery's companion, concisely.",0.0,0.0,0.0,1.0,neutral,The island of Doctor Moreau
"""You can't have me!""",0.0,0.0,0.0,1.0,neutral,The island of Doctor Moreau
"said I, aghast.",-0.4404,0.0,0.592,0.408,negative,The island of Doctor Moreau
He had the squarest and most resolute face I ever set eyes upon.,0.3384,0.179,0.0,0.821,positive,The island of Doctor Moreau
"""Look here,"" I began, turning to the captain.",0.0,0.0,0.0,1.0,neutral,The island of Doctor Moreau
"""Overboard!""",0.0,0.0,0.0,1.0,neutral,The island of Doctor Moreau
said the captain.,0.0,0.0,0.0,1.0,neutral,The island of Doctor Moreau
"""This ship aint for beasts and cannibals and worse than beasts, any more.",-0.4767,0.0,0.205,0.795,negative,The island of Doctor Moreau
"Overboard you go, Mister Shut-up.",0.0,0.0,0.0,1.0,neutral,The island of Doctor Moreau
"If they can't have you, you goes overboard.",0.0,0.0,0.0,1.0,neutral,The island of Doctor Moreau
"But, anyhow, you go--with your friends.",0.631,0.454,0.0,0.546,positive,The island of Doctor Moreau
"I've done with this blessed island for evermore, amen!",0.7111,0.381,0.0,0.619,positive,The island of Doctor Moreau
"I've had enough of it.""",0.0,0.0,0.0,1.0,neutral,The island of Doctor Moreau
"""But, Montgomery,"" I appealed.",0.0,0.0,0.0,1.0,neutral,The island of Doctor Moreau
"He distorted his lower lip, and nodded his head hopelessly at the grey-haired man beside him, to indicate his powerlessness to help me.",-0.6597,0.091,0.272,0.638,negative,The island of Doctor Moreau
"""I'll see to you , presently,"" said the captain.",0.0,0.0,0.0,1.0,neutral,The island of Doctor Moreau
Then began a curious three-cornered altercation.,0.3182,0.365,0.0,0.635,positive,The island of Doctor Moreau
"Alternately I appealed to one and another of the three men,--first to the grey-haired man to let me land, and then to the drunken captain to keep me aboard.",0.0258,0.039,0.0,0.961,neutral,The island of Doctor Moreau
I even bawled entreaties to the sailors.,0.0,0.0,0.0,1.0,neutral,The island of Doctor Moreau
"Montgomery said never a word, only shook his head.",0.0762,0.156,0.0,0.844,positive,The island of Doctor Moreau
"""You're going overboard, I tell you,"" was the captain's refrain.",0.0,0.0,0.0,1.0,neutral,The island of Doctor Moreau
"""Law be damned!",-0.4389,0.0,0.591,0.409,negative,The island of Doctor Moreau
"I'm king here.""",0.0,0.0,0.0,1.0,neutral,The island of Doctor Moreau
At last I must confess my voice suddenly broke in the middle of a vigorous threat.,-0.7351,0.0,0.341,0.659,negative,The island of Doctor Moreau
"I felt a gust of hysterical petulance, and went aft and stared dismally at nothing.",-0.0258,0.0,0.084,0.916,neutral,The island of Doctor Moreau
Meanwhile the sailors progressed rapidly with the task of unshipping the packages and caged animals.,0.0,0.0,0.0,1.0,neutral,The island of Doctor Moreau
"A large launch, with two standing lugs, lay under the lee of the schooner; and into this the strange assortment of goods were swung.",-0.2023,0.0,0.076,0.924,negative,The island of Doctor Moreau
"I did not then see the hands from the island that were receiving the packages, for the hull of the launch was hidden from me by the side of the schooner.",0.0,0.0,0.0,1.0,neutral,The island of Doctor Moreau
"Neither Montgomery nor his companion took the slightest notice of me, but busied themselves in assisting and directing the four or five sailors who were unloading the goods.",0.0,0.0,0.0,1.0,neutral,The island of Doctor Moreau
The captain went forward interfering rather than assisting.,0.0,0.0,0.0,1.0,neutral,The island of Doctor Moreau
I was alternately despairful and desperate.,-0.3182,0.0,0.365,0.635,negative,The island of Doctor Moreau
"Once or twice as I stood waiting there for things to accomplish themselves, I could not resist an impulse to laugh at my miserable quandary.",0.4939,0.216,0.108,0.676,positive,The island of Doctor Moreau
I felt all the wretcheder for the lack of a breakfast.,-0.3182,0.0,0.223,0.777,negative,The island of Doctor Moreau
Hunger and a lack of blood-corpuscles take all the manhood from a man.,-0.5106,0.0,0.323,0.677,negative,The island of Doctor Moreau
"I perceived pretty clearly that I had not the stamina either to resist what the captain chose to do to expel me, or to force myself upon Montgomery and his companion.",0.276,0.165,0.134,0.701,positive,The island of Doctor Moreau
So I waited passively upon fate; and the work of transferring Montgomery's possessions to the launch went on as if I did not exist.,-0.2449,0.0,0.086,0.914,negative,The island of Doctor Moreau
"Presently that work was finished, and then came a struggle.",-0.3182,0.0,0.223,0.777,negative,The island of Doctor Moreau
"I was hauled, resisting weakly enough, to the gangway.",-0.4215,0.0,0.286,0.714,negative,The island of Doctor Moreau
"Even then I noticed the oddness of the brown faces of the men who were with Montgomery in the launch; but the launch was now fully laden, and was shoved off hastily.",0.0,0.0,0.0,1.0,neutral,The island of Doctor Moreau
"A broadening gap of green water appeared under me, and I pushed back with all my strength to avoid falling headlong.",0.1027,0.139,0.165,0.696,positive,The island of Doctor Moreau
"The hands in the launch shouted derisively, and I heard Montgomery curse at them; and then the captain, the mate, and one of the seamen helping him, ran me aft towards the stern.",-0.3182,0.062,0.098,0.84,negative,The island of Doctor Moreau
"The dingey of the Lady Vain had been towing behind; it was half full of water, had no oars, and was quite unvictualled.",-0.6124,0.0,0.192,0.808,negative,The island of Doctor Moreau
"I refused to go aboard her, and flung myself full length on the deck.",-0.2732,0.077,0.154,0.769,negative,The island of Doctor Moreau
"In the end, they swung me into her by a rope (for they had no stern ladder), and then they cut me adrift.",-0.5106,0.0,0.177,0.823,negative,The island of Doctor Moreau
I drifted slowly from the schooner.,0.0,0.0,0.0,1.0,neutral,The island of Doctor Moreau
"In a kind of stupor I watched all hands take to the rigging, and slowly but surely she came round to the wind; the sails fluttered, and then bellied out as the wind came into them.",0.5927,0.104,0.0,0.896,positive,The island of Doctor Moreau
I stared at her weather-beaten side heeling steeply towards me; and then she passed out of my range of view.,0.0,0.0,0.0,1.0,neutral,The island of Doctor Moreau
I did not turn my head to follow her.,0.0,0.0,0.0,1.0,neutral,The island of Doctor Moreau
At first I could scarcely believe what had happened.,0.0,0.0,0.0,1.0,neutral,The island of Doctor Moreau
"I crouched in the bottom of the dingey, stunned, and staring blankly at the vacant, oily sea.",-0.1027,0.0,0.085,0.915,negative,The island of Doctor Moreau
"Then I realised that I was in that little hell of mine again, now half swamped; and looking back over the gunwale, I saw the schooner standing away from me, with the red-haired captain mocking at me over the taffrail, and turning towards the island saw the launch growing smaller as she approached the beach.",-0.7436,0.029,0.121,0.849,negative,The island of Doctor Moreau
Abruptly the cruelty of this desertion became clear to me.,-0.3182,0.179,0.269,0.552,negative,The island of Doctor Moreau
I had no means of reaching the land unless I should chance to drift there.,0.1531,0.237,0.138,0.625,positive,The island of Doctor Moreau
"I was still weak, you must remember, from my exposure in the boat; I was empty and very faint, or I should have had more heart.",-0.5719,0.0,0.183,0.817,negative,The island of Doctor Moreau
"But as it was I suddenly began to sob and weep, as I had never done since I was a little child.",-0.8201,0.0,0.321,0.679,negative,The island of Doctor Moreau
The tears ran down my face.,-0.2263,0.0,0.275,0.725,negative,The island of Doctor Moreau
"In a passion of despair I struck with my fists at the water in the bottom of the boat, and kicked savagely at the gunwale.",-0.5423,0.102,0.254,0.644,negative,The island of Doctor Moreau
I prayed aloud for God to let me die.,-0.4215,0.175,0.325,0.5,negative,The island of Doctor Moreau
VI.,0.0,0.0,0.0,1.0,neutral,The island of Doctor Moreau
THE EVIL-LOOKING BOATMEN.,0.0,0.0,0.0,1.0,neutral,The island of Doctor Moreau
"But the islanders, seeing that I was really adrift, took pity on me.",-0.4932,0.0,0.225,0.775,negative,The island of Doctor Moreau
"I drifted very slowly to the eastward, approaching the island slantingly; and presently I saw, with hysterical relief, the launch come round and return towards me.",0.4588,0.118,0.042,0.84,positive,The island of Doctor Moreau
"She was heavily laden, and I could make out as she drew nearer Montgomery's white-haired, broad-shouldered companion sitting cramped up with the dogs and several packing-cases in the stern sheets.",0.0,0.0,0.0,1.0,neutral,The island of Doctor Moreau
This individual stared fixedly at me without moving or speaking.,0.0,0.0,0.0,1.0,neutral,The island of Doctor Moreau
The black-faced cripple was glaring at me as fixedly in the bows near the puma.,0.0,0.0,0.0,1.0,neutral,The island of Doctor Moreau
"There were three other men besides,--three strange brutish-looking fellows, at whom the staghounds were snarling savagely.",-0.6124,0.0,0.263,0.737,negative,The island of Doctor Moreau
"Montgomery, who was steering, brought the boat by me, and rising, caught and fastened my painter to the tiller to tow me, for there was no room aboard.",-0.2732,0.038,0.075,0.887,negative,The island of Doctor Moreau
"I had recovered from my hysterical phase by this time and answered his hail, as he approached, bravely enough.",0.5423,0.222,0.053,0.725,positive,The island of Doctor Moreau
"I told him the dingey was nearly swamped, and he reached me a piggin.",0.1027,0.113,0.0,0.887,positive,The island of Doctor Moreau
I was jerked back as the rope tightened between the boats.,-0.2023,0.0,0.167,0.833,negative,The island of Doctor Moreau
For some time I was busy baling.,0.0,0.0,0.0,1.0,neutral,The island of Doctor Moreau
It was not until I had got the water under (for the water in the dingey had been shipped; the boat was perfectly sound) that I had leisure to look at the people in the launch again.,0.6369,0.11,0.0,0.89,positive,The island of Doctor Moreau
"The white-haired man I found was still regarding me steadfastly, but with an expression, as I now fancied, of some perplexity.",0.0,0.0,0.0,1.0,neutral,The island of Doctor Moreau
"When my eyes met his, he looked down at the staghound that sat between his knees.",0.0,0.0,0.0,1.0,neutral,The island of Doctor Moreau
"He was a powerfully-built man, as I have said, with a fine forehead and rather heavy features; but his eyes had that odd drooping of the skin above the lids which often comes with advancing years, and the fall of his heavy mouth at the corners gave him an expression of pugnacious resolution.",-0.3716,0.027,0.056,0.917,negative,The island of Doctor Moreau
He talked to Montgomery in a tone too low for me to hear.,-0.2732,0.0,0.16,0.84,negative,The island of Doctor Moreau
From him my eyes travelled to his three men; and a strange crew they were.,-0.2023,0.0,0.122,0.878,negative,The island of Doctor Moreau
"I saw only their faces, yet there was something in their faces--I knew not what--that gave me a queer spasm of disgust.",-0.5994,0.0,0.17,0.83,negative,The island of Doctor Moreau
"I looked steadily at them, and the impression did not pass, though I failed to see what had occasioned it.",0.5577,0.223,0.0,0.777,positive,The island of Doctor Moreau
"They seemed to me then to be brown men; but their limbs were oddly swathed in some thin, dirty, white stuff down even to the fingers and feet: I have never seen men so wrapped up before, and women so only in the East.",-0.5927,0.0,0.084,0.916,negative,The island of Doctor Moreau
"They wore turbans too, and thereunder peered out their elfin faces at me,--faces with protruding lower-jaws and bright eyes.",0.4404,0.139,0.0,0.861,positive,The island of Doctor Moreau
"They had lank black hair, almost like horsehair, and seemed as they sat to exceed in stature any race of men I have seen.",0.2975,0.091,0.0,0.909,positive,The island of Doctor Moreau
"The white-haired man, who I knew was a good six feet in height, sat a head below any one of the three.",0.4404,0.139,0.0,0.861,positive,The island of Doctor Moreau
"I found afterwards that really none were taller than myself; but their bodies were abnormally long, and the thigh-part of the leg short and curiously twisted.",0.0,0.0,0.0,1.0,neutral,The island of Doctor Moreau
"At any rate, they were an amazingly ugly gang, and over the heads of them under the forward lug peered the black face of the man whose eyes were luminous in the dark.",-0.5563,0.0,0.101,0.899,negative,The island of Doctor Moreau
"As I stared at them, they met my gaze; and then first one and then another turned away from my direct stare, and looked at me in an odd, furtive manner.",-0.3182,0.0,0.073,0.927,negative,The island of Doctor Moreau
"It occurred to me that I was perhaps annoying them, and I turned my attention to the island we were approaching.",-0.4019,0.0,0.13,0.87,negative,The island of Doctor Moreau
"It was low, and covered with thick vegetation,--chiefly a kind of palm, that was new to me.",-0.2732,0.0,0.123,0.877,negative,The island of Doctor Moreau
"From one point a thin white thread of vapour rose slantingly to an immense height, and then frayed out like a down feather.",0.3612,0.111,0.0,0.889,positive,The island of Doctor Moreau
We were now within the embrace of a broad bay flanked on either hand by a low promontory.,0.5267,0.267,0.102,0.631,positive,The island of Doctor Moreau
"The beach was of dull-grey sand, and sloped steeply up to a ridge, perhaps sixty or seventy feet above the sea-level, and irregularly set with trees and undergrowth.",0.0,0.0,0.0,1.0,neutral,The island of Doctor Moreau
"Half way up was a square enclosure of some greyish stone, which I found subsequently was built partly of coral and partly of pumiceous lava.",0.0,0.0,0.0,1.0,neutral,The island of Doctor Moreau
Two thatched roofs peeped from within this enclosure.,0.0,0.0,0.0,1.0,neutral,The island of Doctor Moreau
A man stood awaiting us at the water's edge.,0.0,0.0,0.0,1.0,neutral,The island of Doctor Moreau
I fancied while we were still far off that I saw some other and very grotesque-looking creatures scuttle into the bushes upon the slope; but I saw nothing of these as we drew nearer.,0.0,0.0,0.0,1.0,neutral,The island of Doctor Moreau
"This man was of a moderate size, and with a black negroid face.",0.0,0.0,0.0,1.0,neutral,The island of Doctor Moreau
"He had a large, almost lipless, mouth, extraordinary lank arms, long thin feet, and bow-legs, and stood with his heavy face thrust forward staring at us.",0.0,0.0,0.0,1.0,neutral,The island of Doctor Moreau
"He was dressed like Montgomery and his white-haired companion, in jacket and trousers of blue serge.",0.3612,0.143,0.0,0.857,positive,The island of Doctor Moreau
"As we came still nearer, this individual began to run to and fro on the beach, making the most grotesque movements.",0.0,0.0,0.0,1.0,neutral,The island of Doctor Moreau
"At a word of command from Montgomery, the four men in the launch sprang up, and with singularly awkward gestures struck the lugs.",-0.3818,0.0,0.153,0.847,negative,The island of Doctor Moreau
Montgomery steered us round and into a narrow little dock excavated in the beach.,0.0,0.0,0.0,1.0,neutral,The island of Doctor Moreau
Then the man on the beach hastened towards us.,0.0,0.0,0.0,1.0,neutral,The island of Doctor Moreau
"This dock, as I call it, was really a mere ditch just long enough at this phase of the tide to take the longboat.",0.0,0.0,0.0,1.0,neutral,The island of Doctor Moreau
"I heard the bows ground in the sand, staved the dingey off the rudder of the big boat with my piggin, and freeing the painter, landed.",0.4767,0.114,0.0,0.886,positive,The island of Doctor Moreau
"The three muffled men, with the clumsiest movements, scrambled out upon the sand, and forthwith set to landing the cargo, assisted by the man on the beach.",0.0,0.0,0.0,1.0,neutral,The island of Doctor Moreau
"I was struck especially by the curious movements of the legs of the three swathed and bandaged boatmen,--not stiff they were, but distorted in some odd way, almost as if they were jointed in the wrong place.",-0.8852,0.04,0.27,0.69,negative,The island of Doctor Moreau
"The dogs were still snarling, and strained at their chains after these men, as the white-haired man landed with them.",-0.4019,0.0,0.124,0.876,negative,The island of Doctor Moreau
"The three big fellows spoke to one another in odd guttural tones, and the man who had waited for us on the beach began chattering to them excitedly--a foreign language, as I fancied--as they laid hands on some bales piled near the stern.",-0.3182,0.0,0.053,0.947,negative,The island of Doctor Moreau
"Somewhere I had heard such a voice before, and I could not think where.",0.0,0.0,0.0,1.0,neutral,The island of Doctor Moreau
"The white-haired man stood, holding in a tumult of six dogs, and bawling orders over their din.",0.0,0.0,0.0,1.0,neutral,The island of Doctor Moreau
"Montgomery, having unshipped the rudder, landed likewise, and all set to work at unloading.",0.0,0.0,0.0,1.0,neutral,The island of Doctor Moreau
"I was too faint, what with my long fast and the sun beating down on my bare head, to offer any assistance.",-0.4588,0.0,0.13,0.87,negative,The island of Doctor Moreau
"Presently the white-haired man seemed to recollect my presence, and came up to me.",0.0,0.0,0.0,1.0,neutral,The island of Doctor Moreau
"""You look,"" said he, ""as though you had scarcely breakfasted.""",0.0,0.0,0.0,1.0,neutral,The island of Doctor Moreau
His little eyes were a brilliant black under his heavy brows.,0.5478,0.282,0.0,0.718,positive,The island of Doctor Moreau
"""I must apologise for that.",0.3818,0.394,0.0,0.606,positive,The island of Doctor Moreau
"Now you are our guest, we must make you comfortable,--though you are uninvited, you know.""",0.0,0.0,0.0,1.0,neutral,The island of Doctor Moreau
He looked keenly into my face.,0.25,0.286,0.0,0.714,positive,The island of Doctor Moreau
"""Montgomery says you are an educated man, Mr. Prendick; says you know something of science.",0.0,0.0,0.0,1.0,neutral,The island of Doctor Moreau
"May I ask what that signifies?""",0.0,0.0,0.0,1.0,neutral,The island of Doctor Moreau
"I told him I had spent some years at the Royal College of Science, and had done some researches in biology under Huxley.",0.0,0.0,0.0,1.0,neutral,The island of Doctor Moreau
He raised his eyebrows slightly at that.,0.0,0.0,0.0,1.0,neutral,The island of Doctor Moreau
"""That alters the case a little, Mr. Prendick,"" he said, with a trifle more respect in his manner.",0.5256,0.184,0.0,0.816,positive,The island of Doctor Moreau
"""As it happens, we are biologists here.",0.0,0.0,0.0,1.0,neutral,The island of Doctor Moreau
"This is a biological station--of a sort.""",0.0,0.0,0.0,1.0,neutral,The island of Doctor Moreau
"His eye rested on the men in white who were busily hauling the puma, on rollers, towards the walled yard.",0.0,0.0,0.0,1.0,neutral,The island of Doctor Moreau
"""I and Montgomery, at least,"" he added.",0.0,0.0,0.0,1.0,neutral,The island of Doctor Moreau
"Then, ""When you will be able to get away, I can't say.",0.0,0.0,0.0,1.0,neutral,The island of Doctor Moreau
We're off the track to anywhere.,0.0,0.0,0.0,1.0,neutral,The island of Doctor Moreau
"We see a ship once in a twelve-month or so.""",0.0,0.0,0.0,1.0,neutral,The island of Doctor Moreau
"He left me abruptly, and went up the beach past this group, and I think entered the enclosure.",0.0,0.0,0.0,1.0,neutral,The island of Doctor Moreau
